{
  "capitulo": 2,
  "titulo": "Criação de Personagens",
  "tabelas": [
    {
      "cabecalhos": [
        "Classe",
        "Interesse",
        "Atributo Primário",
        "Complexidade"
      ],
      "dados": [
        {
          "Classe": "Bárbaro",
          "Interesse": "Combate",
          "Atributo Primário": "Força",
          "Complexidade": "Média"
        },
        {
          "Classe": "Bardo",
          "Interesse": "Atuação",
          "Atributo Primário": "Carisma",
          "Complexidade": "Alta"
        },
        {
          "Classe": "Bruxo",
          "Interesse": "Conhecimento obscuro",
          "Atributo Primário": "Carisma",
          "Complexidade": "Alta"
        },
        {
          "Classe": "Clérigo",
          "Interesse": "Deuses",
          "Atributo Primário": "Sabedoria",
          "Complexidade": "Média"
        },
        {
          "Classe": "Druida",
          "Interesse": "Natureza",
          "Atributo Primário": "Sabedoria",
          "Complexidade": "Alta"
        },
        {
          "Classe": "Feiticeiro",
          "Interesse": "Poder",
          "Atributo Primário": "Carisma",
          "Complexidade": "Alta"
        },
        {
          "Classe": "Guardião",
          "Interesse": "Sobrevivência",
          "Atributo Primário": "Destreza e Sabedoria",
          "Complexidade": "Média"
        },
        {
          "Classe": "Guerreiro",
          "Interesse": "Armas",
          "Atributo Primário": "Força ou Destreza",
          "Complexidade": "Baixa"
        },
        {
          "Classe": "Ladino",
          "Interesse": "Furtividade",
          "Atributo Primário": "Destreza",
          "Complexidade": "Baixa"
        },
        {
          "Classe": "Mago",
          "Interesse": "Livros de magia",
          "Atributo Primário": "Inteligência",
          "Complexidade": "Média"
        },
        {
          "Classe": "Monge",
          "Interesse": "Combate desarmado",
          "Atributo Primário": "Destreza e Sabedoria",
          "Complexidade": "Alta"
        },
        {
          "Classe": "Paladino",
          "Interesse": "Proteção",
          "Atributo Primário": "Força e Carisma",
          "Complexidade": "Média"
        }
      ]
    },
    {
      "cabecalhos": [
        "Atributo",
        "Antecedentes"
      ],
      "dados": [
        {
          "Atributo": "Força",
          "Antecedentes": "Artesão, Artista, Fazendeiro, Guarda, Marinheiro, Nobre, Soldado"
        },
        {
          "Atributo": "Destreza",
          "Antecedentes": "Andarilho, Artesão, Artista, Charlatão, Criminoso, Escriba, Guia, Marinheiro, Soldado"
        },
        {
          "Atributo": "Constituição",
          "Antecedentes": "Charlatão, Criminoso, Eremita, Fazendeiro, Guia, Mercador, Sábio, Soldado"
        },
        {
          "Atributo": "Inteligência",
          "Antecedentes": "Acólito, Artesão, Criminoso, Escriba, Guarda, Mercador, Nobre, Sábio"
        },
        {
          "Atributo": "Sabedoria",
          "Antecedentes": "Acólito, Andarilho, Eremita, Escriba, Fazendeiro, Guarda, Guia, Marinheiro, Sábio"
        },
        {
          "Atributo": "Carisma",
          "Antecedentes": "Acólito, Andarilho, Artista, Charlatão, Eremita, Mercador, Nobre"
        }
      ]
    },
    {
      "cabecalhos": [
        "1d12",
        "Idioma",
        "Origem"
      ],
      "dados": [
        {
          "1d12": "—",
          "Idioma": "Comum",
          "Origem": "Sigil"
        },
        {
          "1d12": "1",
          "Idioma": "Língua de Sinais Comum",
          "Origem": "Sigil"
        },
        {
          "1d12": "2",
          "Idioma": "Dracônico",
          "Origem": "Dragões"
        },
        {
          "1d12": "3–4",
          "Idioma": "Anão",
          "Origem": "Anões"
        },
        {
          "1d12": "5–6",
          "Idioma": "Élfico",
          "Origem": "Elfos"
        },
        {
          "1d12": "7",
          "Idioma": "Gigante",
          "Origem": "Gigantes"
        },
        {
          "1d12": "8",
          "Idioma": "Gnômico",
          "Origem": "Gnomos"
        },
        {
          "1d12": "9",
          "Idioma": "Goblin",
          "Origem": "Goblinoides"
        },
        {
          "1d12": "10–11",
          "Idioma": "Pequenino",
          "Origem": "Pequeninos"
        },
        {
          "1d12": "12",
          "Idioma": "Orc",
          "Origem": "Orcs"
        }
      ]
    },
    {
      "cabecalhos": [
        "Idioma",
        "Origem"
      ],
      "dados": [
        {
          "Idioma": "Abissal",
          "Origem": "Demônios do Abismo"
        },
        {
          "Idioma": "Celestial",
          "Origem": "Celestiais"
        },
        {
          "Idioma": "Dialeto Obscuro",
          "Origem": "Aberrações"
        },
        {
          "Idioma": "Druídico",
          "Origem": "Círculos druídicos"
        },
        {
          "Idioma": "Gíria dos Ladrões",
          "Origem": "Várias guildas criminosas"
        },
        {
          "Idioma": "Infernal",
          "Origem": "Diabos dos Nove Infernos"
        },
        {
          "Idioma": "Primordial\\*",
          "Origem": "Elementais"
        },
        {
          "Idioma": "Silvestre",
          "Origem": "A Faéria"
        },
        {
          "Idioma": "Subcomum",
          "Origem": "A Umbraeterna"
        }
      ]
    },
    {
      "cabecalhos": [
        "Valor",
        "Custo"
      ],
      "dados": [
        {
          "Valor": "8",
          "Custo": "0"
        },
        {
          "Valor": "9",
          "Custo": "1"
        },
        {
          "Valor": "10",
          "Custo": "2"
        },
        {
          "Valor": "11",
          "Custo": "3"
        },
        {
          "Valor": "12",
          "Custo": "4"
        },
        {
          "Valor": "13",
          "Custo": "5"
        },
        {
          "Valor": "14",
          "Custo": "7"
        },
        {
          "Valor": "15",
          "Custo": "9"
        }
      ]
    },
    {
      "cabecalhos": [
        "Conjunto Padrão por Classe",
        "For.",
        "Des.",
        "Con.",
        "Int.",
        "Sab.",
        "Car."
      ],
      "dados": [
        {
          "Conjunto Padrão por Classe": "Bárbaro",
          "For.": "15",
          "Des.": "13",
          "Con.": "14",
          "Int.": "10",
          "Sab.": "12",
          "Car.": "8"
        },
        {
          "Conjunto Padrão por Classe": "Bardo",
          "For.": "8",
          "Des.": "14",
          "Con.": "12",
          "Int.": "13",
          "Sab.": "10",
          "Car.": "15"
        },
        {
          "Conjunto Padrão por Classe": "Bruxo",
          "For.": "8",
          "Des.": "14",
          "Con.": "13",
          "Int.": "12",
          "Sab.": "10",
          "Car.": "15"
        },
        {
          "Conjunto Padrão por Classe": "Clérigo",
          "For.": "14",
          "Des.": "8",
          "Con.": "13",
          "Int.": "10",
          "Sab.": "15",
          "Car.": "12"
        },
        {
          "Conjunto Padrão por Classe": "Druida",
          "For.": "8",
          "Des.": "12",
          "Con.": "14",
          "Int.": "13",
          "Sab.": "15",
          "Car.": "10"
        },
        {
          "Conjunto Padrão por Classe": "Feiticeiro",
          "For.": "10",
          "Des.": "13",
          "Con.": "14",
          "Int.": "8",
          "Sab.": "12",
          "Car.": "15"
        },
        {
          "Conjunto Padrão por Classe": "Guardião",
          "For.": "12",
          "Des.": "15",
          "Con.": "13",
          "Int.": "8",
          "Sab.": "14",
          "Car.": "10"
        },
        {
          "Conjunto Padrão por Classe": "Guerreiro",
          "For.": "15",
          "Des.": "14",
          "Con.": "13",
          "Int.": "8",
          "Sab.": "10",
          "Car.": "12"
        },
        {
          "Conjunto Padrão por Classe": "Ladino",
          "For.": "12",
          "Des.": "15",
          "Con.": "13",
          "Int.": "14",
          "Sab.": "10",
          "Car.": "8"
        },
        {
          "Conjunto Padrão por Classe": "Mago",
          "For.": "8",
          "Des.": "12",
          "Con.": "13",
          "Int.": "15",
          "Sab.": "14",
          "Car.": "10"
        },
        {
          "Conjunto Padrão por Classe": "Monge",
          "For.": "12",
          "Des.": "15",
          "Con.": "13",
          "Int.": "10",
          "Sab.": "14",
          "Car.": "8"
        },
        {
          "Conjunto Padrão por Classe": "Paladino",
          "For.": "15",
          "Des.": "10",
          "Con.": "13",
          "Int.": "8",
          "Sab.": "12",
          "Car.": "14"
        }
      ]
    },
    {
      "cabecalhos": [
        "Valor",
        "Modificador"
      ],
      "dados": [
        {
          "Valor": "3",
          "Modificador": "-4"
        },
        {
          "Valor": "4–5",
          "Modificador": "-3"
        },
        {
          "Valor": "6–7",
          "Modificador": "-2"
        },
        {
          "Valor": "8–9",
          "Modificador": "-1"
        },
        {
          "Valor": "10–11",
          "Modificador": "+0"
        },
        {
          "Valor": "12–13",
          "Modificador": "+1"
        },
        {
          "Valor": "14–15",
          "Modificador": "+2"
        },
        {
          "Valor": "16–17",
          "Modificador": "+3"
        },
        {
          "Valor": "18–19",
          "Modificador": "+4"
        },
        {
          "Valor": "20",
          "Modificador": "+5"
        }
      ]
    },
    {
      "cabecalhos": [
        "1d4",
        "For. Alta",
        "1d4",
        "For. Baixa"
      ],
      "dados": [
        {
          "1d4": "1",
          "For. Alta": "Musculoso",
          "For. Baixa": "Fraco"
        },
        {
          "1d4": "2",
          "For. Alta": "Robusto",
          "For. Baixa": "Magro"
        },
        {
          "1d4": "3",
          "For. Alta": "Protetor",
          "For. Baixa": "Autoconsciente"
        },
        {
          "1d4": "4",
          "For. Alta": "Direto",
          "For. Baixa": "Indireto"
        }
      ]
    },
    {
      "cabecalhos": [
        "1d4",
        "Des. Alta",
        "1d4",
        "Des. Baixa"
      ],
      "dados": [
        {
          "1d4": "1",
          "Des. Alta": "Ágil",
          "Des. Baixa": "Atrapalhado"
        },
        {
          "1d4": "2",
          "Des. Alta": "Dinâmico",
          "Des. Baixa": "Desajeitado"
        },
        {
          "1d4": "3",
          "Des. Alta": "Inquieto",
          "Des. Baixa": "Hesitante"
        },
        {
          "1d4": "4",
          "Des. Alta": "Equilibrado",
          "Des. Baixa": "Instável"
        }
      ]
    },
    {
      "cabecalhos": [
        "1d4",
        "Con. Alta",
        "1d4",
        "Con. Baixa"
      ],
      "dados": [
        {
          "1d4": "1",
          "Con. Alta": "Energético",
          "Con. Baixa": "Débil"
        },
        {
          "1d4": "2",
          "Con. Alta": "Vigoroso",
          "Con. Baixa": "Sensível"
        },
        {
          "1d4": "3",
          "Con. Alta": "Saudável",
          "Con. Baixa": "Letárgico"
        },
        {
          "1d4": "4",
          "Con. Alta": "Estável",
          "Con. Baixa": "Frágil"
        }
      ]
    },
    {
      "cabecalhos": [
        "1d4",
        "Int. Alta",
        "1d4",
        "Int. Baixa"
      ],
      "dados": [
        {
          "1d4": "1",
          "Int. Alta": "Decidido",
          "Int. Baixa": "Inapto"
        },
        {
          "1d4": "2",
          "Int. Alta": "Lógico",
          "Int. Baixa": "Ilógico"
        },
        {
          "1d4": "3",
          "Int. Alta": "Informado",
          "Int. Baixa": "Desinformado"
        },
        {
          "1d4": "4",
          "Int. Alta": "Curioso",
          "Int. Baixa": "Fútil"
        }
      ]
    },
    {
      "cabecalhos": [
        "1d4",
        "Sab. Alta",
        "1d4",
        "Sab. Baixa"
      ],
      "dados": [
        {
          "1d4": "1",
          "Sab. Alta": "Sereno",
          "Sab. Baixa": "Impulsivo"
        },
        {
          "1d4": "2",
          "Sab. Alta": "Atento",
          "Sab. Baixa": "Distraído"
        },
        {
          "1d4": "3",
          "Sab. Alta": "Observador",
          "Sab. Baixa": "Alheio"
        },
        {
          "1d4": "4",
          "Sab. Alta": "Vigilante",
          "Sab. Baixa": "Ingênuo"
        }
      ]
    },
    {
      "cabecalhos": [
        "1d4",
        "Car. Alto",
        "1d4",
        "Car. Baixo"
      ],
      "dados": [
        {
          "1d4": "1",
          "Car. Alto": "Encantador",
          "Car. Baixo": "Pedante"
        },
        {
          "1d4": "2",
          "Car. Alto": "Imponente",
          "Car. Baixo": "Carrancudo"
        },
        {
          "1d4": "3",
          "Car. Alto": "Engraçado",
          "Car. Baixo": "Reservado"
        },
        {
          "1d4": "4",
          "Car. Alto": "Inspirador",
          "Car. Baixo": "Indelicado"
        }
      ]
    },
    {
      "cabecalhos": [
        "Alinhamento",
        "1d4",
        "Traço Associado"
      ],
      "dados": [
        {
          "Alinhamento": "Bom",
          "1d4": "1",
          "Traço Associado": "Compassivo"
        },
        {
          "Alinhamento": "2",
          "1d4": "Prestativo",
          "Traço Associado": ""
        },
        {
          "Alinhamento": "3",
          "1d4": "Honesto",
          "Traço Associado": ""
        },
        {
          "Alinhamento": "4",
          "1d4": "Gentil",
          "Traço Associado": ""
        },
        {
          "Alinhamento": "Caótico",
          "1d4": "1",
          "Traço Associado": "Orgulhoso"
        },
        {
          "Alinhamento": "2",
          "1d4": "Impulsivo",
          "Traço Associado": ""
        },
        {
          "Alinhamento": "3",
          "1d4": "Rebelde",
          "Traço Associado": ""
        },
        {
          "Alinhamento": "4",
          "1d4": "Egocêntrico",
          "Traço Associado": ""
        },
        {
          "Alinhamento": "Mau",
          "1d4": "1",
          "Traço Associado": "Desonesto"
        },
        {
          "Alinhamento": "2",
          "1d4": "Vingativo",
          "Traço Associado": ""
        },
        {
          "Alinhamento": "3",
          "1d4": "Cruel",
          "Traço Associado": ""
        },
        {
          "Alinhamento": "4",
          "1d4": "Ganancioso",
          "Traço Associado": ""
        },
        {
          "Alinhamento": "Neutro",
          "1d4": "1",
          "Traço Associado": "Egoísta"
        },
        {
          "Alinhamento": "2",
          "1d4": "Desinteressado",
          "Traço Associado": ""
        },
        {
          "Alinhamento": "3",
          "1d4": "Lacônico",
          "Traço Associado": ""
        },
        {
          "Alinhamento": "4",
          "1d4": "Pragmático",
          "Traço Associado": ""
        },
        {
          "Alinhamento": "Ordeiro",
          "1d4": "1",
          "Traço Associado": "Cooperativo"
        },
        {
          "Alinhamento": "2",
          "1d4": "Leal",
          "Traço Associado": ""
        },
        {
          "Alinhamento": "3",
          "1d4": "Julgador",
          "Traço Associado": ""
        },
        {
          "Alinhamento": "4",
          "1d4": "Metódico",
          "Traço Associado": ""
        }
      ]
    },
    {
      "cabecalhos": [
        "Classe",
        "Pontos de Vida Máximos"
      ],
      "dados": [
        {
          "Classe": "Bárbaro",
          "Pontos de Vida Máximos": "12 + mod. de Constituição"
        },
        {
          "Classe": "Guardião, Guerreiro ou Paladino",
          "Pontos de Vida Máximos": "10 + mod. de Constituição"
        },
        {
          "Classe": "Bardo, Bruxo, Clérigo, Druida, Ladino ou Monge",
          "Pontos de Vida Máximos": "8 + mod. de Constituição"
        },
        {
          "Classe": "Feiticeiro ou Mago",
          "Pontos de Vida Máximos": "6 + mod. de Constituição"
        }
      ]
    },
    {
      "cabecalhos": [
        "Nível",
        "Pontos de Experiência",
        "Bônus de Proficiência"
      ],
      "dados": [
        {
          "Nível": "1",
          "Pontos de Experiência": "0",
          "Bônus de Proficiência": "+2"
        },
        {
          "Nível": "2",
          "Pontos de Experiência": "300",
          "Bônus de Proficiência": "+2"
        },
        {
          "Nível": "3",
          "Pontos de Experiência": "900",
          "Bônus de Proficiência": "+2"
        },
        {
          "Nível": "4",
          "Pontos de Experiência": "2.700",
          "Bônus de Proficiência": "+2"
        },
        {
          "Nível": "5",
          "Pontos de Experiência": "6.500",
          "Bônus de Proficiência": "+3"
        },
        {
          "Nível": "6",
          "Pontos de Experiência": "14.000",
          "Bônus de Proficiência": "+3"
        },
        {
          "Nível": "7",
          "Pontos de Experiência": "23.000",
          "Bônus de Proficiência": "+3"
        },
        {
          "Nível": "8",
          "Pontos de Experiência": "34.000",
          "Bônus de Proficiência": "+3"
        },
        {
          "Nível": "9",
          "Pontos de Experiência": "48.000",
          "Bônus de Proficiência": "+4"
        },
        {
          "Nível": "10",
          "Pontos de Experiência": "64.000",
          "Bônus de Proficiência": "+4"
        },
        {
          "Nível": "11",
          "Pontos de Experiência": "85.000",
          "Bônus de Proficiência": "+4"
        },
        {
          "Nível": "12",
          "Pontos de Experiência": "100.000",
          "Bônus de Proficiência": "+4"
        },
        {
          "Nível": "13",
          "Pontos de Experiência": "120.000",
          "Bônus de Proficiência": "+5"
        },
        {
          "Nível": "14",
          "Pontos de Experiência": "140.000",
          "Bônus de Proficiência": "+5"
        },
        {
          "Nível": "15",
          "Pontos de Experiência": "165.000",
          "Bônus de Proficiência": "+5"
        },
        {
          "Nível": "16",
          "Pontos de Experiência": "195.000",
          "Bônus de Proficiência": "+5"
        },
        {
          "Nível": "17",
          "Pontos de Experiência": "225.000",
          "Bônus de Proficiência": "+6"
        },
        {
          "Nível": "18",
          "Pontos de Experiência": "265.000",
          "Bônus de Proficiência": "+6"
        },
        {
          "Nível": "19",
          "Pontos de Experiência": "305.000",
          "Bônus de Proficiência": "+6"
        },
        {
          "Nível": "20",
          "Pontos de Experiência": "355.000",
          "Bônus de Proficiência": "+6"
        }
      ]
    },
    {
      "cabecalhos": [
        "Classe",
        "Pontos de Vida por Nível"
      ],
      "dados": [
        {
          "Classe": "Bárbaro",
          "Pontos de Vida por Nível": "7 + mod. de Constituição"
        },
        {
          "Classe": "Guardião, Guerreiro, Paladino",
          "Pontos de Vida por Nível": "6 + mod. de Constituição"
        },
        {
          "Classe": "Bardo, Bruxo, Clérigo, Druida, Ladino ou Monge",
          "Pontos de Vida por Nível": "5 + mod. de Constituição"
        },
        {
          "Classe": "Feiticeiro ou Mago",
          "Pontos de Vida por Nível": "4 + mod. de Constituição"
        }
      ]
    },
    {
      "cabecalhos": [
        "Nível Inicial",
        "Equipamento e Dinheiro",
        "Itens Mágicos"
      ],
      "dados": [
        {
          "Nível Inicial": "2–4",
          "Equipamento e Dinheiro": "Equipamento Inicial Normal",
          "Itens Mágicos": "1 Comum"
        },
        {
          "Nível Inicial": "5–10",
          "Equipamento e Dinheiro": "500 PO mais 1d10 × 25 PO mais equipamento inicial normal",
          "Itens Mágicos": "1 Comum, 1 Incomum"
        },
        {
          "Nível Inicial": "11–16",
          "Equipamento e Dinheiro": "5.000 PO mais 1d10 × 250 PO mais equipamento inicial normal",
          "Itens Mágicos": "2 Comum, 3 Incomum, 1 Raro"
        },
        {
          "Nível Inicial": "17–20",
          "Equipamento e Dinheiro": "20.000 PO mais 1d10 × 250 PO mais equipamento inicial normal",
          "Itens Mágicos": "2 Comum, 4 Incomum, 3 Raro, 1 Muito Raro"
        }
      ]
    },
    {
      "cabecalhos": [
        "Nível",
        "1",
        "2",
        "3",
        "4",
        "5",
        "6",
        "7",
        "8",
        "9"
      ],
      "dados": [
        {
          "Nível": "1",
          "1": "2",
          "2": "—",
          "3": "—",
          "4": "—",
          "5": "—",
          "6": "—",
          "7": "—",
          "8": "—",
          "9": "—"
        },
        {
          "Nível": "2",
          "1": "3",
          "2": "—",
          "3": "—",
          "4": "—",
          "5": "—",
          "6": "—",
          "7": "—",
          "8": "—",
          "9": "—"
        },
        {
          "Nível": "3",
          "1": "4",
          "2": "2",
          "3": "—",
          "4": "—",
          "5": "—",
          "6": "—",
          "7": "—",
          "8": "—",
          "9": "—"
        },
        {
          "Nível": "4",
          "1": "4",
          "2": "3",
          "3": "—",
          "4": "—",
          "5": "—",
          "6": "—",
          "7": "—",
          "8": "—",
          "9": "—"
        },
        {
          "Nível": "5",
          "1": "4",
          "2": "3",
          "3": "2",
          "4": "—",
          "5": "—",
          "6": "—",
          "7": "—",
          "8": "—",
          "9": "—"
        },
        {
          "Nível": "6",
          "1": "4",
          "2": "3",
          "3": "3",
          "4": "—",
          "5": "—",
          "6": "—",
          "7": "—",
          "8": "—",
          "9": "—"
        },
        {
          "Nível": "7",
          "1": "4",
          "2": "3",
          "3": "3",
          "4": "1",
          "5": "—",
          "6": "—",
          "7": "—",
          "8": "—",
          "9": "—"
        },
        {
          "Nível": "8",
          "1": "4",
          "2": "3",
          "3": "3",
          "4": "2",
          "5": "—",
          "6": "—",
          "7": "—",
          "8": "—",
          "9": "—"
        },
        {
          "Nível": "9",
          "1": "4",
          "2": "3",
          "3": "3",
          "4": "3",
          "5": "1",
          "6": "—",
          "7": "—",
          "8": "—",
          "9": "—"
        },
        {
          "Nível": "10",
          "1": "4",
          "2": "3",
          "3": "3",
          "4": "3",
          "5": "2",
          "6": "—",
          "7": "—",
          "8": "—",
          "9": "—"
        },
        {
          "Nível": "11",
          "1": "4",
          "2": "3",
          "3": "3",
          "4": "3",
          "5": "2",
          "6": "1",
          "7": "—",
          "8": "—",
          "9": "—"
        },
        {
          "Nível": "12",
          "1": "4",
          "2": "3",
          "3": "3",
          "4": "3",
          "5": "2",
          "6": "1",
          "7": "—",
          "8": "—",
          "9": "—"
        },
        {
          "Nível": "13",
          "1": "4",
          "2": "3",
          "3": "3",
          "4": "3",
          "5": "2",
          "6": "1",
          "7": "1",
          "8": "—",
          "9": "—"
        },
        {
          "Nível": "14",
          "1": "4",
          "2": "3",
          "3": "3",
          "4": "3",
          "5": "2",
          "6": "1",
          "7": "1",
          "8": "—",
          "9": "—"
        },
        {
          "Nível": "15",
          "1": "4",
          "2": "3",
          "3": "3",
          "4": "3",
          "5": "2",
          "6": "1",
          "7": "1",
          "8": "1",
          "9": "—"
        },
        {
          "Nível": "16",
          "1": "4",
          "2": "3",
          "3": "3",
          "4": "3",
          "5": "2",
          "6": "1",
          "7": "1",
          "8": "1",
          "9": "—"
        },
        {
          "Nível": "17",
          "1": "4",
          "2": "3",
          "3": "3",
          "4": "3",
          "5": "2",
          "6": "1",
          "7": "1",
          "8": "1",
          "9": "1"
        },
        {
          "Nível": "18",
          "1": "4",
          "2": "3",
          "3": "3",
          "4": "3",
          "5": "3",
          "6": "1",
          "7": "1",
          "8": "1",
          "9": "1"
        },
        {
          "Nível": "19",
          "1": "4",
          "2": "3",
          "3": "3",
          "4": "3",
          "5": "3",
          "6": "2",
          "7": "1",
          "8": "1",
          "9": "1"
        },
        {
          "Nível": "20",
          "1": "4",
          "2": "3",
          "3": "3",
          "4": "3",
          "5": "3",
          "6": "2",
          "7": "2",
          "8": "1",
          "9": "1"
        }
      ]
    },
    {
      "cabecalhos": [
        "1d100",
        "Bugigangas"
      ],
      "dados": [
        {
          "1d100": "01",
          "Bugigangas": "Uma mão de goblin mumificada"
        },
        {
          "1d100": "02",
          "Bugigangas": "Um cristal que brilha levemente ao luar"
        },
        {
          "1d100": "03",
          "Bugigangas": "Uma moeda de ouro cunhada em uma terra desconhecida"
        },
        {
          "1d100": "04",
          "Bugigangas": "Um diário escrito em um idioma que você não conhece"
        },
        {
          "1d100": "05",
          "Bugigangas": "Um anel de latão que nunca mancha"
        },
        {
          "1d100": "06",
          "Bugigangas": "Uma antiga peça de xadrez feita de vidro"
        },
        {
          "1d100": "07",
          "Bugigangas": "Um par de dados feitos de ossos de articulação, cada um com o símbolo de um crânio na face que normalmente mostraria seis pontos"
        },
        {
          "1d100": "08",
          "Bugigangas": "Um pequeno ídolo que representa uma criatura aterradora e lhe causa sonhos inquietantes quando você dorme perto dele"
        },
        {
          "1d100": "09",
          "Bugigangas": "Uma mecha de cabelo de alguém"
        },
        {
          "1d100": "10",
          "Bugigangas": "A escritura de um terreno em um reino desconhecido por você"
        },
        {
          "1d100": "11",
          "Bugigangas": "Um bloco pesando 30 gramas produzido de material desconhecido"
        },
        {
          "1d100": "12",
          "Bugigangas": "Uma pequena boneca de tecido espetada com agulhas"
        },
        {
          "1d100": "13",
          "Bugigangas": "Um dente de uma fera desconhecida"
        },
        {
          "1d100": "14",
          "Bugigangas": "Uma escama enorme, talvez de um dragão"
        },
        {
          "1d100": "15",
          "Bugigangas": "Uma pena verde brilhante"
        },
        {
          "1d100": "16",
          "Bugigangas": "Uma antiga carta de adivinhação com imagens semelhantes a você"
        },
        {
          "1d100": "17",
          "Bugigangas": "Um orbe de vidro cheio de fumaça se movimentando"
        },
        {
          "1d100": "18",
          "Bugigangas": "Um ovo com uma casca vermelha e brilhante, pesando 500 gramas"
        },
        {
          "1d100": "19",
          "Bugigangas": "Um tubo que sopra bolhas"
        },
        {
          "1d100": "20",
          "Bugigangas": "Um frasco de vidro contendo um pouco de carne flutuando no fluido de decapagem"
        },
        {
          "1d100": "21",
          "Bugigangas": "Uma caixa de música feita por gnomos que toca uma música que você lembra vagamente da sua infância"
        },
        {
          "1d100": "22",
          "Bugigangas": "Uma estatueta de madeira de um pequenino orgulhoso"
        },
        {
          "1d100": "23",
          "Bugigangas": "Um orbe de bronze com runas estranhas gravadas"
        },
        {
          "1d100": "24",
          "Bugigangas": "Um disco de pedra multicolorido"
        },
        {
          "1d100": "25",
          "Bugigangas": "Um ícone de um corvo prateado"
        },
        {
          "1d100": "26",
          "Bugigangas": "Uma bolsa contendo quarenta e sete dentes, um dos quais está podre"
        },
        {
          "1d100": "27",
          "Bugigangas": "Uma lasca de obsidiana que, quando tocada, provoca sensação de calor"
        },
        {
          "1d100": "28",
          "Bugigangas": "Uma garra de dragão amarrada em um cordão de couro"
        },
        {
          "1d100": "29",
          "Bugigangas": "Um par de meias velhas"
        },
        {
          "1d100": "30",
          "Bugigangas": "Um livro em branco cujas páginas se recusam ter tinta, giz, grafite ou qualquer outra marcação gravada"
        },
        {
          "1d100": "31",
          "Bugigangas": "Um emblema de prata de uma estrela de cinco pontas"
        },
        {
          "1d100": "32",
          "Bugigangas": "Uma faca que pertencia a um parente"
        },
        {
          "1d100": "33",
          "Bugigangas": "Um frasco de vidro cheio de pedaços de unhas"
        },
        {
          "1d100": "34",
          "Bugigangas": "Um dispositivo de metal retangular com dois minúsculos copos de metal em uma extremidade que lança faíscas quando molhado"
        },
        {
          "1d100": "35",
          "Bugigangas": "Uma luva branca, com adornos, projetada para um ser humano"
        },
        {
          "1d100": "36",
          "Bugigangas": "Um colete com cem bolsos minúsculos"
        },
        {
          "1d100": "37",
          "Bugigangas": "Uma pedra sem peso"
        },
        {
          "1d100": "38",
          "Bugigangas": "Um rascunho desenhado de um goblin"
        },
        {
          "1d100": "39",
          "Bugigangas": "Um frasco de vidro vazio que cheira a perfume"
        },
        {
          "1d100": "40",
          "Bugigangas": "Uma pedra preciosa que se parece com um pedaço de carvão quando examinada por alguém que não seja você"
        },
        {
          "1d100": "41",
          "Bugigangas": "Um pedaço de pano de uma bandeira velha"
        },
        {
          "1d100": "42",
          "Bugigangas": "Uma insígnia de patente de um legionário perdido"
        },
        {
          "1d100": "43",
          "Bugigangas": "Um sino de prata sem badalo"
        },
        {
          "1d100": "44",
          "Bugigangas": "Um canário mecânico dentro de uma lâmpada"
        },
        {
          "1d100": "45",
          "Bugigangas": "Um baú em miniatura esculpido para parecer que tem vários pés na parte inferior"
        },
        {
          "1d100": "46",
          "Bugigangas": "Um sprite morto dentro de uma garrafa de vidro transparente"
        },
        {
          "1d100": "47",
          "Bugigangas": "Uma lata de metal que não tem abertura, mas soa como se estivesse cheia de líquido, areia, aranhas ou vidro quebrado (à sua escolha)"
        },
        {
          "1d100": "48",
          "Bugigangas": "Um orbe de vidro cheio de água, no qual um peixinho dourado mecânico fica nadando"
        },
        {
          "1d100": "49",
          "Bugigangas": "Uma colher de prata com um M gravado na pega"
        },
        {
          "1d100": "50",
          "Bugigangas": "Um apito feito de madeira dourada"
        },
        {
          "1d100": "51",
          "Bugigangas": "Um escaravelho morto do tamanho da sua mão"
        },
        {
          "1d100": "52",
          "Bugigangas": "Dois soldados de brinquedo, um sem cabeça"
        },
        {
          "1d100": "53",
          "Bugigangas": "Uma pequena caixa cheia de botões de diferentes tamanhos"
        },
        {
          "1d100": "54",
          "Bugigangas": "Uma vela que não pode ser acesa"
        },
        {
          "1d100": "55",
          "Bugigangas": "Uma gaiola em miniatura sem porta"
        },
        {
          "1d100": "56",
          "Bugigangas": "Uma chave antiga"
        },
        {
          "1d100": "57",
          "Bugigangas": "Um mapa de tesouro indecifrável"
        },
        {
          "1d100": "58",
          "Bugigangas": "Uma empunhadura de uma espada quebrada"
        },
        {
          "1d100": "59",
          "Bugigangas": "Uma pata de coelho"
        },
        {
          "1d100": "60",
          "Bugigangas": "Um olho de vidro"
        },
        {
          "1d100": "61",
          "Bugigangas": "Uma breve aparição de uma pessoa de aparência desagradável"
        },
        {
          "1d100": "62",
          "Bugigangas": "Um crânio de prata do tamanho de uma moeda"
        },
        {
          "1d100": "63",
          "Bugigangas": "Uma máscara de alabastro"
        },
        {
          "1d100": "64",
          "Bugigangas": "Um cone de incenso-preto, pegajoso, que fede"
        },
        {
          "1d100": "65",
          "Bugigangas": "Um gorro de dormir que te dá sonhos agradáveis quando você o usa"
        },
        {
          "1d100": "66",
          "Bugigangas": "Um único estrepe produzido de osso"
        },
        {
          "1d100": "67",
          "Bugigangas": "Uma armação dourada de um monóculo sem a lente"
        },
        {
          "1d100": "68",
          "Bugigangas": "Um cubo de 2,5 centímetros, cada lado com uma cor diferente"
        },
        {
          "1d100": "69",
          "Bugigangas": "Uma maçaneta de cristal"
        },
        {
          "1d100": "70",
          "Bugigangas": "Um pacote cheio de pó rosa"
        },
        {
          "1d100": "71",
          "Bugigangas": "Um fragmento de uma bela canção, escrita como notas musicais em dois pedaços de pergaminho"
        },
        {
          "1d100": "72",
          "Bugigangas": "Um brinco prateado em formato de lágrima produzido de uma lágrima verdadeira"
        },
        {
          "1d100": "73",
          "Bugigangas": "Uma casca de ovo pintada com cenas de desgraça em detalhes perturbadores"
        },
        {
          "1d100": "74",
          "Bugigangas": "Um leque que, quando desdobrado, mostra um gato dormindo"
        },
        {
          "1d100": "75",
          "Bugigangas": "Um conjunto de tubos produzidos com osso"
        },
        {
          "1d100": "76",
          "Bugigangas": "Um trevo-de-quatro-folhas pressionado dentro de um livro sobre boas maneiras e etiqueta"
        },
        {
          "1d100": "77",
          "Bugigangas": "Uma folha de pergaminho sobre a qual é desenhada uma engenhoca mecânica"
        },
        {
          "1d100": "78",
          "Bugigangas": "Uma bainha ornamentada que não cabe em nenhuma lâmina que você tenha encontrado"
        },
        {
          "1d100": "79",
          "Bugigangas": "Um convite para uma festa onde aconteceu um assassinato"
        },
        {
          "1d100": "80",
          "Bugigangas": "Um pentagrama de bronze com uma gravura da cabeça de um rato em seu centro"
        },
        {
          "1d100": "81",
          "Bugigangas": "Um lenço roxo bordado com o nome de um arquimago"
        },
        {
          "1d100": "82",
          "Bugigangas": "Metade de uma planta baixa de um templo, um castelo ou outra estrutura"
        },
        {
          "1d100": "83",
          "Bugigangas": "Um pedaço de pano dobrado que, quando desdobrado, se transforma em um chapéu elegante"
        },
        {
          "1d100": "84",
          "Bugigangas": "Um recibo de depósito em um banco em uma cidade distante"
        },
        {
          "1d100": "85",
          "Bugigangas": "Um diário com sete páginas faltando"
        },
        {
          "1d100": "86",
          "Bugigangas": "Uma caixa prateada de tabaco vazia com a inscrição \"sonhos\" na tampa"
        },
        {
          "1d100": "87",
          "Bugigangas": "Um símbolo sagrado de ferro dedicado a um deus desconhecido"
        },
        {
          "1d100": "88",
          "Bugigangas": "Um livro sobre a ascensão e queda de um herói lendário, com o último capítulo faltando"
        },
        {
          "1d100": "89",
          "Bugigangas": "Um frasco com sangue de dragão"
        },
        {
          "1d100": "90",
          "Bugigangas": "Uma flecha antiga de estilo élfico"
        },
        {
          "1d100": "91",
          "Bugigangas": "Uma agulha que nunca entorta"
        },
        {
          "1d100": "92",
          "Bugigangas": "Um broche ornamentado de estilo anão"
        },
        {
          "1d100": "93",
          "Bugigangas": "Uma garrafa de vinho vazia com um rótulo bonito que diz: \"Vinícola O Mago dos Vinhos e Vinhais, Engasga-gato do Dragão Vermelho, 331422-W\""
        },
        {
          "1d100": "94",
          "Bugigangas": "Um mosaico com uma superfície em vidro multicolorido"
        },
        {
          "1d100": "95",
          "Bugigangas": "Um rato petrificado"
        },
        {
          "1d100": "96",
          "Bugigangas": "Uma bandeira pirata negra, adornada com uma caveira de dragão e ossos cruzados"
        },
        {
          "1d100": "97",
          "Bugigangas": "Um minúsculo caranguejo ou aranha mecânicos que se move quando não está sendo observado"
        },
        {
          "1d100": "98",
          "Bugigangas": "Um frasco de vidro contendo banha com uma etiqueta que diz: \"Graxa de Grifo\""
        },
        {
          "1d100": "99",
          "Bugigangas": "Uma caixa de madeira com um fundo de cerâmica que contém uma minhoca viva com uma cabeça em cada extremidade do corpo"
        },
        {
          "1d100": "00",
          "Bugigangas": "Uma urna de metal contendo as cinzas de um herói"
        }
      ]
    }
  ],
  "texto_completo": "Capítulo 2 - Criação de Personagens\n\nVocê pode criar um personagem para **Dungeons & Dragons** usando os blocos de construção deste livro. Seu personagem é uma combinação de estatísticas de jogo, ganchos de interpretação e sua imaginação. Você escolhe uma classe (como Guerreiro ou Mago), um antecedente (como Acólito ou Marinheiro) e uma espécie (como Elfo ou Humano). Você também cria a personalidade e a aparência do seu personagem. Uma vez completado, seu personagem serve como seu avatar no multiverso de D&D.\n\n# Preparando-se\n\nAntes de iniciar a criação do personagem, existem algumas etapas a serem seguidas para se preparar, conforme explicado abaixo.\n\n## Converse com seu Mestre\n\nComece conversando com o seu Mestre sobre o tipo de jogo de D&D que ele planeja conduzir. Se o Mestre se inspira na mitologia grega, por exemplo, você pode escolher uma direção diferente para o seu personagem ao invés do que escolheria se o Mestre estivesse planejando uma aventura de piratas nos mares. Pense no tipo de aventureiro que você quer interpretar neste jogo. Se não souber por onde começar, dê uma olhada nas ilustrações de personagens deste livro para se inspirar.\n\n## Escolha uma Ficha de Personagem\n\nVocê registra os principais detalhes de seu personagem em uma ficha de personagem. Neste capítulo, utilizamos o termo “ficha de personagem” para nos referirmos a qualquer meio que você use para acompanhar os detalhes do seu personagem, seja uma ficha impressa (como a apresentada nas páginas seguintes), uma ficha digital como a do D&D Beyond, ou até mesmo uma folha de papel comum. Escolha o estilo de ficha que preferir e comece a criar seu personagem!\n\n**Sessão Zero**\n\nAlguns Mestres iniciam uma campanha com uma “sessão zero”, uma reunião inicial focada na criação de personagens e no estabelecimento de expectativas, incluindo tópicos a serem evitados, bem como aqueles a serem abordados. Uma sessão zero oferece uma ótima oportunidade para conversar com os outros jogadores e com o Mestre, além de decidir se os personagens já se conhecem, como se encontraram e que tipo de missões o grupo pode realizar juntos.\n\nCriando Seu Personagem\n\nAqui estão os passos para criar um personagem; cada etapa é explorada em detalhes neste capítulo:\n\n**Escolha uma Classe**: Todo aventureiro pertence a uma classe. Uma classe descreve amplamente a vocação, os talentos especiais e as táticas preferidas do personagem.\n\n**Determine a Origem**: A origem de um personagem inclui dois elementos: antecedente e espécie. Como o personagem passou os anos antes de se tornar um aventureiro? Quem são seus ancestrais? Você também pode escolher os idiomas do seu personagem.\n\n**Determine os Valores de Atributos.** Muito do que seu personagem faz no jogo depende de seus seis atributos.\n\n**Escolha um Alinhamento**: O alinhamento é uma forma abreviada de representar a bússola moral do seu personagem.\n\n**Preencha os Detalhes**: Usando as escolhas que você fez, preencha os detalhes restantes na ficha de personagem.\n\nNa ficha de personagem nas páginas a seguir, muitos espaços estão rotulados com um número que corresponde a um desses passos.\n\n## Passo 1: Escolha uma Classe\n\nEscolha uma classe e anote-a na ficha de personagem. A tabela Visão Geral das Classes fornece um resumo delas. Veja o capítulo 3 para detalhes.\n\n**Visão Geral das Classes**\n\n| **Classe** | **Interesse**        | **Atributo Primário** | **Complexidade** |\n|------------|----------------------|-----------------------|------------------|\n| Bárbaro    | Combate              | Força                 | Média            |\n| Bardo      | Atuação              | Carisma               | Alta             |\n| Bruxo      | Conhecimento obscuro | Carisma               | Alta             |\n| Clérigo    | Deuses               | Sabedoria             | Média            |\n| Druida     | Natureza             | Sabedoria             | Alta             |\n| Feiticeiro | Poder                | Carisma               | Alta             |\n| Guardião   | Sobrevivência        | Destreza e Sabedoria  | Média            |\n| Guerreiro  | Armas                | Força ou Destreza     | Baixa            |\n| Ladino     | Furtividade          | Destreza              | Baixa            |\n| Mago       | Livros de magia      | Inteligência          | Média            |\n| Monge      | Combate desarmado    | Destreza e Sabedoria  | Alta             |\n| Paladino   | Proteção             | Força e Carisma       | Média            |\n\n**Um Grupo Equilibrado**\n\nO grupo clássico de D&D é composto por um Clérigo, um Guerreiro, um Ladino e um Mago. Essas quatro Classes, as mais antigas do jogo, proporcionam uma combinação equilibrada de habilidades para as aventuras. Você pode utilizar essa formação ou adaptá-la de acordo com estas diretrizes:\n\n-   **Clérigo.** Substituir por um Bardo ou Druida\n-   **Guerreiro.** Substituir por um Bárbaro, Guardião, Monge ou Paladino\n-   **Ladino.** Substituir por um Bardo ou Guardião\n-   **Mago.** Substituir por um Bardo, Bruxo ou Feiticeiro\n\n### Anote Seu Nível\n\nAnote o nível do seu personagem na ficha. Normalmente, um personagem começa no nível 1 e sobe de nível ao aventurar-se e obter Pontos de Experiência (XP).\n\n**Anote seu XP.** Além disso, anote seus Pontos de Experiência. Um personagem no nível 1 tem 0 XP.\n\n**Iniciando em um Nível Mais Alto.** Seu Mestre pode optar por iniciar em um nível mais alto. Se começar no nível 3 ou superior, anote a subclasse escolhida na sua ficha de personagem. Veja a seção “Começando em Níveis Mais Altos” mais adiante no capítulo para mais informações.\n\n### Anote seu Treinamento com Armadura\n\nSua classe pode oferecer treinamento em determinadas categorias de armadura. Registre seu treinamento com armaduras na ficha de personagem. O treinamento em um tipo de armadura significa que você pode utilizá-la de forma eficaz, recebendo bônus defensivos. As categorias de armadura estão descritas no capítulo 6.\n\n### Tenha Ela em Mente\n\nMais adiante, você incluirá mais detalhes sobre sua classe. A escolha da sua classe é a decisão mais importante ao criar um personagem e influencia muitas das escolhas que você fará nos próximos passos. Você consultará a descrição da sua classe no capítulo 3 diversas vezes.\n\n## Passo 2: Determine a Origem\n\nDeterminar a origem do seu personagem envolve escolher um antecedente, uma espécie e dois idiomas.\n\nO antecedente do personagem representa o lugar e a ocupação mais formativos em sua vida. A combinação de antecedente, espécie e idiomas oferece um terreno fértil para sua imaginação ao pensar sobre os primeiros dias do seu personagem.\n\n## Escolha um Antecedente\n\nEscolha o antecedente do seu personagem e registre-o na sua ficha. Você pode optar pelos antecedentes descritos no capítulo 4, e seu Mestre pode oferecer antecedentes adicionais como opções.\n\nO antecedente escolhido influencia o passo 3, onde você define os valores de atributo do seu personagem. Se tiver dificuldade em decidir, a tabela Valores de Atributo e Antecedentes mostra quais antecedentes favorecem quais atributos. Nela, você encontrará o atributo principal da sua classe.\n\n**Valores de Atributo e Antecedentes**\n\n| **Atributo** | **Antecedentes**                                                                      |\n|--------------|---------------------------------------------------------------------------------------|\n| Força        | Artesão, Artista, Fazendeiro, Guarda, Marinheiro, Nobre, Soldado                      |\n| Destreza     | Andarilho, Artesão, Artista, Charlatão, Criminoso, Escriba, Guia, Marinheiro, Soldado |\n| Constituição | Charlatão, Criminoso, Eremita, Fazendeiro, Guia, Mercador, Sábio, Soldado             |\n| Inteligência | Acólito, Artesão, Criminoso, Escriba, Guarda, Mercador, Nobre, Sábio                  |\n| Sabedoria    | Acólito, Andarilho, Eremita, Escriba, Fazendeiro, Guarda, Guia, Marinheiro, Sábio     |\n| Carisma      | Acólito, Andarilho, Artista, Charlatão, Eremita, Mercador, Nobre                      |\n\n**Anote Seu Talento.** Um antecedente concede um talento (detalhado no capítulo 5), que confere habilidades específicas ao seu personagem. Anote seu talento na ficha de personagem.\n\n**Anote Suas Proficiências.** Seu antecedente concede proficiência em duas perícias e em uma ferramenta. Anote essas informações na sua ficha de personagem.\n\nSua classe também concede proficiências. Confira a descrição da sua classe no capítulo 3 e anote as proficiências na sua ficha de personagem.\n\nNo exemplo da ficha de personagem, você pode indicar proficiência em perícias e salvaguardas marcando o círculo ao lado delas.\n\nA tabela de características na descrição da sua classe mostra o seu Bônus de Proficiência (descrito no capítulo 1), que é +2 para um personagem de nível 1. Anote esse número na sua ficha de personagem. Você preencherá outros números relacionados a essa proficiência no passo 5.\n\n## Escolhendo o Equipamento Inicial\n\nSeu antecedente e sua classe fornecem o equipamento inicial. Todas as moedas que você receber neste passo podem ser imediatamente gastas em equipamentos do capítulo 6. Além disso, você pode adquirir uma bugiganga sem qualquer custo (veja a tabela Bugigangas no final deste capítulo).\n\nAnote o equipamento escolhido na sua ficha de personagem. Os equipamentos estão descritos no capítulo 6, mas por enquanto você pode apenas anotar tudo e consultar os detalhes mais tarde neste capítulo. Também há espaço na ficha de personagem para anotar as moedas que restaram após a compra do equipamento, assim como os tesouros que você irá adquirir em suas aventuras.\n\n### Escolha uma Espécie\n\nEscolha uma espécie para o seu personagem. As opções de espécies a seguir são detalhadas no capítulo 4: Aasimar, Anão, Draconato, Elfo, Gnomo, Golias, Humano, Orc, Pequenino e Tiferino. Após escolher uma espécie, anote-a na sua ficha de personagem. Em seguida, anote os traços correspondentes à sua espécie.\n\nO tamanho e o Deslocamento do seu personagem são definidos pela sua espécie; também anote nos locais apropriados da sua ficha de personagem (você pode anotar apenas a primeira letra do seu tamanho).\n\n### Imagine seu Passado e Presente\n\nDeixe o antecedente e a espécie do seu personagem inspirarem como você imagina o passado dele. Esse passado moldou o presente do personagem. Com isso em mente, considere as seguintes perguntas:\n\n-   Quem criou você?\n-   Quem foi seu amigo de infância mais querido?\n-   Você cresceu com um animal de estimação?\n-   Você se apaixonou? Se sim, por quem?\n-   Você se juntou a alguma organização, como uma guilda ou religião? Se sim, ainda é membro?\n-   Quais elementos do seu passado o inspiraram a se aventurar?\n\n### Escolha de Idiomas\n\nO seu personagem sabe pelo menos três idiomas: Comum e mais dois idiomas que você pode escolher da tabela Idiomas Comuns. O conhecimento de um idioma significa que o seu personagem pode se comunicar, ler e escrever nesse idioma. A sua classe e outras características também podem lhe conceder idiomas.\n\nA tabela Idiomas Comuns lista os idiomas comuns nos mundos de D&D. Todos os personagens jogadores conhecem o Comum, que se originou na metrópole planar de Sigil, o centro do multiverso. Os outros idiomas comuns originaram-se com os primeiros membros das espécies mais proeminentes nos mundos de D&D e desde então se espalharam amplamente.\n\nIdiomas Comuns\n\n| **1d12** | **Idioma**                | **Origem**  |\n|----------|---------------------------|-------------|\n| —        | Comum                     | Sigil       |\n| 1        | Língua de Sinais Comum | Sigil       |\n| 2        | Dracônico                 | Dragões     |\n| 3–4      | Anão                      | Anões       |\n| 5–6      | Élfico                    | Elfos       |\n| 7        | Gigante                   | Gigantes    |\n| 8        | Gnômico                   | Gnomos      |\n| 9        | Goblin                    | Goblinoides |\n| 10–11    | Pequenino                 | Pequeninos  |\n| 12       | Orc                       | Orcs        |\n\nIdiomas Raros\n\nConsidere como suas escolhas se combinam para colocar seu personagem no caminho da aventura.\n\nA tabela de **Idiomas Raros** lista idiomas que são secretos ou derivados de outros planos de existência e, portanto, menos comuns nos mundos do Plano Material. Algumas características permitem que um personagem aprenda um idioma raro.\n\n| **Idioma**        | **Origem**                |\n|-------------------|---------------------------|\n| Abissal           | Demônios do Abismo        |\n| Celestial         | Celestiais                |\n| Dialeto Obscuro   | Aberrações                |\n| Druídico          | Círculos druídicos        |\n| Gíria dos Ladrões | Várias guildas criminosas |\n| Infernal          | Diabos dos Nove Infernos  |\n| Primordial\\*      | Elementais                |\n| Silvestre         | A Faéria                  |\n| Subcomum          | A Umbraeterna             |\n\n\\*Primordial inclui os dialetos Aquan, Auran, Ignan e Terran. As criaturas que conhecem um destes dialetos podem se comunicar com aquelas que conhecem um dialeto diferente.\n\n## Etapa 3: Determinando os Valores de Atributo\n\nPara determinar os valores de atributo do seu personagem, você primeiro gera um conjunto de seis números seguindo as instruções abaixo e, em seguida, os atribui aos seus seis atributos. O Capítulo 1 explica o que cada atributo representa.\n\n### Gerando seus Valores de Atributo\n\nDetermine seus valores de atributo usando um dos três métodos a seguir. Seu Mestre pode preferir que você use um método específico.\n\n**Conjunto Padrão.** Use os seguintes seis valores para seus atributos: 15, 14, 13, 12, 10, 8.\n\n**Geração Aleatória.** Jogue quatro d6s e registre o total dos três dados mais altos. Faça isso mais cinco vezes, para que você tenha seis números.\n\n**Custo de Pontos.** Você tem 27 pontos para gastar em seus valores de atributo. O custo de cada valor é apresentado na tabela Custos de Pontos para Valores de Atributo. Por exemplo, um valor de 14 custa 7 dos seus 27 pontos.\n\nCustos de Pontos para Valores de Atributo\n\n| **Valor** | **Custo** |\n|-----------|-----------|\n| 8         | 0         |\n| 9         | 1         |\n| 10        | 2         |\n| 11        | 3         |\n| 12        | 4         |\n| 13        | 5         |\n| 14        | 7         |\n| 15        | 9         |\n\n### Atribua os Valores de Atributo\n\nApós gerar seis valores, atribua-os a Força, Destreza, Constituição, Inteligência, Sabedoria e Carisma, lembrando-se do atributo primário da sua classe. Preencha também os modificadores de atributo.\n\nSe você estiver usando a opção de Conjunto Padrão, consulte a tabela Conjunto Padrão por Classe para sugestões de onde atribuir os valores para a classe do seu personagem. A tabela coloca os valores mais altos nos principais atributos da classe. Se você utilizou outro método para gerar os valores, ainda pode usar essa tabela como guia para decidir onde colocar seus maiores e menores valores.\n\n| **Conjunto Padrão por Classe** | **For.** | **Des.** | **Con.** | **Int.** | **Sab.** | **Car.** |\n|--------------------------------|----------|----------|----------|----------|----------|----------|\n| Bárbaro                        | 15       | 13       | 14       | 10       | 12       | 8        |\n| Bardo                          | 8        | 14       | 12       | 13       | 10       | 15       |\n| Bruxo                          | 8        | 14       | 13       | 12       | 10       | 15       |\n| Clérigo                        | 14       | 8        | 13       | 10       | 15       | 12       |\n| Druida                         | 8        | 12       | 14       | 13       | 15       | 10       |\n| Feiticeiro                     | 10       | 13       | 14       | 8        | 12       | 15       |\n| Guardião                       | 12       | 15       | 13       | 8        | 14       | 10       |\n| Guerreiro                      | 15       | 14       | 13       | 8        | 10       | 12       |\n| Ladino                         | 12       | 15       | 13       | 14       | 10       | 8        |\n| Mago                           | 8        | 12       | 13       | 15       | 14       | 10       |\n| Monge                          | 12       | 15       | 13       | 10       | 14       | 8        |\n| Paladino                       | 15       | 10       | 13       | 8        | 12       | 14       |\n\nAntecedentes e Espécies de Livros Antigos\n\nAntecedentes em livros antigos de D&D não incluem ajustes nos valores de atributo. Se você estiver usando um antecedente de um livro antigo, ajuste seus valores de atributo aumentando um valor em 2 e um valor diferente em 1, ou aumente três valores em 1. Nenhum desses aumentos pode elevar um valor acima de 20.\n\nDa mesma forma, espécies em livros antigos incluem aumentos nos valores de atributo. Se você estiver usando uma espécie de um livro antigo, ignore esses aumentos e use apenas os fornecidos pelo seu antecedente.\n\nAlém disso, se o antecedente que você escolheu não fornecer um talento, você obtém um talento de Origem à sua escolha.\n\n### Aplicando os Valores de Atributos\n\nApós atribuir seus valores de atributo, ajuste-os de acordo com seu antecedente. Seu antecedente apresenta três atributos; aumente um desses valores em 2 e um diferente em 1, ou aumente todos os três em 1. Nenhum desses aumentos pode ser maior que 20.\n\nAlguns jogadores preferem aumentar o atributo primário de sua classe, enquanto outros optam por melhorar um valor baixo.\n\n### Determinando os Valores de Atributo\n\nPor fim, determine seus modificadores de atributo usando a tabela Valores e Modificadores de Atributo. Escreva o modificador ao lado de cada um de seus valores.\n\nValores e Modificadores de Atributo\n\n| **Valor** | **Modificador** |\n|-----------|-----------------|\n| 3         | -4              |\n| 4–5       | -3              |\n| 6–7       | -2              |\n| 8–9       | -1              |\n| 10–11     | +0              |\n| 12–13     | +1              |\n| 14–15     | +2              |\n| 16–17     | +3              |\n| 18–19     | +4              |\n| 20        | +5              |\n\n### Descreva a Aparência e Personalidade\n\nOs valores de atributo são parte essencial das regras, mas podem ir além disso. Depois de estabelecer seus valores de atributo, pense no que esses valores podem dizer sobre a aparência e a personalidade do seu personagem. Um personagem muito forte com Carisma baixo pode se comportar e parecer diferente de um personagem carismático com Força baixa. As tabelas a seguir oferecem sugestões de palavras descritivas com base em um valor alto ou baixo em determinado atributo.\n\nAnote a aparência e a personalidade do seu personagem na sua ficha de personagem.\n\n**Força**\n\n| **1d4** | **For. Alta** | **1d4** | **For. Baixa** |\n|---------|---------------|---------|----------------|\n| 1       | Musculoso     | 1       | Fraco          |\n| 2       | Robusto       | 2       | Magro          |\n| 3       | Protetor      | 3       | Autoconsciente |\n| 4       | Direto        | 4       | Indireto       |\n\n**Destreza**\n\n| **1d4** | **Des. Alta** | **1d4** | **Des. Baixa** |\n|---------|---------------|---------|----------------|\n| 1       | Ágil          | 1       | Atrapalhado    |\n| 2       | Dinâmico      | 2       | Desajeitado    |\n| 3       | Inquieto      | 3       | Hesitante      |\n| 4       | Equilibrado   | 4       | Instável       |\n\n**Constituição**\n\n| **1d4** | **Con. Alta** | **1d4** | **Con. Baixa** |\n|---------|---------------|---------|----------------|\n| 1       | Energético    | 1       | Débil          |\n| 2       | Vigoroso      | 2       | Sensível       |\n| 3       | Saudável      | 3       | Letárgico      |\n| 4       | Estável       | 4       | Frágil         |\n\n**Inteligência**\n\n| **1d4** | **Int. Alta** | **1d4** | **Int. Baixa** |\n|---------|---------------|---------|----------------|\n| 1       | Decidido      | 1       | Inapto         |\n| 2       | Lógico        | 2       | Ilógico        |\n| 3       | Informado     | 3       | Desinformado   |\n| 4       | Curioso       | 4       | Fútil          |\n\n**Sabedoria**\n\n| **1d4** | **Sab. Alta** | **1d4** | **Sab. Baixa** |\n|---------|---------------|---------|----------------|\n| 1       | Sereno        | 1       | Impulsivo      |\n| 2       | Atento        | 2       | Distraído      |\n| 3       | Observador    | 3       | Alheio         |\n| 4       | Vigilante     | 4       | Ingênuo        |\n\n**Carisma**\n\n| **1d4** | **Car. Alto** | **1d4** | **Car. Baixo** |\n|---------|---------------|---------|----------------|\n| 1       | Encantador    | 1       | Pedante        |\n| 2       | Imponente     | 2       | Carrancudo     |\n| 3       | Engraçado     | 3       | Reservado      |\n| 4       | Inspirador    | 4       | Indelicado     |\n\n**Criaturas Sem Alinhamento**\n\nA maioria das criaturas que não possuem capacidade de pensamento racional não têm alinhamento. Tubarões, por exemplo, são predadores selvagens, mas não são maus; eles não têm alinhamento.\n\n## Passo 4: Escolha um Alinhamento\n\nEscolha o alinhamento do seu personagem a partir das opções abaixo e anote em sua ficha de personagem.\n\nD&D presume que os personagens dos jogadores não têm um alinhamento mau. Consulte seu Mestre antes de criar um personagem mau.\n\n### Os Nove Alinhamentos\n\nO alinhamento de uma criatura descreve de maneira abrangente suas atitudes éticas e ideais. O alinhamento é uma combinação de dois fatores: um identifica a moralidade (bom, mau ou neutro) e o outro descreve as atitudes em relação à ordem (ordeiro, caótico ou neutro).\n\nAs descrições dos alinhamentos abaixo descrevem o comportamento esperado de uma criatura com tal alinhamento; indivíduos podem variar dentro desse comportamento.\n\n**Ordeiro e Bom (OB).** Criaturas Ordeiras e Boas se esforçam para fazer a coisa certa, conforme esperado pela sociedade. Alguém que luta contra a injustiça e protege os inocentes sem hesitação é provavelmente Ordeiro e Bom.\n\n**Neutro e Bom (NB).** Criaturas Neutras e Boas fazem o melhor que podem, trabalhando dentro das regras, mas sem se sentir obrigadas por elas. Uma pessoa bondosa que ajuda os outros conforme as necessidades deles é provavelmente Neutra e Boa.\n\n**Caótico e Bom (CB).** Criaturas Caóticas e Boas agem conforme sua consciência, sem se importar muito com o que os outros esperam. Um rebelde que embosca os coletores de impostos de um barão cruel e usa o dinheiro roubado para ajudar os pobres é provavelmente Caótico e Bom.\n\n**Ordeiro e Neutro (ON).** Indivíduos Ordeiros e Neutros agem de acordo com a lei, tradição ou códigos pessoais. Alguém que segue uma regra disciplinada de vida — e não é influenciado pelas demandas dos necessitados ou pelas tentações do mal — é provavelmente Ordeiro e Neutro.\n\n**Neutro (N).** Neutro é o alinhamento daqueles que preferem evitar questões morais e não tomam partido, fazendo o que parece melhor no momento. Alguém que está entediado com o debate moral provavelmente é Neutro.\n\n**Caótico e Neutro (CN).** Criaturas Caóticas e Neutras seguem seus impulsos, valorizando sua liberdade pessoal acima de tudo. Um patife que vagabundeia pela terra vivendo de seus próprios recursos é provavelmente Caótico e Neutro.\n\n**Ordeiro e Mau (OM).** Criaturas Ordeiras e Más tomam metodicamente o que querem dentro dos limites de um código de tradição, lealdade ou ordem. Um aristocrata que explora os cidadãos enquanto trama por poder é provavelmente Ordeiro e Mau.\n\n**Neutro e Mau (NM).** Neutro e Mau é o alinhamento daqueles que não se preocupam com o mal que causam enquanto perseguem seus desejos. Um criminoso que rouba e assassina à vontade é provavelmente Neutro e Mau.\n\n**Caótico e Mau (CM).** Criaturas Caóticas e Más agem com violência arbitrária, impulsionadas pelo ódio ou pela sede de sangue. Um vilão que persegue esquemas de vingança e caos é provavelmente Caótico e Mau.\n\nAlinhamentos podem ser visualizados como uma grade como esta — junto com criaturas que incorporam esses alinhamentos.\n\n### **Alinhamento e Personalidade**\n\nO alinhamento pode moldar a personalidade, os objetivos e as crenças centrais de um personagem. Ao considerar os dois elementos de um alinhamento, você pode usar as listas abaixo para inspirar detalhes da personalidade do seu personagem.\n\n**Traços de Personalidade por Alinhamento**\n\n| **Alinhamento** | **1d4** | **Traço Associado** |\n|-----------------|---------|---------------------|\n| Bom             | 1       | Compassivo          |\n|                 | 2       | Prestativo          |\n|                 | 3       | Honesto             |\n|                 | 4       | Gentil              |\n| Caótico         | 1       | Orgulhoso           |\n|                 | 2       | Impulsivo           |\n|                 | 3       | Rebelde             |\n|                 | 4       | Egocêntrico         |\n| Mau             | 1       | Desonesto           |\n|                 | 2       | Vingativo           |\n|                 | 3       | Cruel               |\n|                 | 4       | Ganancioso          |\n| Neutro          | 1       | Egoísta             |\n|                 | 2       | Desinteressado      |\n|                 | 3       | Lacônico            |\n|                 | 4       | Pragmático          |\n| Ordeiro         | 1       | Cooperativo         |\n|                 | 2       | Leal                |\n|                 | 3       | Julgador            |\n|                 | 4       | Metódico            |\n\n## **Passo 5: Preencha os Detalhes**\n\nAgora, preencha o resto da sua ficha de personagem.\n\n### **Registre as Características de Classe**\n\nConsulte a tabela de características da sua classe no capítulo 3 e anote as características de nível 1. As características de classe estão detalhadas naquele mesmo capítulo.\n\nAlgumas características de classe oferecem escolhas. Certifique-se de ler todas as suas características e fazer quaisquer escolhas oferecidas.\n\n### **Preencha os Números**\n\nAnote os seguintes números na sua ficha de personagem.\n\n**Salvaguardas.** Para as salvaguardas nas quais você tem proficiência, adicione seu Bônus de Proficiência ao modificador de atributo apropriado e anote o total. Alguns jogadores também gostam de anotar o modificador para salvaguardas nas quais não têm proficiência, que é apenas o modificador de atributo relevante.\n\n**Perícias.** Para as perícias nas quais você tem proficiência, adicione seu Bônus de Proficiência ao modificador de atributo associado a essa perícia e anote o total. Você também pode querer anotar o modificador para perícias nas quais não tem proficiência, que é apenas o modificador de atributo relevante.\n\n**Percepção Passiva.** Às vezes, seu Mestre determinará se seu personagem percebe algo sem que você precise realizar um teste de Sabedoria (Percepção); o Mestre usa sua Percepção Passiva em vez disso. A Percepção Passiva é um valor que reflete uma consciência geral do seu entorno quando você não está ativamente procurando algo. Use a seguinte fórmula para determinar seu valor de Percepção Passiva:\n\n**Percepção Passiva = 10 + modificador do teste de Sabedoria (Percepção)**\n\nInclua todos os modificadores que se aplicam aos seus testes de Sabedoria (Percepção). Por exemplo, se seu personagem tem Sabedoria 15 e proficiência na perícia Percepção, você tem uma Percepção Passiva de 14 (10 + 2 pelo seu modificador de Sabedoria + 2 pela proficiência).\n\n**Pontos de Vida.** Sua classe e modificador de Constituição determinam seus Pontos de Vida máximos no nível 1, conforme mostrado na tabela Pontos de Vida no Nível 1 por Classe.\n\n**Pontos de Vida no Nível 1 por Classe**\n\n| **Classe**                                     | **Pontos de Vida Máximos** |\n|------------------------------------------------|----------------------------|\n| Bárbaro                                        | 12 + mod. de Constituição  |\n| Guardião, Guerreiro ou Paladino                | 10 + mod. de Constituição  |\n| Bardo, Bruxo, Clérigo, Druida, Ladino ou Monge | 8 + mod. de Constituição   |\n| Feiticeiro ou Mago                             | 6 + mod. de Constituição   |\n\nA ficha de personagem inclui espaço para anotar seus Pontos de Vida atuais quando você sofre dano, assim como quaisquer Pontos de Vida Temporários que você possa receber. Há também espaço para monitorar Salvaguardas Contra Morte.\n\n**Dados de Pontos de Vida.** A descrição da sua classe informa o tipo de dado dos Pontos de Vida do seu personagem (ou Dados de Vida, para abreviar); anote isso na sua ficha de personagem. No nível 1, seu personagem tem 1 Dado de Vida. Você pode gastar Dados de Vida durante um Descanso Curto para recuperar Pontos de Vida. Sua ficha de personagem também inclui espaço para anotar quantos Dados de Vida você gastou.\n\n**Iniciativa.** Anote o modificador de Destreza no espaço para Iniciativa na sua ficha de personagem.\n\n**Classe de Armadura.** Sem armadura ou escudo, sua Classe de Armadura base é 10 mais seu modificador de Destreza. Se seu equipamento inicial incluir armadura ou um escudo (ou ambos), calcule sua CA usando as regras no capítulo 6. Uma característica de classe pode fornecer uma maneira diferente de calcular sua CA.\n\n**Ataques.** Na seção de Armas e Truques de Dano da ficha de personagem, escreva suas armas iniciais. O bônus de jogada de ataque para uma arma com a qual você tem proficiência é um dos seguintes, a menos que a propriedade da arma indique o contrário:\n\n**Bônus de ataque Corpo a Corpo** = modificador de Força + Bônus de Proficiência\n\n**Bônus de ataque à Distância** = modificador de Destreza + Bônus de Proficiência\n\nVeja o capítulo 6 para conferir o dano e as propriedades das suas armas. Você adiciona o mesmo modificador de atributo que utiliza para os ataques com uma arma às suas jogadas de dano com essa arma.\n\n**Conjuração.** Anote tanto a CD para evitar suas magias quanto o bônus de ataque para os ataques que você realiza com elas, usando as seguintes fórmulas:\n\n**CD para evitar magia** = 8 + modificador de atributo de conjuração + Bônus de Proficiência\n\n**Bônus de ataque mágico** = modificador de atributo de conjuração + Bônus de Proficiência\n\nO modificador de atributo de conjuração para uma magia é determinado pela característica que lhe confere a capacidade de conjurar a magia.\n\n**Espaços de Magia, Truques e Magias Preparadas.** Se sua classe lhe confere a característica Conjuração ou Magia de Pacto, a tabela de características da sua classe mostra o número de espaços de magia disponíveis, quantos truques você conhece e quantas magias você pode preparar. Escolha seus truques e magias preparadas, e anote-os — junto com seu número de espaços de magia — na sua ficha de personagem.\n\n### Nomeie Seu Personagem\n\nEscolha um nome para o seu personagem e escreva-o na sua ficha de personagem. O nome pode ser o que você quiser. É o nome de um ancestral? Tem significado religioso ou outra importância? É um nome que você escolheu para si?\n\n### Crie Detalhes Finais\n\nAo terminar de criar seu personagem, considere se gostaria de inventar mais detalhes sobre ele. Aqui estão alguns aspectos que você pode desejar para o seu personagem:\n\n-   Qual é o seu gênero?\n-   Quem ou o que você mais valoriza?\n-   Qual é o seu maior medo?\n-   Em suas aventuras, você busca conhecimento, riqueza, glória, justiça, poder ou algo mais?\n\n# Avanço de Nível\n\nDurante as aventuras, seu personagem obtém experiência, representada por Pontos de Experiência (XP). Um personagem que atinge um total específico de Pontos de Experiência avança em capacidade, o que é chamado de alcançar um nível.\n\nA tabela Evolução do Personagem detalha a quantidade de XP necessária para avançar de nível e o Bônus de Proficiência correspondente a esse nível. Quando o total de XP do seu personagem é igual ou superior a um número na coluna de Pontos de Experiência, você atinge o nível correspondente.\n\n**Evolução do Personagem**\n\n| **Nível** | **Pontos de Experiência** | **Bônus de Proficiência** |\n|-----------|---------------------------|---------------------------|\n| 1         | 0                         | +2                        |\n| 2         | 300                       | +2                        |\n| 3         | 900                       | +2                        |\n| 4         | 2.700                     | +2                        |\n| 5         | 6.500                     | +3                        |\n| 6         | 14.000                    | +3                        |\n| 7         | 23.000                    | +3                        |\n| 8         | 34.000                    | +3                        |\n| 9         | 48.000                    | +4                        |\n| 10        | 64.000                    | +4                        |\n| 11        | 85.000                    | +4                        |\n| 12        | 100.000                   | +4                        |\n| 13        | 120.000                   | +5                        |\n| 14        | 140.000                   | +5                        |\n| 15        | 165.000                   | +5                        |\n| 16        | 195.000                   | +5                        |\n| 17        | 225.000                   | +6                        |\n| 18        | 265.000                   | +6                        |\n| 19        | 305.000                   | +6                        |\n| 20        | 355.000                   | +6                        |\n\n**O equipamento de aventura melhora à medida que o personagem avança pelos estágios de jogo.**\n\n## Adquirindo Um nível\n\nAo atingir um nível, siga estas etapas:\n\n1: **Escolha uma Classe.** A maioria dos personagens avança na mesma classe, mas você pode optar por adquirir um nível em outra classe, utilizando as regras da seção \"Multiclasse\" mais adiante neste capítulo.\n\n2: **Ajuste os Pontos de Vida e os Dados de Vida.** Cada vez que você adquire um nível, obtém um dado de vida adicional. Jogue esse dado, adicione seu modificador de Constituição ao resultado e some o total (mínimo de 1) ao seus Pontos de Vida máximos. Em vez de jogar, você pode usar o valor fixo mostrado na tabela Pontos de Vida Fixos por Classe.\n\nPontos de Vida Fixos por Classe\n\n| **Classe**                                     | **Pontos de Vida por Nível** |\n|------------------------------------------------|------------------------------|\n| Bárbaro                                        | 7 + mod. de Constituição     |\n| Guardião, Guerreiro, Paladino                  | 6 + mod. de Constituição     |\n| Bardo, Bruxo, Clérigo, Druida, Ladino ou Monge | 5 + mod. de Constituição     |\n| Feiticeiro ou Mago                             | 4 + mod. de Constituição     |\n\n3: **Anote Novas Características de Classe.** Consulte a tabela de características da sua classe no capítulo 3 e anote as características que você adquire no novo nível nesta classe. Faça as escolhas oferecidas por uma nova característica.\n\n4: **Ajuste o Bônus de Proficiência.** O Bônus de Proficiência de um personagem aumenta em determinados níveis, conforme mostrado na tabela Evolução do Personagem e na tabela de características da sua classe no capítulo 3. Quando o seu Bônus de Proficiência aumenta, aumente todos os números na sua ficha de personagem que incluem esses bônus.\n\n5: **Ajuste os Modificadores de Atributo.** Se você escolher um talento que aumenta um ou mais dos seus valores de atributo, seu modificador de atributo também muda se o novo valor for um número par. Nesse caso, ajuste todos os números na sua ficha de personagem que utilizam esse modificador. Quando seu modificador de Constituição aumenta em 1, seus Pontos de Vida máximos aumentam em 1 para cada nível que você atingiu. Por exemplo, se um personagem atinge o nível 8 e aumenta o valor de Constituição de 17 para 18, o modificador de Constituição aumenta para +4. Os Pontos de Vida máximos do personagem, então, aumentam em 8, além dos Pontos de Vida recebidos ao atingir o nível 8.\n\nTalentos Adicionais no Nível 20\n\nUm Mestre pode usar talentos como forma de avanço após os personagens alcançarem o nível 20, proporcionando maior poder àqueles que não têm mais níveis para adquirir. Com essa abordagem, cada personagem obtém um talento à sua escolha a cada 30.000 XP recebidos além de 355.000 XP. Dádivas Épicas são especialmente apropriadas para esses talentos adicionais, mas um jogador pode escolher qualquer talento para o qual seu personagem de nível 20 se qualifique.\n\n## Estágios de Jogo\n\nCom cada novo nível, os personagens adquirem novas habilidades que os preparam para enfrentar desafios maiores. À medida que os personagens avançam de nível, o tom do jogo também muda e os riscos da campanha aumentam. Ajuda pensar na trajetória de um personagem (e da campanha) em termos de quatro estágios de jogo, descrevendo a jornada de um personagem de nível 1 que acabou de começar sua jornada de aventureiro até as alturas épicas do nível 20. Esses estágios não têm regras associadas; eles indicam que a experiência de jogo evolui conforme os personagens alcançam níveis.\n\n### Estágio 1 (Níveis 1–4)\n\nNo estágio 1, os personagens são aventureiros e aprendizes, embora já se destaquem da população em geral por suas habilidades extraordinárias. Eles aprendem suas características de classe iniciais e escolhem uma subclasse. As ameaças que enfrentam geralmente representam perigo para fazendas ou vilarejos locais.\n\n### Estágio 2 (Níveis 5–10)\n\nNo estágio 2, os personagens se tornam aventureiros completos. Os conjuradores adquirem magias icônicas, como *Bola de Fogo*, *Relâmpago* e *Reviver os Mortos*. A maioria das classes focadas em combate obtém a habilidade de realizar múltiplos ataques em um turno. Os personagens agora enfrentam perigos que ameaçam cidades e reinos.\n\n### Estágio 3 (Níveis 11–16)\n\nNo estágio 3, os personagens alcançaram um nível de poder que os torna especiais entre os aventureiros. No nível 11, muitos conjuradores aprendem magias que alteram a realidade. Outros personagens adquirem características que permitem realizar mais ataques ou fazer coisas mais impressionantes com esses ataques. Esses aventureiros frequentemente enfrentam ameaças a regiões inteiras.\n\n### Estágio 4 (Níveis 17–20)\n\nNo estágio 4, os personagens atingem o auge de suas características de classe, tornando-se arquétipos heroicos. O destino do mundo ou até mesmo a ordem do multiverso pode estar em jogo durante suas aventuras.\n\n# Começando em Níveis Mais Altos\n\nSeu Mestre pode iniciar com os personagens do seu grupo em um nível superior a 1. É especialmente recomendado começar no nível 3 se o grupo for composto por jogadores experientes de D&D.\n\n## Criando Seu Personagem\n\nCriar um personagem de nível mais alto utiliza os mesmos passos de criação de personagem descritos neste capítulo e as regras para avançar além do nível 1 fornecidas na seção \"Avanço de Nível\". Você começa com a quantidade mínima de XP necessária para alcançar seu nível inicial. Por exemplo, se o Mestre inicia com você no nível 10, você possui 64.000 XP.\n\n## Equipamento Inicial\n\nO Mestre decide se seu personagem começa com mais do que o equipamento padrão para um personagem de nível 1, possivelmente incluindo um ou mais itens mágicos. A tabela Equipamento Inicial em Níveis Mais Altos serve como guia para o Mestre.\n\nAlém disso, consulte seu Mestre sobre quais equipamentos estão disponíveis para compra com seu dinheiro inicial. Por exemplo, as armas de fogo descritas no capítulo 6 são muito caras para personagens de nível 1, mas podem estar disponíveis para compra se o Mestre permitir.\n\n**Equipamento Inicial em Níveis Mais Altos**\n\n| **Nível Inicial** | **Equipamento e Dinheiro**                                   | **Itens Mágicos**                        |\n|-------------------|--------------------------------------------------------------|------------------------------------------|\n| 2–4               | Equipamento Inicial Normal                                   | 1 Comum                                  |\n| 5–10              | 500 PO mais 1d10 × 25 PO mais equipamento inicial normal     | 1 Comum, 1 Incomum                       |\n| 11–16             | 5.000 PO mais 1d10 × 250 PO mais equipamento inicial normal  | 2 Comum, 3 Incomum, 1 Raro               |\n| 17–20             | 20.000 PO mais 1d10 × 250 PO mais equipamento inicial normal | 2 Comum, 4 Incomum, 3 Raro, 1 Muito Raro |\n\n# Multiclasse\n\nMulticlasse permite que você adquira níveis em várias classes. Com essa regra, você pode optar por obter um nível em uma nova classe sempre que avançar de nível, ao invés de aumentar seu nível na classe atual. Isso possibilita combinar as habilidades dessas classes para realizar um conceito de personagem que pode não ser refletido em uma única classe.\n\n## Pré-requisitos\n\nPara se qualificar para uma nova classe, você deve ter um valor de pelo menos 13 no atributo primário da nova classe e nas suas classes atuais. Por exemplo, um Bárbaro que decide fazer multiclasse com Druida deve ter valores de Força e Sabedoria de 13 ou mais, já que Força é o atributo primário dos Bárbaros e Sabedoria é o dos Druidas.\n\n## Pontos de Experiência\n\nO custo em Pontos de Experiência para avançar de nível é baseado no seu nível total de personagem, não no nível de uma classe específica, conforme mostrado na tabela Evolução do Personagem. Por exemplo, se você é um Clérigo de nível 6 / Guerreiro de nível 1, deve adquirir XP suficiente para alcançar o nível 8 antes de poder avançar para o segundo nível como Guerreiro ou para o sétimo nível como Clérigo.\n\n## Pontos de Vida e Dados de Pontos de Vida\n\nVocê recebe os Pontos de Vida da nova classe conforme descrito para níveis acima de 1. Os Pontos de Vida do nível 1 de uma classe são obtidos apenas quando seu nível total de personagem é 1.\n\nSome os Dados de Vida concedidos por todas as suas classes para formar sua reserva de Dados de Vida. Se esses dados forem do mesmo tipo, você pode combiná-los. Por exemplo, tanto o Guerreiro quanto o Paladino têm um dado de vida d10, então, se você for um Guerreiro de nível 5 / Paladino de nível 5, tem dez dados d10. Se suas classes fornecerem dados de tipos diferentes, mantenha-os separados. Por exemplo, um Clérigo de nível 5 / Paladino de nível 5 terá cinco dados d8 e cinco dados d10.\n\n## Bônus de Proficiência\n\nSeu Bônus de Proficiência é baseado no seu nível total de personagem, não no nível de uma classe específica, conforme mostrado na tabela Evolução do Personagem. Por exemplo, se você é um Guerreiro de nível 3 / Ladino de nível 2, tem o Bônus de Proficiência de um personagem de nível 5, que é +3.\n\n## Proficiências\n\nAo adquirir seu primeiro nível em uma classe diferente da classe inicial, você obtém apenas algumas das proficiências iniciais dessa nova classe, conforme detalhado na descrição de cada classe no capítulo 3.\n\n## Características de Classe\n\nAo adquirir um novo nível em uma classe, você obtém suas características para aquele nível. Algumas características têm regras adicionais quando você realiza multiclasse. Consulte as informações sobre multiclasse incluídas nas descrições de cada uma de suas classes.\n\nRegras especiais se aplicam a Ataque Extra, Conjuração e características (como Defesa Sem Armadura) que oferecem maneiras alternativas de calcular sua Classe de Armadura.\n\n### Ataque Extra\n\nSe você adquirir a característica Ataque Extra de mais de uma classe, as características não se acumulam. Você não pode realizar mais de dois ataques com essa característica, a menos que tenha uma característica que permita isso (como a característica Dois Ataques Extras do Guerreiro).\n\nDa mesma forma, a invocação Lâmina Sedenta do Bruxo, que concede a característica Ataque Extra à sua arma de pacto, não oferece ataques adicionais se você também já tiver Ataque Extra.\n\n### Classe de Armadura\n\nSe você tiver várias maneiras de calcular sua Classe de Armadura, pode se beneficiar apenas de uma de cada vez. Por exemplo, um Feiticeiro/Monge com a característica de Defesa Sem Armadura do Monge e a Resiliência Dracônica do Feiticeiro deve escolher apenas uma dessas características para calcular sua Classe de Armadura.\n\n### Conjuração\n\nSua capacidade de conjurar magias depende parcialmente dos seus níveis combinados em todas as suas classes conjuradoras e parcialmente dos seus níveis individuais nessas classes. Ao realizar multiclasse e ter a característica Conjuração de mais de uma classe, utilize as regras abaixo. Se você usar multiclasse, mas tiver a característica Conjuração apenas em uma classe, siga as regras dessa classe.\n\n**Magias Preparadas.** Você determina quais magias pode preparar para cada classe individualmente, como se fosse um membro de classe única dessa classe. Por exemplo, se você é um Guardião de nível 4 / Feiticeiro de nível 3, pode preparar cinco magias de 1º círculo de Guardião e preparar seis magias de 1º ou 2º círculo de Feiticeiro (além de quatro truques de Feiticeiro).\n\nCada magia que você prepara está associada a uma de suas classes, e você usa o atributo de conjuração dessa classe quando conjura a magia.\n\n**Truques.** Se um truque seu aumenta de poder em níveis mais altos, o aumento é baseado no seu nível total de personagem, não no nível em uma classe específica, a menos que a magia indique o contrário.\n\nConjurador Multiclasse: Espaços de Magia por Círculo de Magia\n\n| **Nível** | **1** | **2** | **3** | **4** | **5** | **6** | **7** | **8** | **9** |\n|-----------|-------|-------|-------|-------|-------|-------|-------|-------|-------|\n| 1         | 2     | —     | —     | —     | —     | —     | —     | —     | —     |\n| 2         | 3     | —     | —     | —     | —     | —     | —     | —     | —     |\n| 3         | 4     | 2     | —     | —     | —     | —     | —     | —     | —     |\n| 4         | 4     | 3     | —     | —     | —     | —     | —     | —     | —     |\n| 5         | 4     | 3     | 2     | —     | —     | —     | —     | —     | —     |\n| 6         | 4     | 3     | 3     | —     | —     | —     | —     | —     | —     |\n| 7         | 4     | 3     | 3     | 1     | —     | —     | —     | —     | —     |\n| 8         | 4     | 3     | 3     | 2     | —     | —     | —     | —     | —     |\n| 9         | 4     | 3     | 3     | 3     | 1     | —     | —     | —     | —     |\n| 10        | 4     | 3     | 3     | 3     | 2     | —     | —     | —     | —     |\n| 11        | 4     | 3     | 3     | 3     | 2     | 1     | —     | —     | —     |\n| 12        | 4     | 3     | 3     | 3     | 2     | 1     | —     | —     | —     |\n| 13        | 4     | 3     | 3     | 3     | 2     | 1     | 1     | —     | —     |\n| 14        | 4     | 3     | 3     | 3     | 2     | 1     | 1     | —     | —     |\n| 15        | 4     | 3     | 3     | 3     | 2     | 1     | 1     | 1     | —     |\n| 16        | 4     | 3     | 3     | 3     | 2     | 1     | 1     | 1     | —     |\n| 17        | 4     | 3     | 3     | 3     | 2     | 1     | 1     | 1     | 1     |\n| 18        | 4     | 3     | 3     | 3     | 3     | 1     | 1     | 1     | 1     |\n| 19        | 4     | 3     | 3     | 3     | 3     | 2     | 1     | 1     | 1     |\n| 20        | 4     | 3     | 3     | 3     | 3     | 2     | 2     | 1     | 1     |\n\n**Espaços de Magia.** Você determina seus espaços de magia disponíveis somando o seguinte:\n\n-   Todos os seus níveis nas classes Bardo, Clérigo, Druida, Feiticeiro e Mago\n-   Metade dos seus níveis (arredonde para cima) nas classes Guardião e Paladino\n-   Um terço dos seus níveis de Guerreiro ou Ladino (arredondado para baixo) se você tiver a subclasse Cavaleiro Místico ou Trapaceiro Arcano.\n\n    Em seguida, consulte o total de níveis na coluna Círculo da tabela Conjurador Multiclasse. Você utiliza os espaços para aquele círculo para conjurar magias de um círculo apropriado de qualquer classe cuja característica Conjuração você possui.\n\n    Esta tabela pode lhe dar espaços de magia de um círculo mais alto do que as magias que você prepara. Você pode usar esses espaços, mas apenas para conjurar suas magias de círculo inferior. Se uma magia de círculo inferior que você conjurar, como *Mãos Flamejantes*, tiver um efeito aprimorado quando conjurado em um círculo superior, você pode usar o efeito aprimorado normalmente.\n\n    Por exemplo, se você é um Guardião de nível 4 / Feiticeiro de nível 3, conta como um personagem de nível 5 ao determinar seus espaços de magia, somando todos os seus níveis como Feiticeiro e metade dos níveis de Guardião. Como mostrado na tabela Conjurador Multiclasse, você tem quatro espaços de magia de 1º círculo, três espaços de 2º círculo e dois espaços de 3º círculo. No entanto, você não pode preparar magias de 3º círculo, nem pode preparar magias de 2º círculo de Guardião. Você pode usar os espaços de magia desses círculos para conjurar as magias que preparou — e potencialmente aprimorar seus efeitos.\n\n    **Magia de Pacto.** Se você possui a característica Magia de Pacto da classe Bruxo e a característica Conjuração, pode usar os espaços de magia que adquire de Magia de Pacto para conjurar magias que você preparou das classes com a característica Conjuração, e pode usar os espaços de magia que adquire da característica Conjuração para conjurar magias de Bruxo que você preparou.\n\n    **Um personagem com níveis de Bruxo e Paladino pode invocar um juramento de força e um patrono sobrenatural**\n\n# Bugigangas\n\nAo criar seu personagem, você pode jogar uma vez na tabela abaixo para sortear uma bugiganga Minúscula, um item simples, mas que possui um leve toque de mistério. O Mestre também pode usar esta tabela. Pode ajudar a abastecer uma sala em uma masmorra ou encher os bolsos de uma criatura.\n\n**Bugigangas**\n\n| **1d100** | **Bugigangas**                                                                                                                       |\n|-----------|--------------------------------------------------------------------------------------------------------------------------------------|\n| 01        | Uma mão de goblin mumificada                                                                                                         |\n| 02        | Um cristal que brilha levemente ao luar                                                                                              |\n| 03        | Uma moeda de ouro cunhada em uma terra desconhecida                                                                                  |\n| 04        | Um diário escrito em um idioma que você não conhece                                                                                  |\n| 05        | Um anel de latão que nunca mancha                                                                                                    |\n| 06        | Uma antiga peça de xadrez feita de vidro                                                                                             |\n| 07        | Um par de dados feitos de ossos de articulação, cada um com o símbolo de um crânio na face que normalmente mostraria seis pontos     |\n| 08        | Um pequeno ídolo que representa uma criatura aterradora e lhe causa sonhos inquietantes quando você dorme perto dele                 |\n| 09        | Uma mecha de cabelo de alguém                                                                                                        |\n| 10        | A escritura de um terreno em um reino desconhecido por você                                                                          |\n| 11        | Um bloco pesando 30 gramas produzido de material desconhecido                                                                        |\n| 12        | Uma pequena boneca de tecido espetada com agulhas                                                                                    |\n| 13        | Um dente de uma fera desconhecida                                                                                                    |\n| 14        | Uma escama enorme, talvez de um dragão                                                                                               |\n| 15        | Uma pena verde brilhante                                                                                                             |\n| 16        | Uma antiga carta de adivinhação com imagens semelhantes a você                                                                       |\n| 17        | Um orbe de vidro cheio de fumaça se movimentando                                                                                     |\n| 18        | Um ovo com uma casca vermelha e brilhante, pesando 500 gramas                                                                        |\n| 19        | Um tubo que sopra bolhas                                                                                                             |\n| 20        | Um frasco de vidro contendo um pouco de carne flutuando no fluido de decapagem                                                       |\n| 21        | Uma caixa de música feita por gnomos que toca uma música que você lembra vagamente da sua infância                                   |\n| 22        | Uma estatueta de madeira de um pequenino orgulhoso                                                                                   |\n| 23        | Um orbe de bronze com runas estranhas gravadas                                                                                       |\n| 24        | Um disco de pedra multicolorido                                                                                                      |\n| 25        | Um ícone de um corvo prateado                                                                                                        |\n| 26        | Uma bolsa contendo quarenta e sete dentes, um dos quais está podre                                                                   |\n| 27        | Uma lasca de obsidiana que, quando tocada, provoca sensação de calor                                                                 |\n| 28        | Uma garra de dragão amarrada em um cordão de couro                                                                                   |\n| 29        | Um par de meias velhas                                                                                                               |\n| 30        | Um livro em branco cujas páginas se recusam ter tinta, giz, grafite ou qualquer outra marcação gravada                               |\n| 31        | Um emblema de prata de uma estrela de cinco pontas                                                                                   |\n| 32        | Uma faca que pertencia a um parente                                                                                                  |\n| 33        | Um frasco de vidro cheio de pedaços de unhas                                                                                         |\n| 34        | Um dispositivo de metal retangular com dois minúsculos copos de metal em uma extremidade que lança faíscas quando molhado            |\n| 35        | Uma luva branca, com adornos, projetada para um ser humano                                                                           |\n| 36        | Um colete com cem bolsos minúsculos                                                                                                  |\n| 37        | Uma pedra sem peso                                                                                                                   |\n| 38        | Um rascunho desenhado de um goblin                                                                                                   |\n| 39        | Um frasco de vidro vazio que cheira a perfume                                                                                        |\n| 40        | Uma pedra preciosa que se parece com um pedaço de carvão quando examinada por alguém que não seja você                               |\n| 41        | Um pedaço de pano de uma bandeira velha                                                                                              |\n| 42        | Uma insígnia de patente de um legionário perdido                                                                                     |\n| 43        | Um sino de prata sem badalo                                                                                                          |\n| 44        | Um canário mecânico dentro de uma lâmpada                                                                                            |\n| 45        | Um baú em miniatura esculpido para parecer que tem vários pés na parte inferior                                                      |\n| 46        | Um sprite morto dentro de uma garrafa de vidro transparente                                                                          |\n| 47        | Uma lata de metal que não tem abertura, mas soa como se estivesse cheia de líquido, areia, aranhas ou vidro quebrado (à sua escolha) |\n| 48        | Um orbe de vidro cheio de água, no qual um peixinho dourado mecânico fica nadando                                                    |\n| 49        | Uma colher de prata com um M gravado na pega                                                                                         |\n| 50        | Um apito feito de madeira dourada                                                                                                    |\n| 51        | Um escaravelho morto do tamanho da sua mão                                                                                           |\n| 52        | Dois soldados de brinquedo, um sem cabeça                                                                                            |\n| 53        | Uma pequena caixa cheia de botões de diferentes tamanhos                                                                             |\n| 54        | Uma vela que não pode ser acesa                                                                                                      |\n| 55        | Uma gaiola em miniatura sem porta                                                                                                    |\n| 56        | Uma chave antiga                                                                                                                     |\n| 57        | Um mapa de tesouro indecifrável                                                                                                      |\n| 58        | Uma empunhadura de uma espada quebrada                                                                                               |\n| 59        | Uma pata de coelho                                                                                                                   |\n| 60        | Um olho de vidro                                                                                                                     |\n| 61        | Uma breve aparição de uma pessoa de aparência desagradável                                                                           |\n| 62        | Um crânio de prata do tamanho de uma moeda                                                                                           |\n| 63        | Uma máscara de alabastro                                                                                                             |\n| 64        | Um cone de incenso-preto, pegajoso, que fede                                                                                         |\n| 65        | Um gorro de dormir que te dá sonhos agradáveis quando você o usa                                                                     |\n| 66        | Um único estrepe produzido de osso                                                                                                   |\n| 67        | Uma armação dourada de um monóculo sem a lente                                                                                       |\n| 68        | Um cubo de 2,5 centímetros, cada lado com uma cor diferente                                                                          |\n| 69        | Uma maçaneta de cristal                                                                                                              |\n| 70        | Um pacote cheio de pó rosa                                                                                                           |\n| 71        | Um fragmento de uma bela canção, escrita como notas musicais em dois pedaços de pergaminho                                           |\n| 72        | Um brinco prateado em formato de lágrima produzido de uma lágrima verdadeira                                                         |\n| 73        | Uma casca de ovo pintada com cenas de desgraça em detalhes perturbadores                                                             |\n| 74        | Um leque que, quando desdobrado, mostra um gato dormindo                                                                             |\n| 75        | Um conjunto de tubos produzidos com osso                                                                                             |\n| 76        | Um trevo-de-quatro-folhas pressionado dentro de um livro sobre boas maneiras e etiqueta                                              |\n| 77        | Uma folha de pergaminho sobre a qual é desenhada uma engenhoca mecânica                                                              |\n| 78        | Uma bainha ornamentada que não cabe em nenhuma lâmina que você tenha encontrado                                                      |\n| 79        | Um convite para uma festa onde aconteceu um assassinato                                                                              |\n| 80        | Um pentagrama de bronze com uma gravura da cabeça de um rato em seu centro                                                           |\n| 81        | Um lenço roxo bordado com o nome de um arquimago                                                                                     |\n| 82        | Metade de uma planta baixa de um templo, um castelo ou outra estrutura                                                               |\n| 83        | Um pedaço de pano dobrado que, quando desdobrado, se transforma em um chapéu elegante                                                |\n| 84        | Um recibo de depósito em um banco em uma cidade distante                                                                             |\n| 85        | Um diário com sete páginas faltando                                                                                                  |\n| 86        | Uma caixa prateada de tabaco vazia com a inscrição \"sonhos\" na tampa                                                                 |\n| 87        | Um símbolo sagrado de ferro dedicado a um deus desconhecido                                                                          |\n| 88        | Um livro sobre a ascensão e queda de um herói lendário, com o último capítulo faltando                                               |\n| 89        | Um frasco com sangue de dragão                                                                                                       |\n| 90        | Uma flecha antiga de estilo élfico                                                                                                   |\n| 91        | Uma agulha que nunca entorta                                                                                                         |\n| 92        | Um broche ornamentado de estilo anão                                                                                                 |\n| 93        | Uma garrafa de vinho vazia com um rótulo bonito que diz: \"Vinícola O Mago dos Vinhos e Vinhais, Engasga-gato do Dragão Vermelho, 331422-W\" |\n| 94        | Um mosaico com uma superfície em vidro multicolorido                                                                                 |\n| 95        | Um rato petrificado                                                                                                                  |\n| 96        | Uma bandeira pirata negra, adornada com uma caveira de dragão e ossos cruzados                                                       |\n| 97        | Um minúsculo caranguejo ou aranha mecânicos que se move quando não está sendo observado                                              |\n| 98        | Um frasco de vidro contendo banha com uma etiqueta que diz: \"Graxa de Grifo\"                                                         |\n| 99        | Uma caixa de madeira com um fundo de cerâmica que contém uma minhoca viva com uma cabeça em cada extremidade do corpo                |\n| 00        | Uma urna de metal contendo as cinzas de um herói                                                                                     |"
}