{
  "capitulo": 1,
  "titulo": "Jogando o Jogo",
  "tabelas": [
    {
      "cabecalhos": [
        "Atributo",
        "Medidas de Pontuação..."
      ],
      "dados": [
        {
          "Atributo": "Força",
          "Medidas de Pontuação...": "Potência física"
        },
        {
          "Atributo": "Destreza",
          "Medidas de Pontuação...": "Agilidade, reflexos e equilíbrio"
        },
        {
          "Atributo": "Constituição",
          "Medidas de Pontuação...": "Saúde e resistência"
        },
        {
          "Atributo": "Inteligência",
          "Medidas de Pontuação...": "Raciocínio e memória"
        },
        {
          "Atributo": "Sabedoria",
          "Medidas de Pontuação...": "Perceptividade e fortaleza mental"
        },
        {
          "Atributo": "Carisma",
          "Medidas de Pontuação...": "Confiança, equilíbrio e charme"
        }
      ]
    },
    {
      "cabecalhos": [
        "Valor",
        "Significado"
      ],
      "dados": [
        {
          "Valor": "1",
          "Significado": "Este é o valor mais baixo que um valor pode normalmente alcançar. Se um efeito reduz um valor a 0, esse efeito explica o que ocorre."
        },
        {
          "Valor": "2-9",
          "Significado": "Este representa uma capacidade fraca."
        },
        {
          "Valor": "10-11",
          "Significado": "Este representa a média humana."
        },
        {
          "Valor": "12-19",
          "Significado": "Este representa uma capacidade forte."
        },
        {
          "Valor": "20",
          "Significado": "Este é o valor mais alto que um aventureiro pode atingir, a menos que uma característica diga o contrário."
        },
        {
          "Valor": "21-29",
          "Significado": "Este representa uma capacidade extraordinária."
        },
        {
          "Valor": "30",
          "Significado": "Este é o valor mais alto que um valor pode atingir."
        }
      ]
    },
    {
      "cabecalhos": [
        "Valor",
        "Modificador"
      ],
      "dados": [
        {
          "Valor": "1",
          "Modificador": "-5"
        },
        {
          "Valor": "2-3",
          "Modificador": "-4"
        },
        {
          "Valor": "4-5",
          "Modificador": "-3"
        },
        {
          "Valor": "6-7",
          "Modificador": "-2"
        },
        {
          "Valor": "8-9",
          "Modificador": "-1"
        },
        {
          "Valor": "10-11",
          "Modificador": "+0"
        },
        {
          "Valor": "12-13",
          "Modificador": "+1"
        },
        {
          "Valor": "14-15",
          "Modificador": "+2"
        },
        {
          "Valor": "16-17",
          "Modificador": "+3"
        },
        {
          "Valor": "18-19",
          "Modificador": "+4"
        },
        {
          "Valor": "20-21",
          "Modificador": "+5"
        },
        {
          "Valor": "22-23",
          "Modificador": "+6"
        },
        {
          "Valor": "24-25",
          "Modificador": "+7"
        },
        {
          "Valor": "26-27",
          "Modificador": "+8"
        },
        {
          "Valor": "28-29",
          "Modificador": "+9"
        },
        {
          "Valor": "30",
          "Modificador": "+10"
        }
      ]
    },
    {
      "cabecalhos": [
        "Atributo",
        "Realize um Teste Para ..."
      ],
      "dados": [
        {
          "Atributo": "Força",
          "Realize um Teste Para ...": "Levantar, empurrar, puxar ou quebrar algo"
        },
        {
          "Atributo": "Destreza",
          "Realize um Teste Para ...": "Mover-se de maneira ágil, rápida ou silenciosa"
        },
        {
          "Atributo": "Constituição",
          "Realize um Teste Para ...": "Forçar seu corpo além dos limites normais"
        },
        {
          "Atributo": "Inteligência",
          "Realize um Teste Para ...": "Raciocinar ou lembrar"
        },
        {
          "Atributo": "Sabedoria",
          "Realize um Teste Para ...": "Notar coisas no ambiente ou no comportamento das criaturas"
        },
        {
          "Atributo": "Carisma",
          "Realize um Teste Para ...": "Influenciar, entreter ou enganar"
        }
      ]
    },
    {
      "cabecalhos": [
        "Dificuldade da Tarefa",
        "CD",
        "Dificuldade da Tarefa",
        "CD"
      ],
      "dados": [
        {
          "Dificuldade da Tarefa": "Difícil",
          "CD": "20"
        },
        {
          "Dificuldade da Tarefa": "Muito difícil",
          "CD": "25"
        },
        {
          "Dificuldade da Tarefa": "Quase impossível",
          "CD": "30"
        }
      ]
    },
    {
      "cabecalhos": [
        "Atributo",
        "Realize uma SG para..."
      ],
      "dados": [
        {
          "Atributo": "Força",
          "Realize uma SG para...": "Resistir fisicamente à força direta"
        },
        {
          "Atributo": "Destreza",
          "Realize uma SG para...": "Esquivar-se do perigo"
        },
        {
          "Atributo": "Constituição",
          "Realize uma SG para...": "Suportar um risco tóxico"
        },
        {
          "Atributo": "Inteligência",
          "Realize uma SG para...": "Reconhecer uma ilusão como falsa"
        },
        {
          "Atributo": "Sabedoria",
          "Realize uma SG para...": "Resistir a um ataque mental"
        },
        {
          "Atributo": "Carisma",
          "Realize uma SG para...": "Afirmar sua identidade"
        }
      ]
    },
    {
      "cabecalhos": [
        "Atributo",
        "Tipo de Ataque"
      ],
      "dados": [
        {
          "Atributo": "Força",
          "Tipo de Ataque": "Ataque corpo a corpo com uma arma ou um Ataque Desarmado (veja o glossário de regras)"
        },
        {
          "Atributo": "Destreza",
          "Tipo de Ataque": "Ataque à distância com uma arma"
        },
        {
          "Atributo": "Varia",
          "Tipo de Ataque": "Ataque mágico (o atributo utilizado é determinado pela característica de conjuração do conjurador, conforme explicado no capítulo 7)"
        }
      ]
    },
    {
      "cabecalhos": [
        "Nível ou ND",
        "Bônus",
        "Nível ou ND",
        "Bônus"
      ],
      "dados": [
        {
          "Nível ou ND": "17–20",
          "Bônus": "6"
        },
        {
          "Nível ou ND": "21–24",
          "Bônus": "7"
        },
        {
          "Nível ou ND": "25–28",
          "Bônus": "8"
        },
        {
          "Nível ou ND": "29–30",
          "Bônus": "9"
        }
      ]
    },
    {
      "cabecalhos": [
        "Perícia",
        "Atributo",
        "Exemplos de Usos"
      ],
      "dados": [
        {
          "Perícia": "Acrobacia",
          "Atributo": "Destreza",
          "Exemplos de Usos": "Manter-se em pé em uma situação complicada ou realizar uma acrobacia."
        },
        {
          "Perícia": "Arcanismo",
          "Atributo": "Inteligência",
          "Exemplos de Usos": "Recordar conhecimentos sobre magias, itens mágicos e planos de existência."
        },
        {
          "Perícia": "Atletismo",
          "Atributo": "Força",
          "Exemplos de Usos": "Pular mais longe do que o normal, manter-se à tona em águas agitadas ou quebrar algo."
        },
        {
          "Perícia": "Atuação",
          "Atributo": "Carisma",
          "Exemplos de Usos": "Atuar, contar uma história, tocar música ou dançar."
        },
        {
          "Perícia": "Enganação",
          "Atributo": "Carisma",
          "Exemplos de Usos": "Contar uma mentira convincente ou usar um disfarce de forma convincente."
        },
        {
          "Perícia": "Furtividade",
          "Atributo": "Destreza",
          "Exemplos de Usos": "Evitar ser notado movendo-se silenciosamente e se escondendo atrás de objetos."
        },
        {
          "Perícia": "História",
          "Atributo": "Inteligência",
          "Exemplos de Usos": "Relembrar fatos sobre eventos históricos, pessoas, nações e culturas."
        },
        {
          "Perícia": "Intimidação",
          "Atributo": "Carisma",
          "Exemplos de Usos": "Atemorizar ou ameaçar alguém para que faça o que você quer."
        },
        {
          "Perícia": "Intuição",
          "Atributo": "Sabedoria",
          "Exemplos de Usos": "Perceber o humor e as intenções de uma pessoa."
        },
        {
          "Perícia": "Investigação",
          "Atributo": "Inteligência",
          "Exemplos de Usos": "Encontrar informações obscuras em livros ou deduzir como algo funciona."
        },
        {
          "Perícia": "Lidar com Animais",
          "Atributo": "Sabedoria",
          "Exemplos de Usos": "Acalmar ou treinar um animal, ou fazer com que ele se comporte de uma determinada maneira."
        },
        {
          "Perícia": "Medicina",
          "Atributo": "Sabedoria",
          "Exemplos de Usos": "Diagnosticar uma doença ou determinar o que matou uma pessoa que morreu recentemente."
        },
        {
          "Perícia": "Natureza",
          "Atributo": "Inteligência",
          "Exemplos de Usos": "Relembrar fatos sobre o terreno, as plantas, os animais e o clima."
        },
        {
          "Perícia": "Percepção",
          "Atributo": "Sabedoria",
          "Exemplos de Usos": "Usando uma combinação de sentidos, notar algo que é fácil de passar despercebido."
        },
        {
          "Perícia": "Persuasão",
          "Atributo": "Carisma",
          "Exemplos de Usos": "Convencer alguém de algo de forma honesta e graciosa."
        },
        {
          "Perícia": "Prestidigitação",
          "Atributo": "Destreza",
          "Exemplos de Usos": "Furtar um bolso, ocultar um objeto portátil ou fazer truque com as mãos."
        },
        {
          "Perícia": "Religião",
          "Atributo": "Inteligência",
          "Exemplos de Usos": "Relembrar fatos sobre deuses, rituais religiosos e símbolos sagrados."
        },
        {
          "Perícia": "Sobrevivência",
          "Atributo": "Sabedoria",
          "Exemplos de Usos": "Seguir rastros, procurar alimentos, encontrar uma trilha ou evitar perigos naturais."
        }
      ]
    },
    {
      "cabecalhos": [
        "Ação",
        "Resumo"
      ],
      "dados": [
        {
          "Ação": "Ajudar",
          "Resumo": "Ajudar no teste de atributo ou na jogada de ataque de outra criatura ou prestar primeiros socorros."
        },
        {
          "Ação": "Analisar",
          "Resumo": "Realizar um teste de Inteligência (Arcanismo, História, Investigação, Natureza ou Religião)."
        },
        {
          "Ação": "Atacar",
          "Resumo": "Atacar com uma arma ou um Ataque Desarmado."
        },
        {
          "Ação": "Correr",
          "Resumo": "Pelo resto do turno, dê a si mesmo um movimento adicional igual ao seu Deslocamento."
        },
        {
          "Ação": "Desengajar",
          "Resumo": "Seu movimento não provoca Ataques de Oportunidade pelo resto do turno."
        },
        {
          "Ação": "Esconder-se",
          "Resumo": "Realizar um teste de Destreza (Furtividade)."
        },
        {
          "Ação": "Esquivar",
          "Resumo": "Até o início do seu próximo turno, jogadas de ataque contra você têm Desvantagem, e você realiza salvaguardas de Destreza com Vantagem. Você perde este benefício se tiver a condição Incapacitado ou se seu Deslocamento for 0."
        },
        {
          "Ação": "Influenciar",
          "Resumo": "Realizar um teste de Carisma (Atuação, Enganação, Intimidação ou Persuasão) ou Sabedoria (Lidar com Animais) para alterar a atitude de uma criatura."
        },
        {
          "Ação": "Preparar",
          "Resumo": "Preparar-se para executar uma ação em resposta a um gatilho que você define."
        },
        {
          "Ação": "Procurar",
          "Resumo": "Realizar um teste de Sabedoria (Intuição, Medicina, Percepção ou Sobrevivência)."
        },
        {
          "Ação": "Usar Magia",
          "Resumo": "Conjurar uma magia, usar um item mágico ou usar uma característica mágica."
        },
        {
          "Ação": "Usar Objeto",
          "Resumo": "Utilizar um objeto não mágico."
        }
      ]
    },
    {
      "cabecalhos": [
        "Distância Percorrida Por…"
      ],
      "dados": [
        {
          "Distância Percorrida Por…": "Ritmo"
        },
        {
          "Distância Percorrida Por…": "Rápido"
        },
        {
          "Distância Percorrida Por…": "Normal"
        },
        {
          "Distância Percorrida Por…": "Lento"
        }
      ]
    },
    {
      "cabecalhos": [
        "Tamanho",
        "Espaço (Metro)",
        "Espaço (Quadrados)"
      ],
      "dados": [
        {
          "Tamanho": "Minúsculo",
          "Espaço (Metro)": "0,75 por 0,75 metro",
          "Espaço (Quadrados)": "4 por quadrado"
        },
        {
          "Tamanho": "Pequeno",
          "Espaço (Metro)": "1,5 por 1,5 metro",
          "Espaço (Quadrados)": "1 por quadrado"
        },
        {
          "Tamanho": "Médio",
          "Espaço (Metro)": "1,5 por 1,5 metro",
          "Espaço (Quadrados)": "1 por quadrado"
        },
        {
          "Tamanho": "Grande",
          "Espaço (Metro)": "3 por 3 metros",
          "Espaço (Quadrados)": "4 quadrados (2 por 2)"
        },
        {
          "Tamanho": "Enorme",
          "Espaço (Metro)": "4,5 por 4,5 metros",
          "Espaço (Quadrados)": "9 quadrados (3 por 3)"
        },
        {
          "Tamanho": "Colossal",
          "Espaço (Metro)": "6 por 6 metros",
          "Espaço (Quadrados)": "16 quadrados (4 por 4)"
        }
      ]
    },
    {
      "cabecalhos": [
        "Grau",
        "Benefício para o Alvo",
        "Concedido por…"
      ],
      "dados": [
        {
          "Grau": "Parcial",
          "Benefício para o Alvo": "+2 de bônus na CA e em Salvaguardas de Destreza",
          "Concedido por…": "Outra criatura ou um objeto que cobre pelo menos metade do alvo"
        },
        {
          "Grau": "Três Quartos",
          "Benefício para o Alvo": "+5 de bônus na CA e em Salvaguardas de Destreza",
          "Concedido por…": "Um objeto que cobre pelo menos três quartos do alvo"
        },
        {
          "Grau": "Total",
          "Benefício para o Alvo": "Não pode ser alvejado diretamente",
          "Concedido por…": "Um objeto que cobre todo o alvo"
        }
      ]
    },
    {
      "cabecalhos": [
        "Amedrontado",
        "Enfeitiçado",
        "Inconsciente"
      ],
      "dados": [
        {
          "Amedrontado": "Atordoado",
          "Enfeitiçado": "Envenenado",
          "Inconsciente": "Invisível"
        },
        {
          "Amedrontado": "Caído",
          "Enfeitiçado": "Exaustão",
          "Inconsciente": "Paralisado"
        },
        {
          "Amedrontado": "Cego",
          "Enfeitiçado": "Imobilizado",
          "Inconsciente": "Petrificado"
        },
        {
          "Amedrontado": "Contido",
          "Enfeitiçado": "Incapacitado",
          "Inconsciente": "Surdo"
        }
      ]
    }
  ],
  "secoes": [
    "Jogador ou Mestre?",
    "Ritmo do Jogo",
    "Um Jogo Contínuo",
    "Dados",
    "Os Seis Atributos",
    "Testes de D20",
    "Proficiência",
    "Ações",
    "Interação Social",
    "Exemplo de Interação Social",
    "Exploração",
    "Exemplo de Exploração",
    "Combate",
    "Dano e Cura",
    "Condições",
    "Exemplo de Combate e Dano"
  ],
  "texto_completo": "Capítulo 1 - Jogando o Jogo\n\n    A imaginação é essencial em Dungeons & Dragons, um jogo cooperativo onde os personagens que você interpreta embarcam juntos em aventuras em mundos de fantasia repletos de monstros e magia.\n\n    Em D&D, a ação ocorre na imaginação dos jogadores e é narrada coletivamente. Aqui está um vislumbre de como isso acontece:\n\n    **Jairo (como Mestre):** Após sua longa jornada, o Castelo Ravenloft se ergue diante de vocês. Torres de pedra em ruínas — talvez antigas guaritas — se aproximam. Além delas, um abismo profundo se estende, envolto em uma névoa densa. Uma ponte levadiça abaixada atravessa o abismo, suas correntes rangendo ao vento. Gárgulas de pedra observam das altas paredes, e uma luz pálida ilumina o pátio através das portas abertas do castelo.\n\n    **Felipe (como Gareth):** Eu analiso as gárgulas. Tenho a sensação de que não são apenas estátuas!\n\n    **Eva (como Mirabella):** Eu quero avaliar a resistência da ponte levadiça. Será que conseguimos atravessá-la, ou ela vai desmoronar sob o nosso peso?\n\n    **Jairo:** Tudo bem, um de cada vez. Felipe, Gareth está examinando as gárgulas?\n\n    **Felipe:** Sim. Existe alguma indicação de que as gárgulas podem ser criaturas e não apenas decorações?\n\n    **Jairo:** Realize um teste de Inteligência.\n\n    **Felipe:** A minha perícia Investigação se aplica?\n\n    **Jairo:** Claro!\n\n    **Felipe (jogando um d20):** Aff. Sete.\n\n    **Jairo:** Parecem decorações para você. Eva, Mirabella está analisando a ponte levadiça?\n\n    A aventura continua com as descrições do Mestre definindo as cenas. Este capítulo apresenta, entre outros exemplos, aspectos específicos do jogo de D&D, como interação social, exploração e combate.\n\n    **Glossário de Regras**\n\n    Se você ler um termo de regras neste livro e quiser saber sua definição, consulte o glossário de regras no apêndice C. Este capítulo oferece uma visão geral de como jogar D&D e se concentra no contexto geral. Muitos trechos deste capítulo fazem referência a esse glossário.\n\n# Jogador ou Mestre?\n\nPara jogar D&D, você precisa de um Mestre e de três a seis jogadores, que atuarão como aventureiros. Qual função é ideal para você?\n\n## Sendo um Jogador\n\nSe quer ser um dos protagonistas das aventuras do seu grupo, considere ser um jogador. Veja o que os jogadores fazem:\n\n**Crie um Personagem.** Seu personagem é seu alter ego no mundo de fantasia do jogo. Após ler este capítulo, use as regras do capítulo 2 para criar seu personagem.\n\n**Forme Uma Equipe.** Seu personagem se une aos outros jogadores para formar um grupo de aventureiros. Esses aliados enfrentam desafios e situações fantásticas juntos, trazendo habilidades distintas que, idealmente, complementam as dos demais personagens.\n\n**Aventure-se.** O grupo do seu personagem explora locais e eventos apresentados pelo Mestre, aos quais você pode responder de qualquer maneira que imaginar, seguindo as regras deste livro. Embora o Mestre controle todos os monstros encontrados, ele não é seu adversário, mas sim o guia da jornada do grupo, à medida que seus personagens se tornam mais poderosos.\n\n## Sendo um Mestre\n\nSe você deseja ser a mente pensante por trás do jogo, considere ser o Mestre. Veja o que os Mestres fazem:\n\n**Construa Aventuras.** Você prepara as aventuras que os jogadores vivenciam. No *Livro do Mestre*, você encontrará conselhos sobre como criar aventuras e até mundos inteiros.\n\n**Guie a História.** Você narra a maior parte da ação, descrevendo os locais e criaturas que os aventureiros enfrentam. Enquanto os jogadores decidem as ações de seus personagens e o que explorar, você utiliza a imaginação e as regras do jogo para determinar os resultados das decisões dos aventureiros.\n\n**Arbitre as Regras.** Você supervisiona a aplicação das regras do jogo pelo grupo, assegurando que elas promovam a diversão de todos. É fundamental ler o restante deste capítulo para compreender as regras, e o glossário de regras servirá como uma referência essencial.\n\n# Ritmo do Jogo\n\nOs três pilares fundamentais de D&D são a interação social, a exploração e o combate. Independentemente da experiência do jogador, o jogo se desenvolve seguindo esse padrão básico:\n\n1.  **O Mestre Descreve uma Cena.** O Mestre informa aos jogadores a localização de seus aventureiros e o que os rodeia, como a quantidade de portas em uma sala ou o que se encontra sobre uma mesa.\n2.  **Os Jogadores Descrevem as Ações de Seus Personagens.** Geralmente, os aventureiros permanecem juntos enquanto exploram uma masmorra ou outro ambiente. Às vezes, cada um pode executar ações diferentes: um personagem pode procurar um baú de tesouro, enquanto outro examina um símbolo misterioso gravado na parede, e um terceiro fica de vigia. Fora do combate, o Mestre garante que todos tenham a oportunidade de agir, decidindo como resolver cada ação. Durante o combate, os personagens agem em turnos.\n3.  **O Mestre Narra os Resultados das Ações dos Aventureiros.** Às vezes, a resolução de uma tarefa é simples. Se um aventureiro atravessar uma sala e tentar abrir uma porta, o Mestre pode simplesmente informar que a porta se abre e descrever o que está além. No entanto, a porta pode estar trancada, o chão pode esconder uma armadilha ou outras circunstâncias podem dificultar a conclusão da tarefa. Nesses casos, o Mestre pode solicitar que o jogador jogue um dado para determinar o resultado. A descrição desses resultados geralmente leva a uma nova decisão, reiniciando o processo na etapa 1.\n\n    Esse padrão se repete durante toda a sessão de jogo, seja enquanto os aventureiros dialogam com um nobre, exploram ruínas ou enfrentam um dragão. Em certas situações, especialmente em combate, a ação se torna mais organizada, e todos agem em turnos.\n\n    **Exceções Sobrepõe Regras Gerais**\n\n    Regras gerais norteiam cada aspecto do jogo. Por exemplo, as regras de combate determinam que ataques corpo a corpo utilizam Força, enquanto ataques à distância utilizam Destreza. Essa é uma regra geral, e ela se aplica desde que nada no jogo indique explicitamente o contrário.\n\n    O jogo também apresenta elementos — como características de classe, talentos, itens mágicos, propriedades de armas, habilidades de monstros, magias e similares — que, em algumas ocasiões, contradizem uma regra geral. Quando uma exceção entra em conflito com uma regra geral, a exceção prevalece. Por exemplo, se uma característica permite que você realize ataques corpo a corpo utilizando Carisma, você pode fazê-lo, mesmo que isso contrarie a regra geral.\n\n# Um Jogo Contínuo\n\nÀs vezes, uma sessão de D&D é um jogo completo em si (frequentemente chamada de “*one-shot*”), onde você participa de uma aventura curta que dura apenas uma sessão. No entanto, frequentemente as sessões de D&D estão interligadas em uma aventura mais longa que leva várias sessões para ser concluída, e essas aventuras podem ser encadeadas em uma narrativa mais ampla chamada campanha.\n\nUma campanha é como uma série de TV, enquanto uma aventura se assemelha a uma temporada dessa série. Já uma sessão de jogo é como um episódio único — pode ser independente, mas geralmente se liga à trama maior, se existir uma.\n\n## Aventuras\n\nUma aventura pode ser criada pelo Mestre ou adquirida (os exemplos neste capítulo são inspirados em uma aventura publicada, *A Maldição de Strahd*). Em ambos os casos, uma aventura apresenta um cenário fantástico, como uma masmorra subterrânea, uma selva deslumbrante ou uma cidade repleta de magia. Ela inclui um elenco de personagens não jogadores controlados pelo Mestre. Frequentemente, um dos PNJs é um vilão cuja intenção impulsiona grande parte da ação da aventura.\n\nDurante uma aventura, os aventureiros exploram ambientes, eventos e criaturas apresentados pelo Mestre. Batalhas, armadilhas, negociações, mistérios e muito mais emergem durante essas explorações.\n\nAs aventuras variam em duração e complexidade. Uma aventura curta pode incluir apenas alguns desafios e ser concluída em uma única sessão. Por outro lado, uma aventura longa pode envolver muitos combates, interações e outros desafios, durando dezenas de sessões.\n\n## Campanhas\n\nUma campanha é uma série de aventuras com um grupo consistente de aventureiros seguindo a narrativa.\n\nAlgumas campanhas são episódicas, onde cada aventura é uma história independente, e apenas os personagens dos jogadores as conectam à próxima. Outras campanhas apresentam enredos de longa duração, um elenco de PNJs recorrentes e temas que se estendem por várias aventuras, culminando em uma conclusão impactante.\n\nAssim como nas aventuras, um Mestre pode criar uma campanha do zero, montar uma campanha a partir de aventuras publicadas ou misturar material caseiro com material publicado. A campanha pode se passar em um mundo criado pelo Mestre ou em um cenário de campanha publicado, como Forgotten Realms, os Reinos Esquecidos, ou Greyhawk (este último é descrito no *Livro do Mestre*).\n\n**Arredondar para Baixo**\n\nSempre que você dividir ou multiplicar um número no jogo, arredonde para baixo se o resultado tiver uma fração, mesmo que essa fração seja igual ou maior que a metade. Algumas regras fazem exceção e indicam que se deve arredondar para cima.\n\n# Dados\n\nOs dados adicionam aleatoriedade ao jogo. Eles ajudam a determinar se personagens e monstros são bem-sucedidos nas coisas que tentam.\n\n## Notação de Dados\n\nOs dados utilizados em D&D são identificados pela letra *d* seguida pelo número de lados do dado: d4, d6, d8, d10, d12 e d20. Por exemplo, um d6 é um dado de seis lados (o cubo que muitos jogos utilizam). A ilustração nesta página mostra como é cada tipo de dado.\n\nQuando você precisa jogar dados, as regras indicam quantos dados de um determinado tipo devem ser jogados, além de quaisquer números a serem adicionados ou subtraídos. Por exemplo, “3d8 + 5” significa que você joga três dados de oito lados, soma os resultados e adiciona 5 ao total.\n\n### Dados de Porcentagem\n\nAs regras às vezes mencionam um d100. Embora esses dados existam, a forma comum de jogar 1d100 utiliza um par de dados de dez lados numerados de 0 a 9, conhecidos como dados de porcentagem. Um dado — que você escolhe antes de jogar — representa o dígito das dezenas, enquanto o outro representa o dígito das unidades. Se você tirar um 7 para o dígito das dezenas e um 1 para o dígito das unidades, por exemplo, o número obtido é 71. Dois 0s representam 100.\n\nAlguns dados de dez lados são numerados em dezenas (00, 10, 20 e assim por diante), o que facilita a distinção entre o dígito das dezenas e o dígito das unidades. Neste caso, uma jogada de 70 e 1 resulta em 71, enquanto 00 e 0 totalizam 100.\n\n### D3\n\nA mesma notação d aparece na expressão “1d3\", embora seja incomum encontrar dados com apenas três lados. Para simular a jogada de 1d3, jogue 1d6 e divida o resultado obtido por 2 (arredondando para cima).\n\n## Para que Servem os Dados?\n\nAqui estão os usos mais comuns dos dados em D&D.\n\n### Teste de D20\n\nO dado de 20 lados (d20) é o mais importante no jogo, sendo central para a mecânica principal — conhecida como Testes de D20 — que define se as criaturas têm sucesso ou falham em suas ações (consulte “Testes de D20” mais adiante neste capítulo). Sempre que seu personagem tenta algo que o Mestre considera ter uma chance de sucesso ou falha, você joga um d20. Quanto maior o resultado, maior a probabilidade de sucesso.\n\n**Interpretando Jogadas de Dados na História**\n\nParte da diversão de D&D é interpretar os resultados dos dados na história. A aleatoriedade introduzida pelos dados frequentemente traz elementos inesperados: um experiente falha, um novato tem sucesso ou surgem outras surpresas. Quando um Teste de D20 ou outra jogada gera um resultado inesperado, o Mestre descreve frequentemente de maneira divertida o que ocorreu. Se você é jogador, aproveite para interpretar as jogadas de dados do seu personagem e descrever por que as coisas aconteceram inesperadamente ou até humoradamente.\n\n### Dano\n\nO uso mais comum de dados diferentes do d20 é para determinar o dano. Ao realizar uma jogada de ataque bem-sucedida (um tipo de Teste de D20), você joga o dano para avaliar a eficácia do ataque. Ao conjurar uma magia, você também pode infligir dano. Diferentes armas e magias utilizam dados variados para causar dano. Por exemplo, uma Adaga usa 1d4, um Machado Grande usa 1d12 e uma magia *Bola de Fogo* usa 8d6.\n\n### Tabelas Aleatórias\n\nOcasionalmente, você encontrará uma tabela que utiliza uma jogada de dados para gerar um resultado aleatório. Nessas tabelas, você verá uma expressão de dado, como d10 ou d100, no cabeçalho da coluna mais à esquerda. Jogue esse dado e localize o número que você obteve (ou um intervalo que contenha esse número) nessa coluna. Leia essa linha para descobrir o resultado. Por exemplo, a tabela Bugigangas no capítulo 2 utiliza um d100.\n\n### Probabilidade Percentual\n\nÀs vezes, você pode encontrar uma regra que descreve a probabilidade percentual de algo ocorrer. Por exemplo, uma regra pode indicar que há 5% de chance de um evento acontecer. Você pode verificar se isso ocorre jogando dados de porcentagem; se o resultado for igual ou inferior à probabilidade percentual (de 01 a 05, neste caso), o evento acontece.\n\n# Os Seis Atributos\n\nTodas as criaturas — tanto personagens quanto monstros — possuem seis atributos que avaliam características físicas e mentais, conforme ilustrado na tabela Descrições dos Atributos.\n\n**Descrições dos Atributos**\n\n| **Atributo** | **Medidas de Pontuação...**       |\n|--------------|-----------------------------------|\n| Força        | Potência física                   |\n| Destreza     | Agilidade, reflexos e equilíbrio  |\n| Constituição | Saúde e resistência               |\n| Inteligência | Raciocínio e memória              |\n| Sabedoria    | Perceptividade e fortaleza mental |\n| Carisma      | Confiança, equilíbrio e charme    |\n\n## Valores de Atributo\n\nCada atributo possui um valor que varia de 1 a 20, embora alguns monstros possam ter um valor tão alto quanto 30. Esse valor representa a magnitude de um atributo. A tabela Valores de Atributo resume o significado dos valores.\n\n**Valores de Atributo**\n\n| **Valor** | **Significado**                                                                                                                      |\n|-----------|--------------------------------------------------------------------------------------------------------------------------------------|\n| 1         | Este é o valor mais baixo que um valor pode normalmente alcançar. Se um efeito reduz um valor a 0, esse efeito explica o que ocorre. |\n| 2-9       | Este representa uma capacidade fraca.                                                                                                |\n| 10-11     | Este representa a média humana.                                                                                                      |\n| 12-19     | Este representa uma capacidade forte.                                                                                                |\n| 20        | Este é o valor mais alto que um aventureiro pode atingir, a menos que uma característica diga o contrário.                           |\n| 21-29     | Este representa uma capacidade extraordinária.                                                                                       |\n| 30        | Este é o valor mais alto que um valor pode atingir.                                                                                  |\n\n## Modificadores de Atributo\n\nCada atributo possui um modificador que você aplica sempre que faz um Teste de D20 com esse atributo (explicado em “Testes de D20”). Um modificador de atributo é derivado de seu valor, conforme demonstrado na tabela Modificadores de Atributo.\n\n**Modificadores de Atributo**\n\n| **Valor** | **Modificador** |\n|-----------|-----------------|\n| 1         | -5              |\n| 2-3       | -4              |\n| 4-5       | -3              |\n| 6-7       | -2              |\n| 8-9       | -1              |\n| 10-11     | +0              |\n| 12-13     | +1              |\n| 14-15     | +2              |\n| 16-17     | +3              |\n| 18-19     | +4              |\n| 20-21     | +5              |\n| 22-23     | +6              |\n| 24-25     | +7              |\n| 26-27     | +8              |\n| 28-29     | +9              |\n| 30        | +10             |\n\n# Testes de D20\n\nQuando o resultado de uma ação é incerto, o jogo utiliza um teste de d20 para determinar o sucesso ou fracasso. Essas jogadas são conhecidas como Testes de D20 e se dividem em três tipos: testes de atributo, salvaguardas e jogadas de ataque. Elas seguem as seguintes etapas:\n\n1.  **Jogue um 1d20.** Você sempre deseja tirar um valor alto. Se a jogada tem Vantagem ou Desvantagem (explicadas mais adiante neste capítulo), você joga dois d20, mas utiliza apenas o número de um deles — o maior se tiver Vantagem ou o menor se tiver Desvantagem.\n2.  **Adicione Modificadores.** Adicione estes modificadores ao número obtido no d20:\n    -   **O Modificador de Atributo Relevante**. Este capítulo e o glossário de regras explicam quais modificadores de atributo utilizar para diversos Testes de D20.\n    -   **Seu Bônus de Proficiência, se Aplicável.** Cada criatura possui um Bônus de Proficiência, um número que é adicionado ao realizar um Teste de D20 que utiliza algo, como uma perícia, na qual a criatura é proficiente. Veja “Proficiência” mais adiante neste capítulo.\n    -   **Bônus e Penalidades Circunstanciais.** Uma característica, uma magia ou outra regra pode dar um bônus ou penalidade à jogada.\n3.  **Compare o Total com um Número-Alvo.** Se o total do d20 e seus modificadores for igual ou superior ao número-alvo, o Teste de D20 é bem-sucedido. Caso contrário, ele falha. O Mestre determina os números-alvo e informa aos jogadores se seus testes foram bem-sucedidos. O número-alvo para um teste de atributo ou uma salvaguarda é chamado de Classe de Dificuldade (CD). O número-alvo para uma jogada de ataque é denominado Classe de Armadura (CA), que aparece em uma ficha de personagem ou em um bloco de estatísticas (veja o glossário de regras).\n\n## Testes de Atributo\n\nUm teste de atributo representa uma criatura utilizando talento e treinamento para tentar superar um desafio, como forçar a abertura de uma porta trancada, arrombar uma fechadura, entreter uma multidão ou decifrar um símbolo. O Mestre e as regras geralmente exigem um teste de atributo quando uma criatura tenta algo diferente de um ataque que possui uma chance de falha significativa. Quando o resultado é incerto e narrativamente interessante, os dados determinam o resultado.\n\n### Modificador de Atributo\n\nUm teste de atributo é nomeado pelo modificador de atributo que utiliza: um teste de Força, um teste de Inteligência e assim por diante. Diferentes testes de atributo são necessários em diversas situações, dependendo de qual atributo é mais relevante. Veja a tabela Exemplos de Teste de Atributo para ver exemplos de uso de cada teste.\n\n**Um Teste de D20 pode resultar em um sucesso dramático, uma realização simples ou uma catástrofe.**\n\n**Exemplos de Teste de Atributo**\n\n| **Atributo** | **Realize um Teste Para ...**                              |\n|--------------|------------------------------------------------------------|\n| Força        | Levantar, empurrar, puxar ou quebrar algo                  |\n| Destreza     | Mover-se de maneira ágil, rápida ou silenciosa             |\n| Constituição | Forçar seu corpo além dos limites normais                  |\n| Inteligência | Raciocinar ou lembrar                                      |\n| Sabedoria    | Notar coisas no ambiente ou no comportamento das criaturas |\n| Carisma      | Influenciar, entreter ou enganar                           |\n\n### Bônus de Proficiência\n\nAdicione seu Bônus de Proficiência a um teste de atributo quando o Mestre determinar que uma perícia ou proficiência com uma ferramenta é relevante para o teste e você possui essa proficiência. Por exemplo, se uma regra mencionar um teste de Força (Acrobacia ou Atletismo), você pode adicionar seu Bônus de Proficiência ao teste se tiver proficiência na perícia Acrobacia ou Atletismo. Veja “Proficiência” mais adiante neste capítulo para mais informações sobre proficiência com perícias e ferramentas.\n\n### Classe de Dificuldade\n\nA Classe de Dificuldade de um teste de atributo indica a dificuldade da tarefa. Quanto mais desafiadora a tarefa, maior será sua CD. As regras oferecem CDs para determinados testes, mas o Mestre é quem as define. A tabela Classes de Dificuldade Padrão apresenta uma variedade de CDs possíveis para testes de atributo.\n\n**Classes de Dificuldade Padrão**\n\n| **Dificuldade da Tarefa** | **CD** | **Dificuldade da Tarefa** | **CD** |\n|---------------------------|--------|---------------------------|--------|\n| Muito fácil               | 5      | Difícil                   | 20     |\n| Fácil                     | 10     | Muito difícil             | 25     |\n| Média                     | 15     | Quase impossível          | 30     |\n\n## Salvaguardas\n\nUma salvaguarda - também abreviada como SG - representa uma tentativa de evitar ou resistir a uma ameaça, como uma explosão flamejante, uma liberação de gás venenoso ou uma magia que tenta invadir sua mente. Normalmente, você não escolhe realizar uma salvaguarda; você deve fazê-la porque seu personagem ou um monstro (se você for o Mestre) está em perigo. O resultado de uma salvaguarda é detalhado no efeito que a provocou.\n\nSe você não quiser resistir ao efeito, pode optar por falhar na salvaguarda sem jogá-la.\n\n### Modificador de Atributo\n\nAs salvaguardas são nomeadas pelos modificadores de atributo que utilizam: uma salvaguarda de Constituição, uma salvaguarda de Sabedoria e assim por diante. Diferentes salvaguardas são utilizadas para resistir a diferentes tipos de efeitos, conforme mostrado na tabela Exemplos de Salvaguardas.\n\n**Exemplos de Salvaguarda**\n\n| **Atributo** | **Realize uma SG para...**          |\n|--------------|-------------------------------------|\n| Força        | Resistir fisicamente à força direta |\n| Destreza     | Esquivar-se do perigo               |\n| Constituição | Suportar um risco tóxico            |\n| Inteligência | Reconhecer uma ilusão como falsa    |\n| Sabedoria    | Resistir a um ataque mental         |\n| Carisma      | Afirmar sua identidade              |\n\n### Bônus de Proficiência\n\nVocê adiciona seu Bônus de Proficiência à sua salvaguarda se tiver proficiência nesse tipo de salvaguarda. Veja “Proficiência” mais adiante neste capítulo.\n\n### Classe de Dificuldade\n\nA Classe de Dificuldade para uma salvaguarda é determinada pelo efeito que a causa ou pelo Mestre. Por exemplo, se uma magia exigir que você realize uma salvaguarda, a CD é determinada pelo atributo de conjuração e pelo Bônus de Proficiência do conjurador. Habilidades de monstros que requerem salvaguardas especificam a CD.\n\n## Jogadas de Ataque\n\nUma jogada de ataque determina se um ataque atinge um alvo. Uma jogada de ataque acerta se o resultado for igual ou superior à Classe de Armadura do alvo. As jogadas de ataque geralmente ocorrem em batalha, conforme descrito em “Combate” mais adiante neste capítulo, mas o Mestre também pode solicitar uma jogada de ataque em outras situações, como em uma competição de arco e flecha.\n\n### Modificador de Atributo\n\nA tabela Atributos de Jogada de Ataque mostra qual modificador de atributo usar para diferentes tipos de jogadas de ataque.\n\n**Atributos de Jogada de Ataque**\n\n| **Atributo** | **Tipo de Ataque**                                                                                                                   |\n|--------------|--------------------------------------------------------------------------------------------------------------------------------------|\n| Força        | Ataque corpo a corpo com uma arma ou um Ataque Desarmado (veja o glossário de regras)                                                |\n| Destreza     | Ataque à distância com uma arma                                                                                                      |\n| Varia        | Ataque mágico (o atributo utilizado é determinado pela característica de conjuração do conjurador, conforme explicado no capítulo 7) |\n\nAlgumas características permitem que você utilize modificadores de atributo diferentes dos listados. Por exemplo, a propriedade Acuidade (veja o capítulo 6) permite que você use Força ou Destreza com uma arma que possua essa propriedade.\n\n### Bônus de Proficiência\n\nVocê adiciona seu Bônus de Proficiência à sua jogada de ataque ao usar uma arma com a qual tem proficiência, assim como ao atacar com uma magia. Veja “Proficiência” mais adiante neste capítulo para mais informações sobre proficiência com armas.\n\n### Classe de Armadura\n\nA Classe de Armadura de uma criatura indica quão eficazmente ela evita ser ferida em combate. A CA de um personagem é definida durante a criação dele (veja o capítulo 2), enquanto a CA de um monstro é apresentada em seu bloco de estatísticas.\n\n**Calculando a CA.** Todas as criaturas começam com o mesmo cálculo básico de CA:\n\n-   **CA base =** 10 + o modificador de Destreza da criatura.\n\n    A CA de uma criatura pode, então, ser alterada por armaduras, itens mágicos, magias e outros efeitos.\n\n    **Apenas Uma CA Base.** Algumas magias e características de classe oferecem aos personagens uma forma alternativa de calcular sua CA. Um personagem com várias características que proporcionam diferentes métodos de cálculo de CA deve escolher qual utilizar; apenas um cálculo base pode estar em vigor para uma criatura.\n\n### Tirando 20 ou 1\n\nSe você tirar um 20 no d20 (conhecido como “20 natural\") em uma jogada de ataque, o ataque acerta independentemente de quaisquer modificadores ou da Classe de Armadura (CA) do alvo. Isso é chamado de Acerto Crítico (veja “Combate” mais adiante neste capítulo).\n\nSe você tirar um 1 no d20 (um “1 natural\") em uma jogada de ataque, o ataque erra independentemente de quaisquer modificadores ou da CA do alvo.\n\n## Vantagem/Desvantagem\n\nÀs vezes, um teste de D20 é alterado por Vantagem ou Desvantagem. Vantagem representa as circunstâncias favoráveis em torno de uma jogada de d20, enquanto Desvantagem representa circunstâncias desfavoráveis.\n\nVocê normalmente obtém Vantagem ou Desvantagem ao utilizar habilidades e ações especiais. O Mestre também pode determinar que circunstâncias conferem Vantagem ou impõe Desvantagem.\n\n### Jogue Dois D20\n\nQuando uma jogada tem Vantagem ou Desvantagem, jogue um segundo d20 ao realizar a jogada. Utilize a maior das duas jogadas se tem Vantagem e a menor se tem Desvantagem. Por exemplo, se você tem Desvantagem e tira um 18 e um 3, use o 3. Se, ao contrário, você tem Vantagem e tira esses números, utilize o 18.\n\n### Eles Não Acumulam\n\nSe várias situações concederem Vantagem em um teste, você ainda joga apenas dois d20. Da mesma forma, se várias situações impuserem Desvantagem, você também joga apenas dois d20.\n\nSe as circunstâncias resultarem em um teste com Vantagem e Desvantagem, o teste não tem nenhuma delas, e você joga somente um d20. Isso se aplica mesmo que várias circunstâncias imponham Desvantagem e apenas uma conceda Vantagem, ou vice-versa. Nessa situação, você não tem Vantagem nem Desvantagem.\n\n**Se você tem Vantagem, use 18. Se você tem Desvantagem, use 3.**\n\n### Interações com Novas Jogadas\n\nQuando você tem Vantagem ou Desvantagem e algo no jogo permite que você jogue novamente ou substitua o d20, você pode jogar novamente ou substituir apenas um dos dados, não ambos. Você escolhe qual.\n\nPor exemplo, se você tiver Inspiração Heroica (veja a barra lateral) e tirar um 3 e um 18 em um teste de atributo que tenha Vantagem ou Desvantagem, você pode gastar sua Inspiração Heroica para jogar novamente um desses dados, mas não ambos.\n\n**Inspiração Heroica**\n\nÀs vezes, o Mestre ou uma regra lhe concede Inspiração Heroica. Se você tiver Inspiração Heroica, pode gastá-la para jogar novamente qualquer dado imediatamente após jogá-lo, e deve usar o novo resultado.\n\n**Apenas uma de Cada Vez.** Você nunca pode ter mais de uma Inspiração Heroica. Se algo lhe conceder Inspiração Heroica e você já a possuir, pode transferi-la para um personagem do seu grupo que não a tenha.\n\n**Obtendo Inspiração Heroica.** Seu Mestre pode lhe conceder Inspiração Heroica por diversos motivos. Normalmente, os Mestres premiam isso quando você realiza algo especialmente heroico, de caráter ou interessante. É uma recompensa por tornar o jogo mais divertido para todos os participantes.\n\nOutras regras podem permitir que seu personagem obtenha Inspiração Heroica independentemente da decisão do Mestre. Por exemplo, personagens Humanos começam cada dia com Inspiração Heroica.\n\n# Proficiência\n\nPersonagens e monstros são competentes em diversas áreas. Alguns são habilidosos com várias armas, enquanto outros dominam apenas algumas. Alguns se destacam em compreender os motivos das pessoas, enquanto outros são mais aptos a desvendar os segredos do multiverso. Todas as criaturas possuem um Bônus de Proficiência, que reflete o impacto do treinamento nas habilidades da criatura. O Bônus de Proficiência de um personagem aumenta conforme ele alcança níveis (descrito no capítulo 2). O Bônus de Proficiência de um monstro é baseado em seu Nível de Desafio (veja o glossário de regras). A tabela Bônus de Proficiência mostra como o bônus é determinado.\n\nEste bônus é aplicado a um Teste de D20 quando a criatura possui proficiência em uma perícia, em uma salvaguarda ou com um item que utiliza para realizar o Teste de D20. O bônus também se aplica a ataques mágicos e ao cálculo da CD de salvaguardas para evitar magias.\n\n**Bônus de Proficiência**\n\n| **Nível ou ND** | **Bônus** | **Nível ou ND** | **Bônus** |\n|-----------------|-----------|-----------------|-----------|\n| Até 4           | 2         | 17–20           | 6         |\n| 5–8             | 3         | 21–24           | 7         |\n| 9–12            | 4         | 25–28           | 8         |\n| 13–16           | 5         | 29–30           | 9         |\n\n## O Bônus Não Acumula\n\nSeu Bônus de Proficiência não pode ser adicionado a uma jogada de dados ou a outro número mais de uma vez. Por exemplo, se uma regra permitir que você realize um teste de Carisma (Enganação ou Persuasão), você adiciona seu Bônus de Proficiência se for proficiente em qualquer uma das perícias, mas não o adiciona duas vezes se for proficiente em ambas.\n\nOcasionalmente, um Bônus de Proficiência pode ser multiplicado ou dividido (por exemplo, duplicado ou reduzido pela metade) antes de ser adicionado. Por exemplo, a característica Especialista (veja o glossário de regras) dobra o Bônus de Proficiência para determinados testes de atributo. Sempre que o bônus for utilizado, ele pode ser multiplicado apenas uma vez e dividido apenas uma vez.\n\n## Proficiências em Perícias\n\nA maioria dos testes de atributo envolve o uso de uma perícia, que representa uma categoria de ações que as criaturas tentam realizar com um teste de atributo. As descrições das ações que você executa (veja “Ações” mais adiante neste capítulo) especificam qual perícia se aplica caso você realize um teste de atributo para essa ação, e muitas outras regras indicam quando uma perícia é relevante. O Mestre tem a palavra final sobre a relevância de uma perícia em uma situação.\n\nSe uma criatura for proficiente em uma perícia, ela aplica seu Bônus de Proficiência a testes de atributo relacionados a essa perícia. Sem proficiência, a criatura ainda pode realizar testes de atributo envolvendo essa perícia, mas não adiciona seu Bônus de Proficiência. Por exemplo, se um personagem tentar escalar um penhasco, o Mestre pode solicitar um teste de Força (Atletismo). Se o personagem tiver proficiência em Atletismo, ele adiciona seu Bônus de Proficiência ao teste de Força. Caso contrário, ele realiza o teste sem incluir seu Bônus de Proficiência.\n\n**Perícias**\n\n| **Perícia**       | **Atributo** | **Exemplos de Usos**                                                                       |\n|-------------------|--------------|--------------------------------------------------------------------------------------------|\n| Acrobacia         | Destreza     | Manter-se em pé em uma situação complicada ou realizar uma acrobacia.                      |\n| Arcanismo         | Inteligência | Recordar conhecimentos sobre magias, itens mágicos e planos de existência.                 |\n| Atletismo         | Força        | Pular mais longe do que o normal, manter-se à tona em águas agitadas ou quebrar algo.      |\n| Atuação           | Carisma      | Atuar, contar uma história, tocar música ou dançar.                                        |\n| Enganação         | Carisma      | Contar uma mentira convincente ou usar um disfarce de forma convincente.                   |\n| Furtividade       | Destreza     | Evitar ser notado movendo-se silenciosamente e se escondendo atrás de objetos.             |\n| História          | Inteligência | Relembrar fatos sobre eventos históricos, pessoas, nações e culturas.                      |\n| Intimidação       | Carisma      | Atemorizar ou ameaçar alguém para que faça o que você quer.                                |\n| Intuição          | Sabedoria    | Perceber o humor e as intenções de uma pessoa.                                             |\n| Investigação      | Inteligência | Encontrar informações obscuras em livros ou deduzir como algo funciona.                    |\n| Lidar com Animais | Sabedoria    | Acalmar ou treinar um animal, ou fazer com que ele se comporte de uma determinada maneira. |\n| Medicina          | Sabedoria    | Diagnosticar uma doença ou determinar o que matou uma pessoa que morreu recentemente.      |\n| Natureza          | Inteligência | Relembrar fatos sobre o terreno, as plantas, os animais e o clima.                         |\n| Percepção         | Sabedoria    | Usando uma combinação de sentidos, notar algo que é fácil de passar despercebido.          |\n| Persuasão         | Carisma      | Convencer alguém de algo de forma honesta e graciosa.                                      |\n| Prestidigitação   | Destreza     | Furtar um bolso, ocultar um objeto portátil ou fazer truque com as mãos.                   |\n| Religião          | Inteligência | Relembrar fatos sobre deuses, rituais religiosos e símbolos sagrados.                      |\n| Sobrevivência     | Sabedoria    | Seguir rastros, procurar alimentos, encontrar uma trilha ou evitar perigos naturais.       |\n\n### Lista de Perícias\n\nAs perícias são apresentadas na tabela Perícias, que mostra os exemplos de uso para cada proficiência em perícia, assim como o teste de atributo ao qual a perícia se aplica com mais frequência.\n\n### Determinando Perícias\n\nAs proficiências em perícias iniciais de um personagem são definidas durante a criação do personagem, enquanto as proficiências em perícias de um monstro estão presentes em seu bloco de estatísticas.\n\n**Perícias com Atributos Diferentes**\n\nCada proficiência com perícia está vinculada a um teste de atributo. Por exemplo, a perícia Intimidação está relacionada ao Carisma. Em algumas situações, o Mestre pode permitir que você utilize sua proficiência com perícia em um teste de atributo diferente. Por exemplo, se um personagem tentar intimidar alguém por meio de uma demonstração de força física, o Mestre pode solicitar um teste de Força (Intimidação) em vez de um teste de Carisma (Intimidação). Esse personagem realizaria um teste de Força e adicionaria seu Bônus de Proficiência se tiver proficiência com Intimidação.\n\n### Proficiências em Salvaguarda\n\nA proficiência com uma salvaguarda permite que um personagem adicione seu Bônus de Proficiência a salvaguardas que utilizam um atributo específico. Por exemplo, a proficiência com salvaguardas de Sabedoria permite que você some seu Bônus de Proficiência às suas salvaguardas de Sabedoria. Alguns monstros também possuem proficiência em salvaguardas, conforme indicado em seus blocos de estatísticas.\n\nCada classe concede proficiência em pelo menos duas salvaguardas, refletindo o treinamento dessa classe para evitar ou resistir a determinadas ameaças. Os magos, por exemplo, são proficientes com salvaguardas de Inteligência e Sabedoria; eles se preparam para resistir a ataques mentais.\n\n## Proficiências em Equipamentos\n\nUm personagem adquire proficiência com diversas armas e ferramentas de sua classe e antecedentes. Existem duas categorias de proficiência em equipamentos:\n\n**Armas.** Qualquer um pode empunhar uma arma, mas a proficiência faz com que você a utilize melhor. Se você possui proficiência com uma arma, adiciona seu Bônus de Proficiência às jogadas de ataque que realizar com ela.\n\n**Ferramentas.** Se você possui proficiência com uma ferramenta, pode adicionar seu Bônus de Proficiência a qualquer teste de atributo que utilize essa ferramenta. Se você tem Proficiência na perícia que também é aplicada nesse teste, você também obtém Vantagem no teste. Isso significa que você pode se beneficiar tanto da proficiência em perícias quanto da proficiência em ferramentas no mesmo teste de atributo.\n\n# Ações\n\nAo realizar algo além de se mover ou se comunicar, você normalmente executa uma ação. A tabela Ações apresenta as principais ações do jogo, que são definidas com mais detalhes no glossário de regras.\n\n**Ações**\n\n| **Ação**    | **Resumo**                                                                                                                                                                                                                       |\n|-------------|----------------------------------------------------------------------------------------------------------------------------------------------------------------------------------------------------------------------------------|\n| Ajudar      | Ajudar no teste de atributo ou na jogada de ataque de outra criatura ou prestar primeiros socorros.                                                                                                                              |\n| Analisar    | Realizar um teste de Inteligência (Arcanismo, História, Investigação, Natureza ou Religião).                                                                                                                                     |\n| Atacar      | Atacar com uma arma ou um Ataque Desarmado.                                                                                                                                                                                      |\n| Correr      | Pelo resto do turno, dê a si mesmo um movimento adicional igual ao seu Deslocamento.                                                                                                                                             |\n| Desengajar  | Seu movimento não provoca Ataques de Oportunidade pelo resto do turno.                                                                                                                                                           |\n| Esconder-se | Realizar um teste de Destreza (Furtividade).                                                                                                                                                                                     |\n| Esquivar    | Até o início do seu próximo turno, jogadas de ataque contra você têm Desvantagem, e você realiza salvaguardas de Destreza com Vantagem. Você perde este benefício se tiver a condição Incapacitado ou se seu Deslocamento for 0. |\n| Influenciar | Realizar um teste de Carisma (Atuação, Enganação, Intimidação ou Persuasão) ou Sabedoria (Lidar com Animais) para alterar a atitude de uma criatura.                                                                             |\n| Preparar    | Preparar-se para executar uma ação em resposta a um gatilho que você define.                                                                                                                                                     |\n| Procurar    | Realizar um teste de Sabedoria (Intuição, Medicina, Percepção ou Sobrevivência).                                                                                                                                                 |\n| Usar Magia  | Conjurar uma magia, usar um item mágico ou usar uma característica mágica.                                                                                                                                                       |\n| Usar Objeto | Utilizar um objeto não mágico.                                                                                                                                                                                                   |\n\nPersonagens dos jogadores e monstros também podem executar ações que não estão cobertas por essas opções. Muitas características de classe e outras habilidades oferecem alternativas de ação adicionais, e você pode improvisar outras. Quando você descreve uma ação que não está detalhada em outras partes das regras, o Mestre informará se essa ação é viável e que tipo de Teste de D20 você deve realizar, se necessário.\n\n## Uma Coisa de Cada Vez\n\nO jogo utiliza ações para determinar o quanto de coisas você pode fazer simultaneamente. Você pode executar apenas uma ação por vez. Este princípio é especialmente relevante em combate, como será explicado em “Combate” mais adiante neste capítulo.\n\nAs ações também podem surgir em outras situações; em uma interação social, você pode tentar influenciar uma criatura ou executar a ação Procurar para interpretar a linguagem corporal da criatura, mas não pode executar ambas as ações ao mesmo tempo. E quando você está explorando uma masmorra, não é possível executar simultaneamente a ação Procurar para buscar armadilhas e a ação Ajudar para auxiliar outro personagem que está tentando abrir uma porta presa (com a ação Usar Objeto).\n\n## Ações Bônus\n\nVárias características de classe, magias e outras habilidades permitem que você execute uma ação adicional em seu turno chamada Ação Bônus. A característica Ação Ardilosa, por exemplo, possibilita que um Ladino execute uma Ação Bônus. Você pode executar uma Ação Bônus apenas quando uma habilidade especial, uma magia ou outra característica do jogo indicar que você pode fazer algo como uma Ação Bônus. Caso contrário, você não tem uma Ação Bônus disponível para usar.\n\nVocê pode executar apenas uma Ação Bônus em seu turno, portanto, deve escolher qual Ação Bônus utilizar se tiver mais de uma disponível.\n\nVocê decide quando executar uma Ação Bônus durante seu turno, a menos que o tempo da Ação Bônus esteja especificado. Qualquer fator que limite sua capacidade de executar ações também o impede de executar uma Ação Bônus.\n\n## Reações\n\nCertas habilidades especiais, magias e situações permitem que você execute uma ação especial chamada Reação. Uma Reação é uma resposta imediata a um gatilho de algum tipo, que pode ocorrer tanto no seu turno quanto no de outra pessoa. O Ataque de Oportunidade, descrito mais adiante neste capítulo, é o tipo mais comum de Reação.\n\nAo executar uma Reação, você não pode executar outra até o início do seu próximo turno. Se a reação interromper o turno de outra criatura, essa criatura pode continuar o turno dela imediatamente após a Reação.\n\nEm termos de tempo, uma Reação acontece imediatamente após seu gatilho, a menos que a descrição da Reação indique o contrário.\n\n**O Que o Seu Personagem Faria?**\n\nPergunte a si mesmo enquanto joga: “O que meu personagem faria?”. Interpretar um papel envolve entrar na mente de outra pessoa e compreender o que a motiva e como essas motivações se traduzem em ações. Em D&D, essas ações se desenrolam em um mundo fantástico repleto de situações que só podemos imaginar. Como seu personagem reage a essas circunstâncias?\n\nEste conselho vem com uma ressalva importante: evite escolher personagens que comprometam a diversão dos outros jogadores e do Mestre. Opte por ações que encantem você e seus amigos.\n\n**Personagens utilizam todo o seu charme ao negociar itens mágicos com uma megera verde.**\n\n# Interação Social\n\nDurante suas aventuras, os personagens dos jogadores encontram diversas pessoas e enfrentam alguns monstros que preferem dialogar a lutar. Nessas situações, é o momento da interação social, que pode assumir várias formas. Por exemplo, você pode tentar convencer um ladrão a confessar seus crimes ou tentar bajular um guarda. O Mestre assume os papéis de quaisquer personagens não-jogadores que estejam envolvidos.\n\nA atitude de um PNJ em relação ao seu personagem pode ser Amigável, Indiferente ou Hostil, conforme definido no glossário de regras. PNJs amigáveis estão dispostos a ajudar, enquanto os hostis tendem a atrapalhar.\n\nAs interações sociais progridem de duas formas: através de interpretação e de testes de\n\natributo.\n\n## Interpretação\n\nA interpretação é, literalmente, o ato de desempenhar um papel. Nesse contexto, é você, como jogador, quem decide como seu personagem pensa, age e fala. A interpretação permeia todos os aspectos do jogo e se destaca durante as interações sociais.\n\nAo interpretar, leve em conta se você prefere uma abordagem ativa ou descritiva, cada uma das quais é detalhada em “Exemplo de Interação Social”.\n\nO Mestre utiliza a personalidade de um PNJ e as ações e atitudes de seu personagem para definir como um PNJ reage. Um bandido covarde pode se render sob ameaças de prisão. Uma comerciante teimosa se recusa a ajudar se os personagens a importunem. Um dragão vaidoso se regozija com elogios.\n\nAo interagir com um PNJ, preste atenção à representação que o Mestre faz da personalidade do PNJ. Você pode descobrir os objetivos de um PNJ e, em seguida, usar essas informações para influenciá-lo.\n\nSe você oferecer aos PNJs algo que desejam ou brincar com suas simpatias, medos ou objetivos, poderá formar amizades, evitar a violência ou obter informações importantes. Por outro lado, se você insultar um guerreiro orgulhoso ou falar mal dos aliados de um nobre, suas tentativas de convencer ou enganar provavelmente falharão.\n\n## Testes de Atributo\n\nOs testes de atributo podem ser essenciais para determinar o resultado de uma interação social. Seus esforços de interpretação podem modificar a atitude de um PNJ, mas ainda pode haver um elemento de sorte se o Mestre optar por jogar dados para influenciar a resposta de um PNJ a você. Em tais situações, o Mestre normalmente solicitará que você execute a ação Influenciar.\n\nPreste atenção às suas proficiências em perícia ao considerar como você interage com um PNJ; adote uma abordagem que se baseie nas proficiências em perícia do seu grupo. Por exemplo, se o grupo precisar enganar um guarda para que ele os deixe entrar em um castelo, o Ladino proficiente com Enganação deve conduzir a conversa.\n\n# Exemplo de Interação Social\n\nNesta cena, os jogadores participam de um encontro de interação social. Você e seu grupo decidem como cenas semelhantes se desenrolam em suas aventuras.\n\n*Quatro aventureiros — Shreeve, Mirabella, Auro e Gareth — viajaram até a taverna Sangue da Vinha, na sombria vila de Baróvia.*\n\n**Jairo (como Mestre):** Essa taverna pode ter sido bem decorada no passado, mas se tornou precária com o passar dos anos. O fogo ardente na lareira mal aquece o ambiente. Vocês veem um homem atrás do balcão, limpando copos de forma metódica. Três mulheres mais velhas se amontoam em uma mesa. Um belo jovem senta-se sozinho em uma mesa de canto, tomando uma taça de vinho. Ele olha para cima quando vocês entram, mas as outras pessoas os ignoram. “Bem-vindos a Baróvia\", diz ele. Ele mostra uma moeda para o taverneiro: “Uma jarra para os visitantes”. O brilho da prata atrai a atenção do homem atrás do balcão.\n\n**Eva (como Mirabella):** “Obrigado, amigo. Podemos saber a quem estamos em dívida?”\n\n**Jairo:** “Eu sou Ismark Kolyanovich, embora por aqui eu seja frequentemente chamado de Ismark, o Menor”.\n\n**Rubens (como Shreeve):** “Isso é lamentável”.\n\n**Jairo:** “De fato. Espero um dia seguir o exemplo de meu pai e me livrar desse título. E então, meus novos amigos, quem são vocês?”.\n\n**Amanda (como Auro):** “Eu sou Auro”.\n\n**Rubens:** “Shreeve”.\n\n**Felipe (como Gareth):** “Meu nome é Gareth”.\n\n**Eva (como Mirabella):** “Eu me chamo Mirabella. Você disse que seu nome era Kolyanovich. Você é parente de Kolyan Indirovich, o burgomestre desta aldeia?”\n\n**Jairo:** Ele parece um pouco surpreso. Ele diz: “Kolyan Indirovich é meu estimado pai, sim”.\n\n**Eva:** “Então foi ele quem nos convocou!”. Mostro a ele a carta que nos trouxe até aqui.\n\n**Felipe:** Eu observo a reação dele, enquanto ele lê a carta.\n\n**Jairo:** Ele se move para pegar a carta, mas se afasta antes de tocá-la. “Aquele selo... não é do meu pai”. Gareth, realize um teste de Sabedoria (Intuição).\n\n**Felipe:** Gareth tirou 18.\n\n**Jairo:** Você percebe que Ismark está tentando esconder seu terror. Ele tem medo até de tocar no selo da carta.\n\n**Felipe:** Eu pergunto o que o está assustando.\n\n**Rubens:** “Sim, de quem é o selo?”.\n\n**Jairo:** “Do Diabo Strahd”.\n\n**Amanda:** “Parece um sujeito agradável”.\n\n**Jairo:** “Jamais! Ele é o senhor vampiro do Castelo Ravenloft e uma praga para minha irmã. Vocês devem ajudá-la!”.\n\n-   **Interpretação Ativa.** Observe ao longo do exemplo como Rubens e Amanda interpretam ativamente o comportamento de seus personagens. Nessa abordagem ativa, eles falam com as vozes de seus personagens, como um ator que assume um papel. Os jogadores podem até imitar a linguagem corporal de seus personagens. Eles ainda precisam descrever aspectos que não podem ser razoavelmente representados.\n-   **Interpretação Descritiva.** Observe como Felipe descreve as palavras e ações de seu personagem. Com base em sua imagem mental do personagem, ele relata o que o personagem faz e como executa essas ações. Se essa abordagem for mais confortável para você, considere o seguinte:\n    -   Descreva as emoções e atitudes do seu personagem.\n    -   Concentre-se na intenção do seu personagem e em como os outros podem percebê-la.\n    -   Forneça o máximo de detalhes com os quais você se sinta confortável.\n-   Não se preocupe em fazer as coisas exatamente certas. Concentre-se no que seu personagem faria e descreva o que você vê em sua mente.\n-   **Testes de Atributo.** O personagem de Felipe, Gareth, realiza um teste de Sabedoria (Intuição) para perceber os sinais não expressos de Ismark. A Sabedoria é o atributo que mede a percepção e a intuição. Intuição reflete a capacidade de um personagem em interpretar o humor e as intenções de outras pessoas. O Mestre estabeleceu a CD em 15, que Gareth supera. Com um teste bem-sucedido de Sabedoria (Intuição), Gareth obtém informações que não eram evidentes e, portanto, não faziam parte da narração anterior do Mestre. Para mais detalhes, consulte “Valores de Atributo” e “Proficiência” no início deste capítulo, além da ação Procurar no glossário de regras.\n\n    **Amanda:** “Então Strahd escreveu esta carta, fingindo ser o burgomestre, implorando que viéssemos até a Baróvia e resgatássemos Irene Kolyana de uma aflição mortal... quem é ele? Por que ele faria isso?”.\n\n    **Rubens:** “Por que ele iria querer que viéssemos até aqui?”.\n\n    **Eva:** “Claramente, ele não acha que somos uma ameaça”.\n\n    **Amanda:** “Bem, ele ainda não nos conheceu!”.\n\n    **Jairo:** “Ele está brincando com vocês. Ele se deleita na destruição de todas as coisas boas, como minha querida irmã”.\n\n    **Felipe:** Gareth se aproxima e, com compaixão, pergunta a Ismark se sua irmã foi mordida pelo vampiro.\n\n    **Jairo:** Por favor, realize um teste de Carisma (Persuasão) para ver o quão bem ele responde à sua maneira piedosa. Você tem Vantagem porque ele é Amigável.\n\n    **Felipe:** Ah, que bom. Minha primeira jogada foi um 7, mas com Vantagem... aff, não muito melhor. Bem, 10 mais 5 é 15.\n\n    **Jairo:** Ismark se inclina na sua direção, Gareth, lançando um olhar desconfiado para as outras pessoas na taverna, como se temesse que estivessem ouvindo. Em um sussurro tenso, ele diz: “O Diabo Strahd deseja fazer de Irene seu novo brinquedo. Duas vezes ele a visitou durante a noite, usando sua malícia para conseguir um convite para entrar na casa — pois não pode entrar sem ser convidado. Duas vezes ele a mordeu, mas ela ainda luta para viver. Contudo, temo que ela não resista a mais uma visita!”\n\n    **Rubens:** “Está certo, Ismark. Você nos ofereceu bebidas e compartilhou informações sobre o Diabo Strahd e sua irmã. O que podemos fazer para ajudar?”\n\n    **Jairo:** “Você é muito gentil! Primeiro, preciso da sua ajuda para levar Irene até a aldeia de Vallaki”.\n\n    **Eva:** “Onde fica Vallaki?”\n\n    **Jairo:** “Fica a noroeste, no coração do vale. No voo do corvo, são menos de quinze quilômetros, mas a estrada serpenteia entre colinas e bosques, e a jornada leva pelo menos cinco horas a uma velocidade moderada”.\n\n    **Rubens:** “E por que lá?”\n\n    **Jairo:** “A aldeia está fora da vista do Castelo Ravenloft, então espero que também esteja fora do alcance dos espiões de Strahd. Ouvi dizer que Vallaki é bem defendida, com uma paliçada de madeira e portões de ferro”.\n\n    **Rubens:** “Como se tais defesas impedissem um vampiro”.\n\n    **Jairo:** “De fato. Mas se a movermos para lá, podemos mantê-lo longe dela por alguns dias. Aí teremos tempo para a segunda parte da nossa tarefa”.\n\n    **Rubens:** “Uma parte em que você nos ajuda?”.\n\n    **Jairo:** “Sim, quando eu ajudo vocês a enfrentarem o vampiro!”.\n\n-   **Influenciando PNJs.** Gareth executa a ação Influenciar (veja o glossário de regras), que os personagens podem usar para persuadir um PNJ. É mais fácil motivar um PNJ que já está disposto a ajudar, como Ismark nesta situação. A atitude Amigável de Ismark concede Vantagem a Felipe na jogada. Neste caso, ter Vantagem fez a diferença entre o sucesso e o fracasso.\n\n# Exploração\n\nExploração envolve a investigação de locais perigosos e enigmáticos. As regras nesta seção detalham algumas das maneiras pelas quais os aventureiros interagem com o ambiente em tais lugares.\n\n## Equipamento de Aventura\n\nOs aventureiros podem utilizar seu equipamento de diversas maneiras durante a exploração. Uma Escada os transporta a locais de difícil acesso, uma Tocha ou fonte de luz revela detalhes ocultos, Ferramentas de Ladrão auxiliam na abertura de portas e recipientes trancados, e Estrepes criam obstáculos para perseguidores.\n\nVeja o capítulo 6 para regras sobre itens úteis em aventuras, especialmente nas seções “Ferramentas” e “Equipamento de Aventura”, onde as armas desse capítulo têm funções além do combate; por exemplo, um Cajado pode ser usado para pressionar um botão suspeito que você teme tocar.\n\n## Visão e Luz\n\nAlgumas tarefas de aventura, como identificar perigos e atingir um inimigo com determinadas magias, são influenciadas pela visão. Assim, efeitos que comprometem a visão podem prejudicá-lo, conforme explicado a seguir.\n\n### Áreas Obscurecidas\n\nUma área pode estar Parcial ou Totalmente Obscurecida. Em uma área Parcialmente Obscurecida — como uma área com Meia-luz, névoa leve ou folhagem moderada — você sofre Desvantagem em Testes de Sabedoria (Percepção) que dependem da visão.\n\nNão é possível ver através de uma área Totalmente Obscurecida — como uma área com Escuridão, névoa densa ou folhagem espessa. Você tem a condição Cego (veja o glossário de regras) ao tentar ver algo nessa área.\n\n### Luz\n\nA presença ou a ausência de luz determina a categoria de iluminação em uma área, conforme definido a seguir.\n\n**Luz Plena.** Permite que a maioria das criaturas enxergue normalmente. Mesmo em dias sombrios, Luz Plena é fornecida, assim como por tochas, lanternas, fogueiras e outras fontes de iluminação em um raio específico.\n\n**Meia-Luz.** Também chamada de penumbra, cria uma área Parcialmente Obscurecida. A Meia-Luz marca geralmente a transição entre a Luz Plena e a Escuridão. A luz suave do crepúsculo e da aurora também se encaixam nessa categoria. Em algumas circunstâncias, uma lua cheia pode banhar a terra em Meia-Luz.\n\n**Escuridão.** É uma área Totalmente Obscurecida. Personagens geralmente encontram Escuridão ao ar livre à noite, exceto em noites de lua cheia particularmente iluminadas. Eles também enfrentam Escuridão em masmorras não iluminadas ou em uma região de Escuridão mágica.\n\n### Sentidos Especiais\n\nAlgumas criaturas possuem sentidos especiais que as auxiliam a perceber coisas em situações específicas. O glossário de regras define os seguintes sentidos especiais:\n\n-   Sismiconsciência\n-   Visão às Cegas\n-   Visão no Escuro\n-   Visão Verdadeira\n\n## Escondendo-se\n\nAventureiros e monstros frequentemente escondem-se, seja para espionar uns aos outros, passar furtivamente por um guarda ou preparar uma emboscada. O Mestre determina quais circunstâncias são apropriadas para se esconder. Ao tentar se esconder, você executa a ação Esconder.\n\n## Interagindo com Objetos\n\nInteragir com objetos é, em geral, uma tarefa simples. O jogador indica o que seu personagem está fazendo, como mover uma alavanca ou abrir uma porta, e o Mestre descreve o resultado. No entanto, regras específicas podem determinar o que você pode fazer com um objeto, conforme detalhado nas seções a seguir.\n\n### O Que é um Objeto?\n\nPara os fins das regras, um objeto é um item inanimado e distinto, como uma cadeira, espada, janela, livro, mesa, pedra ou porta. Não se trata de um edifício ou veículo, que são compostos por muitos objetos.\n\n### Interações com Objeto com Limite de Tempo\n\nQuando o tempo é curto, como em combate, as interações com objetos são limitadas a uma interação livre por turno. Essa interação deve ocorrer durante o movimento ou a ação de uma criatura. Interações adicionais requerem o uso da ação Usar Objeto, conforme explicado em “Combate” mais adiante neste capítulo.\n\n### Encontrando Objetos Escondidos\n\nQuando seu personagem procura por coisas escondidas, como armadilhas ou portas secretas, o Mestre geralmente solicita um teste de Sabedoria (Percepção), caso você descreva a busca nas proximidades do objeto. Se for bem-sucedido, você encontra o objeto, detalhes importantes ou ambos.\n\nSe você descrever que seu personagem não está procurando nem perto de um objeto escondido, um teste de Sabedoria (Percepção) não revela o objeto, independentemente do resultado do teste.\n\n### Carregando Objetos\n\nVocê geralmente pode carregar seu equipamento e tesouro sem se preocupar com o peso. No entanto, ao tentar carregar um item muito pesado ou muitos itens leves, o Mestre pode exigir que você siga as regras de capacidade de carga descritas no glossário de regras.\n\n### Quebrando Objetos\n\nComo uma ação, você pode destruir automaticamente um objeto frágil e não mágico, como vidro ou papel. Para tentar danificar algo mais resistente, o Mestre pode aplicar as regras sobre quebra de objetos descritas no glossário de regras.\n\n## Riscos\n\nOs monstros são os principais obstáculos enfrentados pelos personagens, mas existem outros perigos à espera deles. O glossário de regras define os seguintes riscos:\n\n-   Asfixia\n-   Combustão\n-   Desidratação\n-   Desnutrição\n-   Queda\n\n### Viagem\n\nDurante uma aventura, os personagens podem percorrer longas distâncias em viagens que podem levar horas ou dias. O Mestre pode resumir essa viagem sem calcular distâncias ou tempos de viagem exatos, ou pode utilizar as regras de ritmo de viagem a seguir. Se precisar saber a velocidade com que pode se mover quando cada segundo conta, veja as regras de movimento em “Combate” mais adiante neste capítulo.\n\n**Ordem de Marcha**\n\nOs aventureiros devem estabelecer uma ordem de marcha durante suas viagens, tanto em ambientes fechados quanto ao ar livre. Essa ordem ajuda a determinar quais personagens podem ser atingidos por armadilhas, quais têm a chance de perceber inimigos ocultos e quais estarão mais próximos desses inimigos caso um combate se inicie. A ordem de marcha pode ser alterada fora do combate e registrada conforme sua preferência, seja por escrito ou organizando miniaturas para representá-la.\n\n### Ritmo de Viagem\n\nDurante uma viagem fora de combate, um grupo pode se mover em ritmo Rápido, Normal ou Lento, de acordo com a tabela Ritmo de Viagem. Esta tabela indica a distância percorrida em um determinado tempo; se estiver montado em cavalos ou outras montarias, o grupo pode dobrar essa distância por 1 hora. Após esse período, as montarias precisam de um Descanso Curto ou Longo antes de se moverem novamente nesse ritmo acelerado (veja o capítulo 6 para opções de montarias à venda). O *Livro do Mestre* inclui regras que influenciam o ritmo escolhido em diferentes tipos de terreno.\n\n**Ritmo de Viagem**\n\n|           | **Distância Percorrida Por…** |           |          |\n|-----------|-------------------------------|-----------|----------|\n| **Ritmo** | **Minutos**                   | **Horas** | **Dias** |\n| Rápido    | 120 metros                    | 6 km      | 45 km    |\n| Normal    | 90 metros                     | 4,5 km    | 36 km    |\n| Lento     | 60 metros                     | 3 km      | 27 km    |\n\nCada ritmo de viagem afeta o jogo, conforme definido a seguir.\n\n**Rápido:** Viajar em ritmo Rápido impõe Desvantagem em testes de Sabedoria (Percepção ou Sobrevivência) e Destreza (Furtividade) do viajante.\n\n**Normal:** Viajar em ritmo Normal impõe Desvantagem nos testes de Destreza (Furtividade).\n\n**Lento:** Viajar em ritmo Lento concede Vantagem nos testes de Sabedoria (Percepção ou Sobrevivência).\n\n### Veículos\n\nViajantes em vagões, carruagens ou outros veículos terrestres geralmente escolhem um ritmo de viagem. Personagens em embarcações aquáticas são limitados ao deslocamento da embarcação e não têm a opção de escolher um ritmo de viagem. Dependendo da embarcação e do tamanho da tripulação, os navios podem navegar por até 24 horas por dia. O capítulo 6 abrange os veículos disponíveis para compra.\n\n# Exemplo de Exploração\n\n*Os personagens estão explorando o Castelo Ravenloft, e o Mestre descreve o cômodo em que acabaram de entrar.*\n\n**Jairo (como Mestre):** Uma lareira ardente ilumina o cômodo com uma luz quente. O fogo brilha em um atiçador ao lado, e as paredes estão repletas de livros antigos. Um enorme quadro em uma moldura dourada está pendurado acima da lareira, iluminando um retrato idêntico a Irene Kolyana.\n\n**Felipe (como Gareth):** Quão antigo parece ser o quadro?\n\n**Eva (como Mirabella):** Vou dar uma olhada nos livros!\n\n**Jairo:** Certo, já falamos sobre isso em um segundo. Rubens e Amanda, o que seus personagens estão fazendo?\n\n**Rubens (como Shreeve):** Fico perto da porta, espada em punho, pronto para o perigo. Este lugar é assustador!\n\n**Amanda (como Auro):** Vou para perto da lareira. Um fogo quente parece agradável, mas também fico alerta para o perigo.\n\n**Jairo:** Entendi. OK, Felipe, realize um teste de Inteligência (História) enquanto Gareth observa o quadro.\n\n**Felipe:** Não tenho proficiência em História, mas lá vou eu. Tirei… Oh! Um 20! Para um total de… 20.\n\n**Jairo:** Gareth nota duas coisas sobre o quadro: primeiro, as roupas da mulher parecem antiquadas e, segundo, a tinta está descascando em vários pontos, coberta por uma fina camada de fuligem. Você diria que o quadro tem alguns séculos.\n\n**Felipe:** Então talvez seja uma ancestral de Irene? A menos que ela já seja uma vampira e essa história de ser “mordida por Strahd” seja uma farsa.\n\n**Jairo:** Quem sabe? Agora, Mirabella está dando uma olhada nos livros?\n\n**Eva:** Sim, tiro um da prateleira ao acaso.\n\n-   **Todos são Considerados.** A exploração é livre; os jogadores não se revezam na movimentação pela masmorra da mesma forma que fazem em combate. No entanto, o Mestre se certifica frequentemente para garantir que está claro onde todos estão e o que estão fazendo.\n-   **Trabalho em Equipe é Fundamental.** Os personagens dos jogadores colaboram em busca de um objetivo comum. Eles se movem juntos pela masmorra e se unem para superar os desafios. Ao entrarem na sala, exploram diferentes partes do ambiente. Quando Auro encontra uma porta secreta atrás da lareira mais tarde no exemplo, eles se reúnem novamente para investigá-la, e Gareth descobre como contornar o fogo. Pode parecer que o personagem de Rubens não estava fazendo muito, mas Shreeve estava protegendo o grupo ao vigiar a porta.\n-   **Vale a Pena Jogar com ou sem Proficiência.** Normalmente, você tem uma chance de sucesso em um teste de atributo mesmo que não possua proficiência com uma perícia relevante. No exemplo, Felipe tira um 20 sem proficiência. O d20 traz muitas surpresas para o jogo - surpresas que o Mestre interpreta.\n\n    **Jairo:** É um livro escrito em Comum chamado *Sobre as Habitações do Divino nos Reinos Celestial e Infernal*.\n\n    **Rubens**: Você acabou de inventar isso?\n\n    **Jairo:** Nunca vou dizer. Ao folhear o livro, você percebe que ele é extremamente acadêmico e difícil de entender.\n\n    **Eva:** Beleza, coloco esse de volta e pego outro.\n\n    **Jairo:** Shreeve e Auro estão fazendo mais alguma coisa?\n\n    **Amanda:** Eu pego o atiçador e mexo nas toras na lareira.\n\n    **Jairo:** Assim que levanta o atiçador, você ouve um rangido, e a parte de trás da lareira desliza para o lado, revelando um cômodo oculto!\n\n    **Amanda:** “Ei, pessoal! Encontrei algo!” Consigo ver algo no cômodo adiante?\n\n    **Jairo:** Além das chamas e da fumaça, você enxerga uma pilha brilhante de moedas amontoadas próxima a um baú.\n\n    **Amanda:** Alguém conhece uma forma rápida de apagar um fogo?\n\n    **Felipe:** E vocês riram de mim por preparar *Criar ou Destruir Água*! Com meu Símbolo Sagrado em mãos, conjuro a magia e apago a lareira.\n\n    **Jairo:** O que a descrição da magia diz?\n\n    **Felipe:** Ela faz com que 40 litros de água se derramem em um cubo de 9 metros, extinguindo as chamas ali.\n\n    **Jairo:** Ótimo! Isso apaga o fogo. Sem a luz da lareira, resta apenas o brilho mágico da espada de Shreeve, que projeta sombras pelo cômodo. Através das nuvens de fumaça persistente, é possível ver um baú fechado no chão, cercado por pilhas de moedas. Na parede oposta, há dois suportes de tochas: um com uma tocha apagada e uma base de metal intrincada, e o outro vazio. Um esqueleto em armadura quebrada está encostado na parede, com uma mão na garganta e a outra segurando a tocha do suporte vazio.\n\n    **Amanda:** Vou conferir o baú!\n\n    **Jairo:** E o resto de vocês?\n\n    **Felipe:** Gareth entra e observa o esqueleto.\n\n    **Eva:** Continuo vigiando deste lado da lareira.\n\n    **Rubens:** Ainda estou na área da primeira porta.\n\n    **Jairo:** Amanda, o baú parece muito bem feito, com acessórios elegantes e pés em forma de garra.\n\n    **Amanda:** Tento abri-lo. Ele está trancado?\n\n    **Jairo:** Não está trancado e abre facilmente, liberando uma nuvem de gás com aroma agradável.\n\n    **Amanda:** Ah, não.\n\n    **Jairo:** Ah, sim. Peço que Auro e Gareth realizem salvaguardas de Constituição.\n\n    **Amanda:** Desculpe, Felipe! Tirei 8.\n\n    **Felipe:** E Gareth tirou 5.\n\n    **Jairo:** Ao inalar esse gás, um frio se espalha por seus corpos, que ficam enrijecidos. Vocês têm a condição Paralisado!\n\n-   **Encontrando Objetos Escondidos.** Ambientes de aventura estão cheios de segredos, como armadilhas, portas ocultas, tábuas soltas e tesouros escondidos. Os personagens frequentemente realizam testes de Sabedoria para encontrar itens — veja também a ação Procurar no glossário de regras — mas, às vezes, descobrem algo acidentalmente, como Auro fez aqui.\n-   **Conjurando Magias.** Muitos personagens têm a capacidade de conjurar magias, que oferecem uma ampla gama de efeitos. Algumas são principalmente eficazes em combate, causando dano ou impondo Condições, enquanto outras são valiosas durante a exploração. Ao jogar com um Conjurador, busque equilibrar magias que sejam eficazes em combate e também úteis em diversas situações.\n-   **Conheça suas Magias!** Tenha seu *Livro do Jogador* aberto na descrição de uma magia antes de conjurá-la. Não espere que o Mestre saiba como sua magia funciona; esteja preparado para responder perguntas sobre ela.\n-   **Visão e Luz.** O Mestre define o que os aventureiros conseguem perceber, incluindo fontes de luz, como as chamas da lareira e a espada cintilante de Shreeve, além de condições que dificultam a visão, como fumaça e neblina. Veja também “Visão e Luz” anteriormente neste capítulo.\n-   **Salvaguardas.** Uma salvaguarda é utilizada para determinar se uma criatura evita ou resiste a algo. Quando o baú libera gás tóxico, os personagens de Felipe e Amanda realizam salvaguardas de Constituição, que é um dos seis atributos que definem as capacidades das criaturas e está associado à saúde e resistência. Ao falharem em suas salvaguardas, o gás os coloca sob a condição Paralisado. Veja também “Condições” mais adiante neste capítulo.\n\n# Combate\n\nOs aventureiros se deparam com muitos monstros perigosos e vilões malignos. Nessas situações, o combate costuma acontecer.\n\n## A Ordem de Combate\n\nUm combate típico é um confronto entre duas partes, envolvendo uma série de golpes, fintas, defesas, jogo de pernas e conjuração. No jogo, o combate acontece em ciclos de rodadas e turnos. Cada rodada corresponde a aproximadamente 6 segundos no mundo do jogo, e a cada rodada, cada participante realiza um turno. A ordem dos turnos é estabelecida no início do combate, quando todos jogam Iniciativa. Após todos os turnos, a luta avança para a próxima rodada, a menos que um dos lados seja derrotado.\n\n### Passo a Passo do Combate\n\nO combate ocorre nestas etapas:\n\n1.  **Determine as Posições.** O Mestre estabelece a localização de todos os personagens e monstros. Com base na ordem de marcha dos aventureiros, nas posições declaradas na sala ou em outro local, o Mestre determina a posição dos adversários, sua distância e direção.\n2.  **Jogue a Iniciativa.** Todos os envolvidos no combate jogam a Iniciativa para definir a ordem dos turnos dos combatentes.\n3.  **Realize os Turnos.** Cada participante realiza um turno na ordem de Iniciativa durante o combate. A rodada se encerra quando todos tiverem completado um turno. Repita as etapas até que o combate chegue ao fim.\n\n### Iniciativa\n\nA Iniciativa estabelece a ordem dos turnos no combate. No início, cada participante realiza um teste de Destreza para determinar sua posição na ordem. O Mestre realiza um teste de Iniciativa para os monstros, e se forem criaturas idênticas, realiza um único teste com a mesma Iniciativa para todas.\n\n**Surpresa.** Um combatente pego de surpresa no início do combate sofre Desvantagem na jogada de Iniciativa. Por exemplo, uma criatura é considerada Surpresa se não perceber que um emboscador escondido deu início ao combate.\n\n**Ordem de Iniciativa.** O total do teste de um combatente é chamado de Contagem de Iniciativa, ou simplesmente Iniciativa. O Mestre organiza os combatentes da maior para a menor Iniciativa. Essa é a ordem em que os combatentes agem durante cada rodada.\n\n**Empates.** Em caso de empate, o Mestre determina a ordem entre os monstros, enquanto os jogadores definem a ordem entre os personagens. O Mestre decide a ordem caso o empate ocorra entre um monstro e um personagem do jogador.\n\n### Seu Turno\n\nNo seu turno, você pode se mover uma distância igual ao seu Deslocamento e executar uma ação. Você decide se vai se mover ou executar sua ação primeiro.\n\nAs principais ações estão descritas em “Ações” no início deste capítulo, enquanto as características de um personagem e o bloco de estatísticas de um monstro também oferecem opções de ação. As regras de movimentação podem ser encontradas em “Movimento e Posição”, mais adiante.\n\n**Criaturas ocupam espaços de tamanhos variados. Esta Pantera Deslocadora ocupa uma área de 3 por 3 metros, enquanto os aventureiros ocupam áreas de 1,5 por 1,5 metro.**\n\n**Comunicação.** Você pode se comunicar como desejar durante seu turno por meio de palavras e gestos breves. Isso não usa sua ação nem seu movimento.\n\nComunicação prolongada, como uma explicação detalhada ou uma tentativa de persuadir um inimigo, requer uma ação. A ação Influenciar é a principal forma de tentar influenciar um monstro.\n\n**Interagir com Objetos.** Você pode interagir com um objeto ou característica do ambiente sem custo durante seu movimento ou ação. Por exemplo, abrir uma porta enquanto avança em direção a um inimigo.\n\nPara interagir com um segundo objeto, é necessário executar a ação Usar Objeto. Alguns itens mágicos e objetos especiais sempre requerem uma ação para serem utilizados, conforme explicado em suas descrições.\n\nO Mestre pode exigir uma ação para atividades que requerem cuidados especiais ou quando representarem obstáculos incomuns. Por exemplo, pode ser necessário executar a ação Usar Objeto para abrir uma porta emperrada ou girar uma manivela para abaixar uma ponte levadiça.\n\n**Não Fazer Nada no Seu Turno.** Você pode escolher não se mover, executar uma ação ou simplesmente realizar nada em seu turno. Se estiver em dúvida, considere executar a ação Esquivar ou a ação Preparar para adiar sua ação.\n\n### Fim do Combate\n\nO combate termina quando um dos lados é derrotado, seja porque as criaturas foram mortas, nocauteadas, se renderam ou fugiram. O combate também pode encerrar-se se ambos os lados concordarem em finalizá-lo.\n\n## Movimento e Posição\n\nNo seu turno, você pode se mover uma distância igual ou menor que o seu Deslocamento, ou optar por não se mover.\n\nSeu movimento pode incluir escalar, nadar, rastejar e saltar, conforme descrito no glossário de regras. Esses modos de movimento podem ser combinados com seu deslocamento regular ou representar todo o seu movimento.\n\nIndependentemente de como você se movimenta utilizando seu Deslocamento, subtraia a distância de cada parte de sua movimentação até que todo o Deslocamento tenha sido utilizado ou até você terminar de se mover, o que ocorrer primeiro.\n\nO deslocamento de um personagem é definido durante sua criação. O deslocamento de um monstro é indicado em seu bloco de estatísticas. Veja também o glossário de regras para saber mais sobre Deslocamento, bem como sobre deslocamentos especiais, como o Deslocamento de Escalada, o Deslocamento de Natação ou o Deslocamento de Voo.\n\n### Terreno Difícil\n\nCombatentes geralmente enfrentam desaceleração em Terreno Difícil. Exemplos de Terreno Difícil incluem entulhos, escadas íngremes, móveis baixos, neve, pântanos rasos e vegetação densa.\n\nCada metro de movimento em Terreno Difícil custa 1 metro adicional, mesmo que vários elementos no espaço sejam considerados Terreno Difícil.\n\n**Jogando com um Grid**\n\nSe você joga usando um grid quadriculado e miniaturas ou outros marcadores, siga estas regras.\n\n**Quadrados.** Cada quadrado representa 1,5 metro.\n\n**Deslocamento.** Mova-se quadrado a quadrado no grid, utilizando seu Deslocamento em segmentos de 1,5 metro. Para converter seu Deslocamento em quadrados, divida-o por 1,5. Por exemplo, 9 metros equivalem a 6 quadrados. Se você usar um grid com frequência, considere anotar seu Deslocamento em quadrados na ficha de personagem.\n\n**Entrando em um Quadrado.** Para entrar em um quadrado, é necessário ter pelo menos 1 quadrado de movimento disponível. Entrar em um quadrado adjacente desocupado, seja diagonal ou ortogonalmente, custa 1 quadrado de movimento. Um quadrado de Terreno Difícil, por sua vez, custa 2 quadrados de movimento. Outros efeitos podem aumentar o custo de movimento de um quadrado.\n\n**Cantos.** Movimento diagonal não pode atravessar o canto de paredes, árvores robustas ou qualquer outra característica do terreno que ocupe todo o seu espaço.\n\n**Distâncias.** Para determinar a distância entre dois elementos em um grid — sejam eles criaturas ou objetos — conte os quadrados a partir de um quadrado adjacente a um deles e pare de contar no espaço do outro. Utilize a rota mais curta.\n\n### Dividindo Seu Movimento\n\nVocê pode dividir seu movimento durante o turno, utilizando parte do seu deslocamento antes e depois de sua ação, Ação Bônus ou Reação. Por exemplo, se você tem um Deslocamento de 9 metros, pode mover-se 3 metros, executar uma ação e, em seguida, mover-se mais 6 metros.\n\n### Condição Caído\n\nNo seu turno, você pode voluntariamente ter a condição Caído (veja também o glossário de regras) sem gastar uma ação ou qualquer parte do seu Deslocamento, exceto se ele for 0.\n\n### Tamanho da Criatura\n\nUma criatura é classificada por seu tamanho, que determina a largura do espaço quadrado que ocupa em um mapa, de acordo com a tabela Tamanho e Espaço da Criatura. Essa tabela lista os tamanhos do menor (Minúsculo) ao maior (Colossal). O espaço de uma criatura refere-se à área que ela controla em combate e àquela necessária para uma luta eficaz.\n\nO tamanho de um personagem é definido pela espécie, enquanto o tamanho de um monstro é indicado em seu bloco de estatísticas.\n\nTamanho e Espaço da Criatura\n\n| **Tamanho** | **Espaço (Metro)**  | **Espaço (Quadrados)** |\n|-------------|---------------------|------------------------|\n| Minúsculo   | 0,75 por 0,75 metro | 4 por quadrado         |\n| Pequeno     | 1,5 por 1,5 metro   | 1 por quadrado         |\n| Médio       | 1,5 por 1,5 metro   | 1 por quadrado         |\n| Grande      | 3 por 3 metros      | 4 quadrados (2 por 2)  |\n| Enorme      | 4,5 por 4,5 metros  | 9 quadrados (3 por 3)  |\n| Colossal    | 6 por 6 metros      | 16 quadrados (4 por 4) |\n\n### Movendo-se entre Outras Criaturas\n\nDurante seu movimento, você pode atravessar o espaço de um aliado, de uma criatura Incapacitada (veja também o glossário de regras), de uma criatura Minúscula ou de uma criatura que seja dois tamanhos maiores ou menores do que você.\n\nO espaço de outra criatura é Terreno Difícil para você, a menos que a criatura seja Minúscula ou sua aliada.\n\nVocê não pode encerrar um movimento voluntariamente em um espaço ocupado por outra criatura. Se você terminar um turno em um espaço com outra criatura, você está Caído (veja também o glossário de regras), a menos que seja Minúsculo ou maior que a outra criatura.\n\n## Realizando um Ataque\n\nAo executar a ação Atacar, você realiza um ataque. Algumas ações, Ações Bônus e Reações também podem permitir que você realize um ataque. Ao usar uma arma Corpo a Corpo, disparar uma arma à Distância ou realizar uma jogada de ataque como parte de uma magia, um ataque segue a seguinte estrutura:\n\n1.  **Escolha um Alvo.** Escolha um alvo dentro da distância do seu ataque: uma criatura, objeto ou local.\n2.  **Determine os Modificadores.** O Mestre determina se o alvo tem cobertura (veja a próxima seção) e se você tem Vantagem ou Desvantagem contra ele. Além disso, magias, habilidades especiais e outros efeitos podem gerar penalidades ou bônus para a sua jogada de ataque.\n3.  **Resolva o Ataque.** Realize a jogada de ataque, conforme detalhado anteriormente. Em caso de acerto, você joga o dano, a menos que esse ataque específico tenha regras que indiquem o contrário. Em vez do dano ou somados a ele, alguns ataques provocam efeitos especiais.\n\n## Cobertura\n\nParedes, árvores, criaturas e outros obstáculos podem proporcionar cobertura durante o combate, tornando um alvo mais difícil de ser atingido.\n\nUma cobertura só beneficia o alvo se o ataque ou outro efeito se originar do lado oposto da cobertura. Se um alvo estiver atrás de múltiplas coberturas, apenas a de maior grau de proteção é aplicada — os graus não se acumulam. Por exemplo, se um alvo estiver atrás de uma criatura que concede Cobertura Parcial e de um tronco de árvore que concede Cobertura de 3/4, o alvo tem Cobertura de 3/4.\n\nCobertura\n\n| **Grau**     | **Benefício para o Alvo**                       | **Concedido por…**                                              |\n|--------------|-------------------------------------------------|-----------------------------------------------------------------|\n| Parcial      | +2 de bônus na CA e em Salvaguardas de Destreza | Outra criatura ou um objeto que cobre pelo menos metade do alvo |\n| Três Quartos | +5 de bônus na CA e em Salvaguardas de Destreza | Um objeto que cobre pelo menos três quartos do alvo             |\n| Total        | Não pode ser alvejado diretamente               | Um objeto que cobre todo o alvo                                 |\n\n**Atacantes e Alvos Invisíveis**\n\nAo atacar um alvo que não pode ser visto, você tem Desvantagem na jogada de ataque. Isso ocorre quando você tenta adivinhar a localização do alvo ou quando ataca uma criatura que pode ouvir, mas não ver. Se o alvo não estiver no espaço atacado, você erra automaticamente.\n\nQuando você não pode ser visto por uma criatura, suas jogadas de ataque têm Vantagem contra ela.\n\nSe estiver escondido quando realizar uma jogada de ataque, você revela sua posição quando o ataque acertar ou errar.\n\n## Ataques à Distância\n\nAo realizar um ataque à distância, você pode utilizar um arco, arremessar um machado ou disparar projéteis para atingir um inimigo à distância. Muitas magias também envolvem ataques à distância.\n\n### Distância\n\nCaso um ataque à distância, como um realizado com uma magia, tenha um alcance específico, você não pode atacar um alvo que esteja fora desse alcance.\n\nAlguns ataques à distância, como os realizados com um Arco Longo, possuem dois alcances. O menor número representa o alcance normal, enquanto o maior número indica o alcance máximo. Sua jogada de ataque tem Desvantagem quando o alvo está além do alcance normal, e você não pode atacar um alvo que esteja além do alcance máximo.\n\n### Ataques à Distância em Combate Corpo a Corpo\n\nÉ mais difícil realizar um ataque à distância quando há um inimigo próximo a você. Ao realizar um ataque à distância com uma arma, magia ou outro meio, você tem Desvantagem na jogada se estiver a 1,5 metro de um inimigo à sua vista e que não tem a condição Incapacitado (veja o glossário de regras).\n\n## Ataques Corpo a Corpo\n\nUm ataque corpo a corpo permite atacar um alvo ao seu alcance. Normalmente, um ataque corpo a corpo utiliza uma arma empunhada ou um Ataque Desarmado. Muitos monstros realizam ataques corpo a corpo com garras, dentes ou outras partes do corpo. Algumas magias também incluem ataques corpo a corpo.\n\n### Alcance\n\nCom um alcance de 1,5 metro, uma criatura pode atacar alvos até essa distância em um ataque corpo a corpo. Algumas criaturas, de acordo com suas descrições, possuem ataques corpo a corpo com alcance superior a 1,5 metro.\n\n### Ataques de Oportunidade\n\nCombatentes estão sempre atentos para quando os inimigos baixam a guarda. Mover-se descuidadamente perto dos inimigos coloca você em risco ao provocar um Ataque de Oportunidade.\n\n**Evitando Ataques de Oportunidade.** Você não provoca um Ataque de Oportunidade ao Desengajar, Teleportar ou ser movido sem usar seu movimento, ação, Ação Bônus ou Reação. Por exemplo, não ocorre Ataque de Oportunidade se uma explosão o arremessar para fora do alcance de um inimigo ou se você cair próximo a ele.\n\n**Realizando um Ataque de Oportunidade.** Um Ataque de Oportunidade pode ser realizado quando uma criatura que você consegue ver sai do seu alcance. Para efetuar o ataque, use uma Reação e realize um ataque corpo a corpo com uma arma ou um Ataque Desarmado contra a criatura. O ataque acontece imediatamente antes que o alvo saia do seu alcance.\n\n## Combate Montado\n\nPara servir como montaria, uma criatura voluntária deve ser pelo menos um tamanho maior que o cavaleiro e ter uma anatomia adequada, seguindo as regras abaixo.\n\n### Montando e Desmontando\n\nEnquanto se move, você pode montar ou desmontar uma criatura que esteja a até 1,5 metro de você. Montar ou desmontar custa um movimento equivalente à metade do seu Deslocamento (arredondado para baixo). Por exemplo, com um Deslocamento de 9 metros, você utiliza 4,5 metros de movimento para montar um cavalo.\n\n### Controlando uma Montaria\n\nVocê só pode controlar uma montaria se ela tiver sido treinada para aceitar um cavaleiro, como cavalos, mulas e outras criaturas domesticadas semelhantes.\n\nAo montar uma montaria controlada, sua Iniciativa passa a valer para ela. A montaria se move no seu turno de acordo com suas ordens e possui apenas três opções de ação: Correr, Desengajar e Esquivar. A montaria controlada pode se mover e agir no turno em que você a monta.\n\nPor outro lado, uma montaria independente — que permite que você a monte, mas não obedece ao seu controle — mantém sua posição na ordem de Iniciativa e se move e age de acordo com sua própria vontade.\n\n**Montado em um Cavalo-Marinho Gigante, um Paladino se aventura debaixo d'água.**\n\n### Caindo de uma Montaria\n\nSe um efeito tentar mover sua montaria contra a vontade dela enquanto você estiver montado, você deve ser bem-sucedido em uma salvaguarda de Destreza CD 10 ou cai da montaria e tem a condição Caído (veja o glossário de regras) em um espaço desocupado a até 1,5 metro dela.\n\nEnquanto estiver montado, você deve realizar a mesma salvaguarda caso você ou sua montaria estejam Caídos.\n\n## Combate Subaquático\n\nUm combate subaquático segue estas regras.\n\n### Armas Restringidas\n\nAo realizar uma jogada de ataque corpo a corpo com uma arma debaixo d'água, uma criatura que não possui Deslocamento de Natação tem Desvantagem na jogada de ataque, a menos que a arma cause dano Perfurante.\n\nUma jogada de ataque à distância com uma arma debaixo d'água automaticamente erra um alvo que está além do alcance normal da arma e tem Desvantagem contra alvos dentro do alcance normal.\n\n### Resistência a Fogo\n\nQualquer coisa debaixo d'água tem Resistência a dano Ígneo (explicado em “Dano e Cura”).\n\n# Dano e Cura\n\nFerimentos e risco de morte são ameaças comuns em D&D, conforme detalhado nas regras a seguir.\n\n## Pontos de Vida\n\nPontos de Vida refletem a resiliência e a vontade de viver. Criaturas com mais Pontos de Vida são mais difíceis de eliminar. Seus Pontos de Vida máximos correspondem ao total quando não estão feridas, enquanto os Pontos de Vida atuais podem variar do máximo até o mínimo, que é 0.\n\nSempre que sofrer dano, subtraia-os dos seus Pontos de Vida. Enquanto não atingir 0, a perda deles não impacta suas habilidades.\n\nCaso você tenha metade ou menos dos seus Pontos de Vida, está Sangrando. Isso não afeta o jogo diretamente, mas pode desencadear outros efeitos.\n\n## Jogadas de Dano\n\nCada arma, magia e habilidade de monstro que causa dano indica o valor de dano que inflige. Você joga os dados de dano, adiciona quaisquer modificadores e aplica o dano ao seu alvo. Se houver uma redução no dano, é possível causar 0 de dano, mas não um dano negativo.\n\nAo atacar com uma arma, você adiciona seu modificador de atributo — o mesmo utilizado na jogada de ataque — à jogada de dano. Uma magia especifica quais dados devem ser jogados para dano e se é necessário adicionar modificadores. A menos que uma regra indique o contrário, não se adiciona o modificador de atributo a um valor fixo de dano que não utiliza dados, como o dano de uma Zarabatana. Veja o capítulo 6 para os dados de dano das armas e o capítulo 7 para os dados de dano das magias.\n\n## Acertos Críticos\n\nAo obter um Acerto Crítico, você causa dano adicional. Jogue os dados de dano do ataque duas vezes, some-os e adicione os modificadores relevantes. Por exemplo, ao obter um Acerto Crítico com uma Adaga, jogue 2d4 em vez de 1d4 e inclua o modificador de atributo apropriado. Se o ataque incluir outros dados de dano, como os do Ataque Furtivo do Ladino, jogue também esses dados duas vezes.\n\n**Descanso**\n\nAventureiros não podem passar o tempo todo se aventurando e precisam de descanso entre as aventuras. Todas as criaturas podem realizar um Descanso Curto de uma hora e um Descanso Longo de 8 horas. Recuperar Pontos de Vida é um dos principais benefícios desse descanso. As regras para os Descansos Curtos e Longos estão descritas no glossário de regras.\n\n## Salvaguardas e Dano\n\nDano causado por salvaguardas usa estas regras.\n\n### Dano Contra Vários Alvos\n\nAo criar um efeito de dano que obriga dois ou mais alvos a realizar salvaguardas simultaneamente, jogue o dano uma única vez para todos os alvos. Por exemplo, ao usar *Bola de Fogo*, o mago joga o dano da magia uma vez para todas as criaturas afetadas pela explosão.\n\n### Metade do Dano\n\nMuitos efeitos de salvaguarda causam dano reduzido pela metade (arredondado para baixo) ao alvo se a salvaguarda for bem-sucedida, sendo esse dano equivalente à metade do que ocorreria em caso de falha.\n\n## Tipos de Dano\n\nCada situação de dano possui um tipo, como Cortante ou Ígneo. Os tipos de dano estão listados no glossário de regras e não têm regras próprias, mas outras regras, como Resistência, dependem deles.\n\n## Resistência e Vulnerabilidade\n\nAlgumas criaturas e objetos possuem Resistência ou Vulnerabilidade a determinados tipos de dano. Se você tem Resistência a um tipo de dano, este é reduzido pela metade (arredondado para baixo). Por outro lado, se você tem Vulnerabilidade a um tipo de dano, este é duplicado. Por exemplo, se você possui Resistência a dano Gélido, ele é reduzido pela metade, enquanto se tiver Vulnerabilidade a dano Ígneo, o dano é dobrado.\n\n### Não Acumula\n\nSituações de Resistência ou Vulnerabilidade que afetam o mesmo tipo de dano são consideradas como uma só. Por exemplo, se você tiver Resistência a dano Necrótico e a qualquer outro tipo de dano, o dano Necrótico será reduzido pela metade.\n\n### Ordem de Aplicação\n\nOs modificadores de dano são aplicados na seguinte ordem: primeiro os ajustes (bônus, penalidades ou multiplicadores), em seguida a Resistência a Dano e, por último, a Vulnerabilidade.\n\nPor exemplo, uma criatura possui Resistência a todos os tipos de dano e Vulnerabilidade a dano Ígneo, estando dentro de uma aura mágica que reduz todo tipo de dano em 5. Se ela sofrer 28 pontos de dano Ígneo, o dano é primeiramente reduzido em 5 (para 23), depois diminuído pela metade devido à Resistência da criatura (arredondado para 11) e, por fim, dobrado em função de sua Vulnerabilidade (para 22).\n\n## Imunidade\n\nCertas criaturas e objetos possuem imunidade a tipos específicos de dano e condições. A imunidade a um tipo de dano significa que você não sofre dano desse tipo, enquanto a imunidade a uma condição indica que você não é afetado por ela.\n\n## Cura\n\nOs Pontos de Vida podem ser recuperados por magia, como *Curar Ferimentos* ou uma *Poção de Cura*, ou por meio de um Descanso Curto ou Longo (veja o glossário de regras). Ao receber cura, adicione os Pontos de Vida recuperados aos seus atuais, sem ultrapassar seus Pontos de Vida Máximos. Qualquer cura que exceda esse máximo é perdida. Por exemplo, se você receber 8 Pontos de Vida de cura, tiver 14 atualmente e um máximo de 20, você só recupera 6.\n\n## Reduzindo a 0 Pontos de Vida\n\nQuando os Pontos de Vida de uma criatura são reduzidos a 0, ela morre definitivamente ou fica Inconsciente, conforme explicado a seguir.\n\n### Morte Instantânea\n\nAqui estão as principais formas de uma criatura morrer instantaneamente:\n\n**Morte de um Monstro.** Um monstro morre assim que seus Pontos de Vida são reduzidos a 0, mas o Mestre pode ignorar essa regra para um monstro específico e tratá-lo como um personagem.\n\n**Pontos de Vida Máximos em 0.** Uma criatura morre se seus Pontos de Vida máximos forem reduzidos a 0. Certos efeitos drenam energia vital, reduzindo Pontos de Vida máximos de uma criatura.\n\n**Dano Maciço.** Se o dano reduzir um personagem a 0 Pontos de Vida e houver dano excedente, o personagem morre se o restante for igual ou superior aos seus Pontos de Vida máximos. Por exemplo, se o personagem tiver 12 Pontos de Vida máximos, estiver com 6 Pontos de Vida e sofrer 18 de dano, ele é reduzido a 0 Pontos de Vida, com 12 de dano restante. Nesse caso, o personagem morre, pois 12 é igual aos seus Pontos de Vida máximos.\n\n### Morte de Personagem\n\nSe seu personagem morrer, o grupo pode encontrar uma forma mágica de revivê-lo, como a magia *Reviver os Mortos*, ou conversar com o Mestre sobre a criação de um novo personagem para integrar o grupo. Veja o glossário de regras para mais detalhes sobre a morte.\n\n### Caindo Inconsciente\n\nAo ser reduzido a 0 Pontos de Vida e não morrer instantaneamente, você tem a condição Inconsciente (veja o glossário de regras) até recuperar qualquer quantidade de Pontos de Vida e precisa realizar Salvaguardas contra Morte (veja abaixo).\n\n**Nocauteando uma Criatura**\n\nAo reduzir uma criatura a 0 Pontos de Vida com um ataque corpo a corpo, pode optar por deixá-la com 1 Ponto de Vida e impor a condição Inconsciente. A criatura inicia um Descanso Curto, ao final do qual a condição termina. Essa condição também encerra antes se a criatura recuperar qualquer Ponto de Vida ou se alguém executar uma ação para prestar primeiros socorros a ela, exigindo um teste bem-sucedido de Sabedoria (Medicina) CD 10.\n\n### Salvaguarda Contra Morte\n\nSempre que você iniciar seu turno com 0 Pontos de Vida, deve realizar uma Salvaguarda contra Morte para determinar se está se aproximando da morte ou conseguindo se manter vivo.\n\nDiferente das outras salvaguardas, esta não está vinculada a um valor de atributo. Agora, você está nas mãos do destino.\n\n**Três Sucessos/Fracassos.** Se o resultado for 10 ou mais, você alcança um sucesso. Caso contrário, você falha. Um sucesso ou fracasso, por si só, não tem impacto. Ao obter o terceiro sucesso, você se torna Estável (veja “Estabilizando um Personagem” abaixo). Ao obter o terceiro fracasso, você morre.\n\nOs sucessos e fracassos não precisam ser consecutivos; registre ambos até alcançar três do mesmo tipo. As contagens retornam a 0 quando você recupera Pontos de Vida ou se torna Estável.\n\n**Tirando 1 ou 20.** Um resultado de 1 no d20 para uma Salvaguarda contra Morte conta como duas falhas. Um 20 no d20 significa que você recupera 1 Ponto de Vida.\n\n**Dano com 0 Pontos de Vida.** Ao sofrer dano com 0 Pontos de Vida, você falha em uma Salvaguarda Contra a Morte. Se o dano for oriundo de um Acerto Crítico, você recebe o dobro de dano. Se o dano for igual ou superior aos seus Pontos de Vida máximos, você morre.\n\n### Estabilizando um Personagem\n\nVocê pode executar a ação Ajudar para tentar estabilizar uma criatura com 0 Pontos de Vida, realizando um teste bem-sucedido de Sabedoria (Medicina) CD 10.\n\nUma criatura estável não realiza Salvaguardas Contra Morte mesmo que tenha 0 pontos de vida, mas ainda tem a condição Inconsciente. Se a criatura sofrer dano, ela deixa de ser estável e começa a realizar novamente os Salvaguardas Contra Morte. Uma criatura estável que não tenha sido curada recupera 1 ponto de vida após 1d4 horas.\n\n## Pontos de Vida Temporários\n\nAlgumas magias e outros efeitos conferem Pontos de Vida Temporários, sendo um amortecedor contra a perda de Pontos de Vida reais, conforme explicado abaixo.\n\n### Perda de Pontos de Vida Temporários Primeiro\n\nSe você tiver Pontos de Vida Temporários e sofrer dano, esses pontos são perdidos primeiro, e qualquer dano restante é subtraído dos seus Pontos de Vida. Por exemplo, se você tiver 5 Pontos de Vida Temporários e sofrer 7 de dano, perde esses pontos e, em seguida, 2 Pontos de Vida.\n\n### Duração\n\nOs Pontos de Vida Temporários duram até se esgotarem ou até você completar um Descanso Longo (veja o glossário de regras).\n\n### Eles Não Acumulam\n\nOs Pontos de Vida Temporários não podem ser acumulados. Se você tiver Pontos de Vida Temporários e receber mais, você decide se mantém os que possui ou se aceita os novos. Por exemplo, se uma magia lhe concede 12 Pontos de Vida Temporários quando você já tem 10, você pode escolher entre 12 ou 10, não 22.\n\n### Não são Pontos de Vida ou Cura\n\nOs Pontos de Vida Temporários não podem ser somados aos seus Pontos de Vida, a cura não pode restaurá-los e o recebimento de Pontos de Vida Temporários não é considerado cura. Como os Pontos de Vida Temporários não são Pontos de Vida, uma criatura pode estar com os Pontos de Vida totais e ainda assim receber Pontos de Vida Temporários.\n\nSe você tiver 0 Pontos de Vida, e receber Pontos de Vida Temporários, você não recupera a consciência. Somente a cura verdadeira pode lhe salvar.\n\n# Condições\n\nMuitos efeitos impõem uma condição, um estado temporário que altera as capacidades do alvo. As condições a seguir são definidas no glossário de regras:\n\n| Amedrontado | Enfeitiçado  | Inconsciente |\n|-------------|--------------|--------------|\n| Atordoado   | Envenenado   | Invisível    |\n| Caído       | Exaustão     | Paralisado   |\n| Cego        | Imobilizado  | Petrificado  |\n| Contido     | Incapacitado | Surdo        |\n\nA definição de uma condição descreve o que acontece com o alvo quando afetado por ela, e algumas condições aplicam outras condições.\n\n## Duração\n\nUma condição persiste por um período indicado pelo efeito que a criou ou até ser encerrada (por exemplo, a condição Caído é anulada ao se levantar).\n\n## Não Acumula\n\nSe vários efeitos impuserem a mesma condição, cada um terá sua própria duração, mas não se acumulam e seus efeitos não pioram. Você tem ou não tem a condição. A exceção é a condição Exaustão, que agrava se você a receber novamente.\n\n# Exemplo de Combate e Dano\n\nNesta cena, ameaças forçam um grupo de aventureiros a entrar em combate. Este exemplo demonstra o fluxo de combate por turnos, onde cada jogador tem a oportunidade de detalhar suas ações durante os momentos decisivos de uma batalha.\n\n*Abaixo do Castelo Ravenloft, os personagens entram em combate!*\n\n**Jairo (como Mestre):** Um líquen amarelo cobre o teto desta passagem, que possui alcovas em ambos os lados.\n\n**Rubens:** Eu dou uma olhada nas alcovas mais próximas.\n\n**Jairo:** Elas contêm restos esqueléticos humanos. O silêncio é subitamente quebrado pelo som de ossos se movendo, enquanto os esqueletos se levantam ao seu redor, prontos para atacar!\n\n**Rubens:** Ah! Quantos esqueletos?\n\n**Jairo:** São dez ao todo, e estão hostis. Joguem Iniciativa!\n\n**Rubens:** Dez esqueletos? Caramba! Eu consegui um 16.\n\n**Eva (como Mirabella):** Eu tirei 8.\n\n**Philip (como Gareth):** Gareth tirou um incrível 2.\n\n**Amanda (como Auro):** Consegui um 19!\n\n**Jairo:** O ladino reage rapidamente — mas não tão rápido quanto os esqueletos! Eles tiraram 20. Os primeiros quatro atacam a pessoa que está na frente: Shreeve.\n\n**Rubens:** Ai, ai.\n\n**Jairo:** As jogadas de ataque deles foram 8, 16, 18 e 20.\n\n**Rubens:** O 8 e o 16 não atingem minha CA, mas os outros acertam.\n\n**Jairo:** Dois deles te acertam com lâminas quebradas, causando um total de 9 de dano Perfurante.\n\n**Rubens:** Isso é o melhor que eles podem fazer?\n\n**Felipe:** Nunca diga isso ao Mestre.\n\n**Jairo:** Heh. Agora, dois deles atacam Auro. O primeiro tira um 1 natural — uma falha crítica. O segundo tira 16.\n\n**Amanda:** Esse acerta.\n\n**Jairo:** Você sofre 4 de dano Perfurante, e um deles ataca Mirabella com um 14.\n\n**Eva:** Esse pega. Não, espera! Eu conjuro *Escudo Arcano*, então erra.\n\n**Jairo:** A lâmina do esqueleto ricocheteia na sua barreira de energia mágica. Em seguida, dois deles atacam Gareth. Um erra com 5, mas o outro acerta com 21, causando 7 de dano Perfurante.\n\n**Felipe:** Isso chamou minha atenção!\n\n**Jairo:** Foram nove ataques. Há mais um esqueleto no fim do corredor. Ele avança e espera por uma oportunidade. Agora é o turno de Auro.\n\n**Amanda:** Eu ataco um que está perto de mim. Com 24 acerta?\n\n**Jairo:** Com certeza acerta!\n\n**Amanda:** E ele está próximo de um dos meus aliados, certo?\n\n**Jairo:** Sim.\n\n**Amanda:** Então, com meu Ataque Furtivo, dá 22 de dano!\n\n**Jairo:** Sua lâmina desliza para uma órbita ocular vazia, e o esqueleto cai no chão, agora inanimado e inofensivo.\n\n**Amanda:** Em seguida, uso Ação Ardilosa para Desengajar como uma Ação Bônus e me afasto 6 metros do combate.\n\n**Jairo:** Muito bem. Shreeve?\n\n**Rubens:** Eu largo minha espada e pego meu Martelo de Guerra. Hora de quebrar alguns ossos! Meu primeiro golpe atinge com 21 e causa 7 de dano Contundente.\n\n-   **Iniciando o Combate.** Enquanto descreve a movimentação dos esqueletos, o Mestre se prepara para iniciar o combate, refletindo sobre a posição de todos, consultando o mapa da área e a ordem de marcha do grupo.\n-   **Jogando Iniciativa.** O próximo passo no combate é todos os envolvidos jogarem a Iniciativa.\n-   **Realizando Turnos.** Agora, cada participante da batalha realiza um turno na ordem de Iniciativa. Os esqueletos agem primeiro porque tiveram a maior Iniciativa: 20.\n-   **Jogadas de Ataque.** Quando uma criatura ataca, seja brandindo uma espada ou disparando uma flecha, o jogador realiza uma jogada de ataque. Se o resultado for igual ou superior à Classe de Armadura (CA) do alvo, o ataque acerta.\n-   **Magias e Reações.** Mirabella conjura a magia *Escudo Arcano*. Esta magia possui uma propriedade especial que permite que seja conjurada mesmo fora do turno da conjuradora, utilizando sua Reação (veja “Ações” anteriormente neste capítulo).\n-   **Habilidades Especiais.** O Ataque Furtivo de Auro permite que ele cause dano adicional aos esqueletos, sua Ação Ardilosa permite a ele Desengajar como uma Ação Bônus. Essas são características de classe (descritas no capítulo 3) que permitem aos personagens adaptarem às regras.\n-   **Vulnerabilidade.** Um ataque que causa dano Contundente é letal para esqueletos. Sabendo disso por experiência, Shreeve abandona a espada e opta por uma arma Contundente. Ela causa apenas 7 pontos de dano, mas o Mestre sabe que o esqueleto realmente sofre 14 pontos de dano.\n\n    **Jairo:** Ele tenta bloquear seu golpe, mas a força do impacto destrói o esqueleto!\n\n    **Rubens:** Eu ataco o próximo esqueleto com 11 na jogada de ataque.\n\n    **Jairo:** O esqueleto esquiva-se, saindo do alcance do golpe.\n\n    **Rubens:** Droga. Esse foi meu turno.\n\n    **Jairo:** Mirabella?\n\n    **Eva:** Quantos consigo acertar em um Cubo de 4,5 metros?\n\n    **Jairo:** Três, se você não quiser acertar Shreeve também.\n\n    **Eva:** Provavelmente é o melhor. Eu conjuro *Onda Trovejante* nesses três, gastando espaço de magia de 2º Círculo. Então, há um estrondo alto e uma onda trovejante forte varre os esqueletos. Eles precisam realizar salvaguardas de Constituição CD 15.\n\n    **Jairo:** Todos eles falham!\n\n    **Eva:** Como usei um espaço de 2 Círculo, isso causa 15 de dano Trovejante, e eles são empurrados 3 metros de distância.\n\n    **Jairo:** Eles são empurrados para trás e despedaçados.\n\n    **Eva:** Excelente! Quatro já foram, faltam seis.\n\n    **Jairo:** E finalmente é o turno do Gareth!\n\n    **Felipe:** Quantos deles estão a menos de 9 metros de mim?\n\n    **Jairo:** Todos os seis.\n\n    **Felipe:** Eu ergo meu Símbolo Sagrado e peço a Pelor, o Sol Sagrado, que queime esses esqueletos. Eles precisam realizar salvaguardas de Sabedoria CD 15.\n\n    **Jairo (jogando):** Ah, esses não são bons números. Nenhum deles chegou nem perto.\n\n    **Felipe:** Cada um deles sofre 18 de dano Radiante e —\n\n    **Jairo:** Deixe o “e” de lado. Pelor realmente fulmina esses esqueletos! Eles ficam visíveis por um instante em um clarão de luz ofuscante, e então desaparecem, deixando apenas suas espadas quebradas.\n\n-   **Área de Efeito.** No jogo, magias e vários outros efeitos preenchem uma área específica, conforme as regras, como o Cubo de 4,5 metros da magia *Onda Trovejante*. Veja o glossário de regras para mais detalhes sobre áreas de efeito.\n\n    **Salvaguarda.** Os esqueletos realizam salvaguardas de Constituição para resistir à magia *Onda Trovejante*. Quando falham, eles sofrem dano e são empurrados, conforme definido na descrição dessa magia.\n\n-   **Dano e Pontos de Vida.** Os esqueletos possuem 13 Pontos de Vida cada, então as magias e ataques neste exemplo causam dano suficiente para destruí-los. Se uma magia ou ataque causasse menos de 13 pontos de dano, o Mestre acompanharia o dano que cada esqueleto sofreu até que fosse reduzido a 0 Pontos de Vida e, consequentemente, destruído.\n-   **Salvaguarda.** O *Destruir Mortos-vivos* de Gareth é uma caraterística de classe (veja o capítulo 3). Assim como a magia *Onda Trovejante* de Mirabella, *Destruir Mortos-Vivos* força os esqueletos a realizarem uma salvaguarda."
}